name,speciality,hospital,city,timestamp
"dr. Yohanes Runtung, Sp.THT-KL",Sp. THT,Siloam Hospitals Lippo Cikarang,"Cikarang Selatan, Kabupaten Bekasi",2025-05-23 11:32:58
dr. YohanesYan Runtung Sp. THT,Sp. THT,RS Pelabuhan Jakarta Utara,"Koja, Jakarta Utara",2025-05-23 11:33:00
"dr. Yohanis Yan Runtung, Sp.THT-KL",Sp. THT,Siloam Hospitals Agora,"Cempaka Putih, Jakarta Pusat",2025-05-23 11:33:00
dr Yohanis Yan Rutungan Sp. THT,Sp. THT,RS Pelabuhan Jakarta Utara,"Koja, Jakarta Utara",2025-05-23 11:33:00
"dr. Yosa Meyla Puar, Sp.THT",Sp. THT,Eka Hospital Bekasi,"Tarumajaya, Kabupaten Bekasi",2025-05-23 11:33:00
Dr. Yosi Oktarina Sp. THT,Sp. THT,Alia Hospital Depok,"Pancoran Mas, Depok",2025-05-23 11:33:00
"dr. Yuan Ariawan Kusuma, Sp.THT-KL",Sp. THT,Siloam Hospitals Surabaya,"Gubeng, Kota Surabaya",2025-05-23 11:33:00
"Dr. Yulialdi Bimanto Heriyanto Putra, SpTHT",Sp. THT,RS Mitra Plumbon Cibitung,"Cibitung, Kabupaten Bekasi",2025-05-23 11:33:00
dr. Yunandi Alfandi Sp. THT-KL,Sp. THT,Mandaya Hospital Karawang,"Telukjambe Timur, Kabupaten Karawang",2025-05-23 11:33:00
"dr. Yurni, Sp.THT-KL",Sp. THT,Siloam Hospitals Silampari (Lubuk Linggau),"Lubuk Linggau Timur I, Kota Lubuk Linggau",2025-05-23 11:33:00
"DR. Dr. Yussy Afriani Dewi, M.Kes, Sp.THT-KL(K), FICS",Sp. THT,Mayapada Hospital Bandung,"Bandung Kidul, Kota Bandung",2025-05-23 11:33:00
dr. Zainal Adhim Sp. THT,Sp. THT,RS Pondok Indah - Pondok Indah,"Kebayoran Lama, Jakarta Selatan",2025-05-23 11:33:02
"dr. Zanil Musa, Sp. THT - KL (K)",Sp. THT,RS Khusus THT Ciranjang,"Kebayoran Baru, Jakarta Selatan",2025-05-23 11:33:02
dr. Zulkarnain Hidayat Sp.THT-KL,Sp. THT,Siloam Hospitals Putera Bahagia Cirebon,"Harjamukti, Kota Cirebon",2025-05-23 11:33:02
"dr. Zulkarnain Hidayat, Sp.THT-KL",Sp. THT,Siloam Hospitals Putera Bahagia Cirebon,"Harjamukti, Kota Cirebon",2025-05-23 11:33:02
"dr Zulrafli, Sp.THT-KL",Sp. THT,RS Bayukarta,"Karawang Barat, Kabupaten Karawang",2025-05-23 11:33:02
"dr. Aji Kusuma, SpTHT-BKL",Sp. THT,RS. Hamori,"Pagaden, Kabupaten Subang",2025-05-23 11:33:02
"dr. Asti Kristiani, Sp.THT",Sp. THT,Klinik Jaya Abadi,"Lengkong, Kota Bandung",2025-05-23 11:33:02
"dr. Bambang Sudiratama, Sp.THT",Sp. THT,RS Allam Medica,"Bumiayu, Kabupaten Brebes",2025-05-23 11:33:02
"dr. Bondn Herwindo, SpTHT-KL",Sp. THT,RSIA Kemang Medical Care,"Pasar Minggu, Jakarta Selatan",2025-05-23 11:33:02
"dr. Budi Santoso, Sp.THT-KL",Sp. THT,RSIA Tumbuh Kembang,"Cimanggis, Depok",2025-05-23 11:33:02
dr. Dewi Pratiwi Sp. THT,Sp. THT,RS dr. OEN Kandang Sapi Solo,"Jebres, Kota Surakarta",2025-05-23 11:33:04
"dr. Didin Komarudin Hidayat, SpTHTKL, Mkes",Sp. THT,RSPKT Prima Sangatta,"Sangatta Utara, Kabupaten Kutai Timur",2025-05-23 11:33:04
"dr. Endang Puspitowati, Sp.THT",Sp. THT,RS Petrokimia Gresik,"Gresik, Kabupaten Gresik",2025-05-23 11:33:04
Dr. dr. Fikri Mirza Putraito Sp.THT,Sp. THT,RSK THT - Bedah Proklamasi,"Menteng, Jakarta Pusat",2025-05-23 11:33:04
"dr. Ines Camilla Putri, Sp.THT-BKL",Sp. THT,RS Syarif Hidayatullah,"Ciputat Timur, Tangerang Selatan",2025-05-23 11:33:04
"dr. Khaeruddin, Sp.THT",Sp. THT,RS Otak & Jantung Pertamina Royal Biringkanaya,"Biringkanaya, Kota Makassar",2025-05-23 11:33:04
"dr. Krisna Dini S, Sp.THT-KL",Sp. THT,RSIA Cahaya Bunda,"Kesambi, Kota Cirebon",2025-05-23 11:33:04
"dr. Lely Mariana Wdjaya, SpTHT-KL",Sp. THT,RSK THT - Bedah KL Proklamasi BSD,"Serpong, Tangerang Selatan",2025-05-23 11:33:04
dr. Lia Natalia Sp. THT,Sp. THT,Tzu Chi Hospital,"Penjaringan, Jakarta Utara",2025-05-23 11:33:04
"dr. M. Tauhid, SpTHT",Sp. THT,RS Permata Jonggol,"Jonggol, Kabupaten Bogor",2025-05-23 11:33:04
"dr. Mochamad Iqbal, Sp.THT, BKL",Sp. THT,RSK THT - Bedah Proklamasi,"Menteng, Jakarta Pusat",2025-05-23 11:33:07
Dr. dr. Nova Pleter Sp THT,Sp. THT,Klinik Ratulangi Medical Center,"Ujung Pandang, Kota Makassar",2025-05-23 11:33:07
"dr. Odhi Anggani, SpTHT-KL",Sp. THT,Siloam Hospitals Yogyakarta,"Gondokusuman, Kota Yogyakarta",2025-05-23 11:33:07
"dr. Ratna Sari, Sp.THT",Sp. THT,RSU St. Elisabeth Purwokerto,"Purwokerto Timur, Kabupaten Banyumas",2025-05-23 11:33:07
"dr. Ricky Yue, Sp.THT",Sp. THT,RS Pondok Indah - Puri Indah,"Kembangan, Jakarta Barat",2025-05-23 11:33:07
"dr. Shally Adhina Putri, Sp.THT-KL",Sp. THT,RS Khusus Bedah SS Medika,"Senen, Jakarta Pusat",2025-05-23 11:33:07
"dr. Sita Asri, Sp.THT",Sp. THT,RS Puri Cinere,"Cinere, Depok",2025-05-23 11:33:07
"dr. Sri Susilawati, Sp.THT-KL",Sp. THT,Mayapada Hospital Tangerang,"Tangerang, Tangerang",2025-05-23 11:33:07
"dr. Stephani Linggawan, Sp.THT-KL",Sp. THT,RS Adi Husada Undaan Wetan,"Genteng, Kota Surabaya",2025-05-23 11:33:07
"dr. Trisa Gustania,Sp.THT",Sp. THT,RS Bhakti Yudha,"Pancoran Mas, Depok",2025-05-23 11:33:07
"dr. Yuwan Pradana, Sp.THT-KL",Sp. THT,RS Restu Ibu Balikpapan,"Balikpapan Tengah, Kota Balikpapan",2025-05-23 11:33:09
"dr. Zainal Adhim, Sp.THT-KL",Sp. THT,RS Pondok Indah - Pondok Indah,"Kebayoran Lama, Jakarta Selatan",2025-05-23 11:33:09
"dr.Alfian, Sp.THT-KL",Sp. THT,RS PIK,"Penjaringan, Jakarta Utara",2025-05-23 11:33:09
"dr.Sofia Tiarini, Sp.THT",Sp. THT,RS Semen Gresik,"Gresik, Kabupaten Gresik",2025-05-23 11:33:09
dr. Abdul Rachman Sp. THT-KL,Sp. THT,halodoc,"Setiabudi, Jakarta Selatan",2025-05-23 11:33:09
Dr. Aditiya Yuda Perkasa Alam Simbolon Sp.THT-KL,Sp. THT,halodoc,"Setiabudi, Jakarta Selatan",2025-05-23 11:33:09
"Dr. Aditya Leonard Tandio MPH, Sp.THT-BKL",Sp. THT,halodoc,"Setiabudi, Jakarta Selatan",2025-05-23 11:33:09
Dr. Adya Arradikha Sp.THT-KL,Sp. THT,halodoc,"Setiabudi, Jakarta Selatan",2025-05-23 11:33:09
dr. Adya arradhika Sp.THT,Sp. THT,halodoc,"Setiabudi, Jakarta Selatan",2025-05-23 11:33:09
Dr. Agriyana Sp.THT-BKL,Sp. THT,halodoc,"Setiabudi, Jakarta Selatan",2025-05-23 11:33:09
Dr. Agustinus Betha Devito Sp.THT-BKL,Sp. THT,halodoc,"Setiabudi, Jakarta Selatan",2025-05-23 11:33:11
"dr. Agustinus Sony Yudianto, Sp.THT-KL",Sp. THT,Siloam Hospitals Balikpapan,"Balikpapan Selatan, Kota Balikpapan",2025-05-23 11:33:11
Dr. Aksimitayani Sp.THT-BKL,Sp. THT,halodoc,"Setiabudi, Jakarta Selatan",2025-05-23 11:33:11
"Dr. Alfira Ulfa Sp.THT-BKL, FICS",Sp. THT,halodoc,"Setiabudi, Jakarta Selatan",2025-05-23 11:33:11
"dr. Amelia Dian Utami, SpTHT",Sp. THT,KLINIK SYAMSINAR MAROS,"Bontoa, Kabupaten Maros",2025-05-23 11:33:11
"Dr. Amrollah Latupono Sp.THT-BKL, MARS",Sp. THT,halodoc,"Setiabudi, Jakarta Selatan",2025-05-23 11:33:11
Dr. Andil Mulya Sp.THT-BKL,Sp. THT,halodoc,"Setiabudi, Jakarta Selatan",2025-05-23 11:33:11
Dr. Anggie Mutmainnah Sp.THT-KL,Sp. THT,halodoc,"Setiabudi, Jakarta Selatan",2025-05-23 11:33:11
"dr. Angie Renatha, SpTHT",Sp. THT,halodoc,"Setiabudi, Jakarta Selatan",2025-05-23 11:33:11
Dr. Anton Hilman Sp.THT-BKL,Sp. THT,halodoc,"Setiabudi, Jakarta Selatan",2025-05-23 11:33:11
Dr. Arif Surgana Sp.THT-BKL,Sp. THT,halodoc,"Setiabudi, Jakarta Selatan",2025-05-23 11:33:13
Dr. Aryo Mandraguna W Sp.THT-BKL,Sp. THT,halodoc,"Setiabudi, Jakarta Selatan",2025-05-23 11:33:13
dr. Asnomi Nanda SP. THT,Sp. THT,RSAU Dr. Esnawan Antariksa,"Makasar, Jakarta Timur",2025-05-23 11:33:13
dr. Ayunita Tri Wirattami Sp.THT-KL,Sp. THT,halodoc,"Setiabudi, Jakarta Selatan",2025-05-23 11:33:13
dr. Aziza Viquisa Berliana Putri Sp.THT-KL,Sp. THT,halodoc,"Setiabudi, Jakarta Selatan",2025-05-23 11:33:13
"Dr. Azmeilia Syafitri Lubis Sp.THT-BKL,M.Ked(ORL-HNS)",Sp. THT,halodoc,"Setiabudi, Jakarta Selatan",2025-05-23 11:33:13
dr Bagus Harning Efrianto Sp. THT,Sp. THT,halodoc,"Setiabudi, Jakarta Selatan",2025-05-23 11:33:13
"Prof. dr. Bambang Hermani, Sp.THT-KL(K)",Sp. THT,RS St. Carolus Salemba,"Senen, Jakarta Pusat",2025-05-23 11:33:13
"dr. Bastu Edo Sp.THT-KL, FICS",Sp. THT,halodoc,"Setiabudi, Jakarta Selatan",2025-05-23 11:33:13
"dr. Carlo Maulana Akbar M.Ked(ORL-HNS), Sp.THT-KL",Sp. THT,halodoc,"Setiabudi, Jakarta Selatan",2025-05-23 11:33:13
"Dr. Cut Elvira Novita M.Ked(ORL-HNS),Sp.THT-BKL",Sp. THT,halodoc,"Setiabudi, Jakarta Selatan",2025-05-23 11:33:15
DATUK DR KULJIT SINGH,Sp. THT,halodoc,"Setiabudi, Jakarta Selatan",2025-05-23 11:33:15
dr. Daniel Abdi Wicaksana Sp. THT,Sp. THT,halodoc,"Setiabudi, Jakarta Selatan",2025-05-23 11:33:15
Dr. Darmayanti Sp.THT-BKL,Sp. THT,halodoc,"Setiabudi, Jakarta Selatan",2025-05-23 11:33:15
"dr. Deden Wahnadian Sobarna M.Kes, Sp.THT-KL",Sp. THT,halodoc,"Setiabudi, Jakarta Selatan",2025-05-23 11:33:15
Dr. Delva Swanda Sp.THT-KL,Sp. THT,halodoc,"Setiabudi, Jakarta Selatan",2025-05-23 11:33:15
Dr. Deni Harapan Sp.THT-KL,Sp. THT,halodoc,"Setiabudi, Jakarta Selatan",2025-05-23 11:33:15
Dr. Denis Anugrah O Sp.THT-BKL,Sp. THT,halodoc,"Setiabudi, Jakarta Selatan",2025-05-23 11:33:15
Dr. Dewi Gemala Wahab Sp.THT-BKL,Sp. THT,halodoc,"Setiabudi, Jakarta Selatan",2025-05-23 11:33:15
Dr. Dewi Susilowati Sp.THT-KL,Sp. THT,halodoc,"Setiabudi, Jakarta Selatan",2025-05-23 11:33:15
Dr. Dewi Yulianti Sp.THT-KL,Sp. THT,halodoc,"Setiabudi, Jakarta Selatan",2025-05-23 11:33:17
Dr. Dewi Yulianti Sp. THT,Sp. THT,halodoc,"Setiabudi, Jakarta Selatan",2025-05-23 11:33:17
Dr. Dhini Vien Arista Sp.THT-BKL,Sp. THT,halodoc,"Setiabudi, Jakarta Selatan",2025-05-23 11:33:17
dr. Dina Putri Nasution Sp.THT-KL,Sp. THT,RS St. Carolus Salemba,"Senen, Jakarta Pusat",2025-05-23 11:33:17
dr. Dina Putri Nasution Sp.THT-KL,Sp. THT,RS St. Carolus Salemba,"Senen, Jakarta Pusat",2025-05-23 11:33:17
dr. Dina Putri Nasution Sp.THT-KL,Sp. THT,RS St. Carolus Salemba,"Senen, Jakarta Pusat",2025-05-23 11:33:17
dr. Dina Putri Nasution Sp.THT-KL,Sp. THT,RS St. Carolus Salemba,"Senen, Jakarta Pusat",2025-05-23 11:33:17
dr. Dina Putri Nasution Sp.THT-KL,Sp. THT,RS St. Carolus Salemba,"Senen, Jakarta Pusat",2025-05-23 11:33:17
dr. Dina Putri Nasution Sp.THT-KL,Sp. THT,RS St. Carolus Salemba,"Senen, Jakarta Pusat",2025-05-23 11:33:17
dr. Dina Putri Nasution Sp.THT-KL,Sp. THT,RS St. Carolus Salemba,"Senen, Jakarta Pusat",2025-05-23 11:33:17
"dr. Dina Putri, Sp.THT-KL",Sp. THT,RS St. Carolus Salemba,"Senen, Jakarta Pusat",2025-05-23 11:33:19
dr. Dini Anggreini Sp.THT-KL,Sp. THT,halodoc,"Setiabudi, Jakarta Selatan",2025-05-23 11:33:19
Dr. Dini Novianti Sp.THT-KL,Sp. THT,halodoc,"Setiabudi, Jakarta Selatan",2025-05-23 11:33:19
Dr. H. Donny Hendriyanto Sp.THT-KL,Sp. THT,halodoc,"Setiabudi, Jakarta Selatan",2025-05-23 11:33:19
Dr Didin Komarudin Hdayat Sp.THT,Sp. THT,RS Pupuk Kaltim Prima Sangatta,"Sangatta Utara, Kabupaten Kutai Timur",2025-05-23 11:33:19
Dr. Zuraidah Nasution Sp.THT-KL,Sp. THT,halodoc,"Setiabudi, Jakarta Selatan",2025-05-23 11:33:19
DR. EE YUIN SU,Sp. THT,Praktek dokter.,"Bukit Raya, Kota Pekanbaru",2025-05-23 11:33:19
Dr. Edward S. P. Sembiring Sp.THT-BKL,Sp. THT,halodoc,"Setiabudi, Jakarta Selatan",2025-05-23 11:33:19
dr. Eka Putra Setiawan Sp. THT,Sp. THT,"Praktek Dr.DG.Arta Eka Putra Sp, THT","Denpasar Selatan, Kota Denpasar",2025-05-23 11:33:19
Dr. Eka Utami Makmur Sp.THT-KL,Sp. THT,halodoc,"Setiabudi, Jakarta Selatan",2025-05-23 11:33:19
"Dr. Emil Kardani Murdiyanto Sp.THT-BKL, M.Biomed",Sp. THT,halodoc,"Setiabudi, Jakarta Selatan",2025-05-23 11:33:22
Dr. Endah Setiani Triastuti Sp.THT-BKL,Sp. THT,halodoc,"Setiabudi, Jakarta Selatan",2025-05-23 11:33:22
dr Endang Suherlan Sp. THT-KL,Sp. THT,halodoc,"Setiabudi, Jakarta Selatan",2025-05-23 11:33:22
"dr. Erica Lukman, Sp.THT-KL",Sp. THT,Siloam Hospitals Balikpapan,"Balikpapan Selatan, Kota Balikpapan",2025-05-23 11:33:22
Dr. Erlina Sp.THT-KL,Sp. THT,halodoc,"Setiabudi, Jakarta Selatan",2025-05-23 11:33:22
Dr. Erna M. Marbun Sp.THT,Sp. THT,Klinik dr Erna S,"Senen, Jakarta Pusat",2025-05-23 11:33:22
"dr. Erwinantyo B, Sp.THT-KL",Sp. THT,halodoc,"Setiabudi, Jakarta Selatan",2025-05-23 11:33:22
Dr. Eunike Lay Sp.THT-BKL,Sp. THT,halodoc,"Setiabudi, Jakarta Selatan",2025-05-23 11:33:22
Dr. Eva Susanti Sp. THT,Sp. THT,dr. Eva Susanti SpTHT,"Cempaka Putih, Jakarta Pusat",2025-05-23 11:33:22
dr. Fahmi Attaufany Sp.THT-KL,Sp. THT,halodoc,"Setiabudi, Jakarta Selatan",2025-05-23 11:33:22
dr. Fahmi Attaufany Sp.THT-KL,Sp. THT,halodoc,"Setiabudi, Jakarta Selatan",2025-05-23 11:33:24
dr. Fahmi Novel,Sp. THT,Klinik Utama Dipta,"Cempaka Putih, Jakarta Pusat",2025-05-23 11:33:24
"dr. Fairuz, SP.THT-KL",Sp. THT,halodoc,"Setiabudi, Jakarta Selatan",2025-05-23 11:33:24
Dr. Fany Dyah Rahmawati Sp.THT-KL,Sp. THT,halodoc,"Setiabudi, Jakarta Selatan",2025-05-23 11:33:24
dr. Febri Arianto Bayu Sp.THT-KL,Sp. THT,halodoc,"Setiabudi, Jakarta Selatan",2025-05-23 11:33:24
Dr. Ferawati Sp.THT-BKL,Sp. THT,halodoc,"Setiabudi, Jakarta Selatan",2025-05-23 11:33:24
Dr. Feri Trihandoko Sp.THT-KL,Sp. THT,halodoc,"Setiabudi, Jakarta Selatan",2025-05-23 11:33:24
"Dr. Fezzan Athama Fuadi Sp.THT-BKL, FICS",Sp. THT,halodoc,"Setiabudi, Jakarta Selatan",2025-05-23 11:33:24
dr. Fikri Mirza Putranto Sp. THT-KL (K),Sp. THT,RSIJ Cempaka Putih,"Cempaka Putih, Jakarta Pusat",2025-05-23 11:33:24
dr. Fikry Hamdan Yasin Sp.THT,Sp. THT,halodoc,"Setiabudi, Jakarta Selatan",2025-05-23 11:33:24
dr. Fikry Hamdan Yasin Sp. THT,Sp. THT,halodoc,"Setiabudi, Jakarta Selatan",2025-05-23 11:33:26
Dr. Finna Christianty Sp.THT-BKL,Sp. THT,halodoc,"Setiabudi, Jakarta Selatan",2025-05-23 11:33:26
Dr. Fiqih Fakhriana Kartini Sp.THT-BKL,Sp. THT,halodoc,"Setiabudi, Jakarta Selatan",2025-05-23 11:33:26
Dr. Fira Sofia Sp.THT-BKL,Sp. THT,halodoc,"Setiabudi, Jakarta Selatan",2025-05-23 11:33:26
Dr. Foppi Puspitasari Sp.THT-BKL,Sp. THT,halodoc,"Setiabudi, Jakarta Selatan",2025-05-23 11:33:26
dr. Friska Meutia Lubis Sp.THT-KL,Sp. THT,halodoc,"Setiabudi, Jakarta Selatan",2025-05-23 11:33:26
dr. Genggam Sp.THT,Sp. THT,halodoc,"Setiabudi, Jakarta Selatan",2025-05-23 11:33:26
"dr. Gunawan Kurnaedi, Sp.THT-KL",Sp. THT,"dr. Gunawan Effendi, Sp.THT-KL","Tarogong Kidul, Kabupaten Garut",2025-05-23 11:33:26
"dr. Guntur Bayu Bima Pratama, SpTHT",Sp. THT,halodoc,"Setiabudi, Jakarta Selatan",2025-05-23 11:33:26
"dr. H. Bogi Seoseno, Sp.THT-KL",Sp. THT,Apotek Bona Farma,"Cidadap, Kota Bandung",2025-05-23 11:33:26
"Prof. Dr. Dr. H. Iwin Sumarman, Sp THT-KL",Sp. THT,"Praktek Dokter Prof. Dr. Dr. H. Iwin Sumarman, Sp THT-KL","Bandung Wetan, Kota Bandung",2025-05-23 11:33:28
Dr. Hana Listyani Koentjoro Sp.THT-KL,Sp. THT,halodoc,"Setiabudi, Jakarta Selatan",2025-05-23 11:33:28
dr. Hana Listyani Koentjoro Sp.THT-KL,Sp. THT,APOTIK SUMBER REZEKI FARMA,"Kebayoran Lama, Jakarta Selatan",2025-05-23 11:33:28
Dr. Hanski R.P Legranssp Sp. THT,Sp. THT,KLINIK KIMIA FARMA KOTAMOBAGU,"Kotamobagu Barat, Kota Kotamobagu",2025-05-23 11:33:28
Dr. Hari Pranoto Sp.THT-BKL,Sp. THT,halodoc,"Setiabudi, Jakarta Selatan",2025-05-23 11:33:28
Dr. Harry Munggaran K. Sp.THT-KL,Sp. THT,halodoc,"Setiabudi, Jakarta Selatan",2025-05-23 11:33:28
dr Hartati Kusumawardani Sp.THT,Sp. THT,APOTEK JAYA,"Banjarmasin Barat, Kota Banjarmasin",2025-05-23 11:33:28
dr. Hartati Kusumawardani Sp.THT,Sp. THT,dr Hartati Kusumawardhani SpTHT,"Cempaka Putih, Jakarta Pusat",2025-05-23 11:33:28
Dr. Hasnan Habib Sp.THT-BKL,Sp. THT,halodoc,"Setiabudi, Jakarta Selatan",2025-05-23 11:33:28
Prof. dr. Helmi Sp.THT-KL,Sp. THT,halodoc,"Setiabudi, Jakarta Selatan",2025-05-23 11:33:28
Dr. Helta Tandi Sarira Sp.THT-KL,Sp. THT,halodoc,"Setiabudi, Jakarta Selatan",2025-05-23 11:33:30
Dr. Herdiansyah Sp.THT-BKL,Sp. THT,halodoc,"Setiabudi, Jakarta Selatan",2025-05-23 11:33:30
Dr. Hj Arina Ikasari Muhtadi Sp. THT,Sp. THT,halodoc,"Setiabudi, Jakarta Selatan",2025-05-23 11:33:30
"dr. Hj. Selvie Sira, Sp.THT",Sp. THT,Apotek Kimia Farma Antasari,"Samarinda Ulu, Kota Samarinda",2025-05-23 11:33:30
Dr. Hj. Sri Sophia Wahyuni Sp.THT,Sp. THT,Klinik Medika Farma,"Plumbon, Kabupaten Cirebon",2025-05-23 11:33:30
dr. I Dewa Made Sudiatmika Sp.THT-KL,Sp. THT,halodoc,"Setiabudi, Jakarta Selatan",2025-05-23 11:33:30
Dr. I Gede Wahyu Adi Raditya Sp.THT-KL,Sp. THT,halodoc,"Setiabudi, Jakarta Selatan",2025-05-23 11:33:30
Dr. I Made Rai Wiryadi Sp.THT-BKL,Sp. THT,halodoc,"Setiabudi, Jakarta Selatan",2025-05-23 11:33:30
Dr. I Nyoman Swardyana Sp.THT-BKL,Sp. THT,halodoc,"Setiabudi, Jakarta Selatan",2025-05-23 11:33:30
dr. I. Radian Sp.THT-KL,Sp. THT,halodoc,"Setiabudi, Jakarta Selatan",2025-05-23 11:33:30
Dr. I.B. Yudi Madiawan Sp. THT,Sp. THT,APOTEK INA FARMA,"Denpasar Barat, Kota Denpasar",2025-05-23 11:33:33
"dr. Ichsan Juliansyah Juanda, Sp.THT-KL",Sp. THT,RSUD AL IHSAN,"Baleendah, Kabupaten Bandung",2025-05-23 11:33:33
Dr. Ida Ayu Citra Pratiwi Sp.THT-BKL,Sp. THT,halodoc,"Setiabudi, Jakarta Selatan",2025-05-23 11:33:33
Dr. Idola Pratiwi Harianja Sp.THT-BKL,Sp. THT,halodoc,"Setiabudi, Jakarta Selatan",2025-05-23 11:33:33
dr. Indra Irawan Sp.THT,Sp. THT,RSUD dr. soetijono Blora,"Kota Blora, Kabupaten Blora",2025-05-23 11:33:33
Dr. Indra Setiawan Sp.THT-KL(K),Sp. THT,halodoc,"Setiabudi, Jakarta Selatan",2025-05-23 11:33:33
dr. Ira Agustine Mutiara Sp. THT-KL,Sp. THT,halodoc,"Setiabudi, Jakarta Selatan",2025-05-23 11:33:33
dr Iskandar Z Sp. THT,Sp. THT,RS Islam PKU Muhammadiyah Pekajangan Pekalongan,"Kedungwuni, Kabupaten Pekalongan",2025-05-23 11:33:33
Dr. Ivana Supit Sp.THT-BKL,Sp. THT,halodoc,"Setiabudi, Jakarta Selatan",2025-05-23 11:33:33
Dr. Jarod Wahyu Kristiyanto Sp.THT-BKL,Sp. THT,halodoc,"Setiabudi, Jakarta Selatan",2025-05-23 11:33:33
"dr. Jerry Tobing , MKED (ORL-HNS), Sp THT-KL",Sp. THT,halodoc,"Setiabudi, Jakarta Selatan",2025-05-23 11:33:35
dr. Johnny Harijanto Sp.THT,Sp. THT,Dr. Johnny Harjanto Sp THT KL,"Papar, Kabupaten Kediri",2025-05-23 11:33:35
dr. Johnny Harijanto Sp. THT,Sp. THT,Dr. Johnny Harjanto Sp THT KL,"Papar, Kabupaten Kediri",2025-05-23 11:33:35
dr. Johnny Harjanto Sp THT KL,Sp. THT,Dr. Johnny Harjanto Sp THT KL,"Papar, Kabupaten Kediri",2025-05-23 11:33:35
"dr. Johnny Harjanto, Sp. THT",Sp. THT,halodoc,"Setiabudi, Jakarta Selatan",2025-05-23 11:33:35
Dr. Julian Hartawan Wijaya Sp.THT-BKL,Sp. THT,halodoc,"Setiabudi, Jakarta Selatan",2025-05-23 11:33:35
"dr. Junicko Sacrifian Anoraga, Sp.THT-KL",Sp. THT,RS Dr Suyoto,"Pesanggrahan, Jakarta Selatan",2025-05-23 11:33:35
"dr. Junicko Sacrifian Anoraga, Sp.THT-KL",Sp. THT,RS Dr Suyoto,"Pesanggrahan, Jakarta Selatan",2025-05-23 11:33:35
"dr. Junicko Sacrifian Anoraga, Sp.THT-KL",Sp. THT,RS Dr Suyoto,"Pesanggrahan, Jakarta Selatan",2025-05-23 11:33:35
dr. Junico Stefanus Anargya Sp.THT,Sp. THT,RS Dr Suyoto,"Pesanggrahan, Jakarta Selatan",2025-05-23 11:33:35
"dr. Juriko Sacrifian Anoraga, Sp.THT-KL",Sp. THT,RS Dr Suyoto,"Pesanggrahan, Jakarta Selatan",2025-05-23 11:33:37
Dr. Kadek Agustina Sp.THT-BKL,Sp. THT,halodoc,"Setiabudi, Jakarta Selatan",2025-05-23 11:33:37
"Dr. Karina Witary Ayu Siagian Sp.THT-KL, M.Kes",Sp. THT,halodoc,"Setiabudi, Jakarta Selatan",2025-05-23 11:33:37
Dr. Ketut Tadeus Pinatih Sp.THT-BKL,Sp. THT,halodoc,"Setiabudi, Jakarta Selatan",2025-05-23 11:33:37
Dr. Khoirul A. Iriantoro Sp.THT-KL,Sp. THT,halodoc,"Setiabudi, Jakarta Selatan",2025-05-23 11:33:37
Dr. Kurniawaty Hesli Pratiwi Sp.THT-BKL,Sp. THT,halodoc,"Setiabudi, Jakarta Selatan",2025-05-23 11:33:37
"Dr. Laksito Wening Sp.THT-KL, M.Kes",Sp. THT,halodoc,"Setiabudi, Jakarta Selatan",2025-05-23 11:33:37
dr. Legawati Sihingo-Ringo Sp.THT,Sp. THT,halodoc,"Setiabudi, Jakarta Selatan",2025-05-23 11:33:37
Dr. Leny Megawati Sp.THT-BKL,Sp. THT,halodoc,"Setiabudi, Jakarta Selatan",2025-05-23 11:33:37
Dr Long Chin Wan,Sp. THT,halodoc,"Setiabudi, Jakarta Selatan",2025-05-23 11:33:37
dr. Lorensia Fitra Dwita Sp.THT-KL,Sp. THT,halodoc,"Setiabudi, Jakarta Selatan",2025-05-23 11:33:39
Dr. Luh Astriani Sp.THT-KL,Sp. THT,halodoc,"Setiabudi, Jakarta Selatan",2025-05-23 11:33:39
Dr. Luh Putu Happy Sandha Sp.THT-KL,Sp. THT,halodoc,"Setiabudi, Jakarta Selatan",2025-05-23 11:33:39
"Dr. Luh Witari Indrayani M.Biomed, Sp.THT-KL",Sp. THT,halodoc,"Setiabudi, Jakarta Selatan",2025-05-23 11:33:39
"dr. M Budi Caecarian Lubis, M.Ked (ORL-HNS), Sp. THT-KL",Sp. THT,"Logo Penjual Praktek THT dr M Budi Caecarian Lubis, M.Ked (ORL-HNS), Sp. THT-KL","Bekasi Selatan, Bekasi",2025-05-23 11:33:39
Dr. M Destrian Cossandra Sp.THT-KL,Sp. THT,halodoc,"Setiabudi, Jakarta Selatan",2025-05-23 11:33:39
dr. M. Budi C. Lubis Sp. THT-KL,Sp. THT,"Praktek THT dr M Budi Caecarian Lubis, M.Ked (ORL-HNS), Sp. THT-KL","Bekasi Selatan, Bekasi",2025-05-23 11:33:39
Dr. M. Fachreza Saputra Sp.THT-BKL,Sp. THT,halodoc,"Setiabudi, Jakarta Selatan",2025-05-23 11:33:39
dr. M. Gima Faizal Gani Sp.THT,Sp. THT,Apotik Idaman,"Taraju, Kabupaten Tasikmalaya",2025-05-23 11:33:39
Dr. Made Prani Windasari Sp.THT-BKL,Sp. THT,halodoc,"Setiabudi, Jakarta Selatan",2025-05-23 11:33:39
Dr. Made Rara Rusmala Dewi M. Sp.THT-KL,Sp. THT,halodoc,"Setiabudi, Jakarta Selatan",2025-05-23 11:33:41
"dr. Maesyara Adinda Sari M.Ked(ORL-HNS), Sp.THT-KL",Sp. THT,halodoc,"Setiabudi, Jakarta Selatan",2025-05-23 11:33:41
"dr. Maranatha Lumban Batu, Sp.THT-KL",Sp. THT,Siloam Hospitals Balikpapan,"Balikpapan Selatan, Kota Balikpapan",2025-05-23 11:33:41
Dr. Marisa Rizqiana Dewi Sp.THT-KL,Sp. THT,halodoc,"Setiabudi, Jakarta Selatan",2025-05-23 11:33:41
Dr. Marisa Rizqiana Dewi Sp THT-KL,Sp. THT,halodoc,"Setiabudi, Jakarta Selatan",2025-05-23 11:33:41
Dr. Mariska Regina Sp.THT-KL,Sp. THT,halodoc,"Setiabudi, Jakarta Selatan",2025-05-23 11:33:41
dr. Mattheos Lucky Haurissa Sp.THT,Sp. THT,RS Putra Waspada Tulungagung,"Kedungwaru, Kabupaten Tulungagung",2025-05-23 11:33:41
Dr. Maximiliano Agustian Mahardhika Sp.THT-BKL,Sp. THT,halodoc,"Setiabudi, Jakarta Selatan",2025-05-23 11:33:41
dr. Mei Risanti Sirait Sp.THT-KL,Sp. THT,halodoc,"Setiabudi, Jakarta Selatan",2025-05-23 11:33:41
dr. Meila Sutanti Sp.THT-KL,Sp. THT,RS St. Carolus Salemba,"Senen, Jakarta Pusat",2025-05-23 11:33:41
dr. Meilia Sutanti Sp.THT-KL,Sp. THT,RS St. Carolus Salemba,"Senen, Jakarta Pusat",2025-05-23 11:33:43
Dr. Merza M. Muzakkir Sp THT KL,Sp. THT,Apotek Zamzam,"Medan Kota, Kota Medan",2025-05-23 11:33:43
Dr. Mila Habibasari Sp.THT-KL,Sp. THT,halodoc,"Setiabudi, Jakarta Selatan",2025-05-23 11:33:43
Dr. Mohammad Lukmanul Hakim Winugroho Sp.THT-BKL,Sp. THT,halodoc,"Setiabudi, Jakarta Selatan",2025-05-23 11:33:43
Dr. Muhammad Anwar Sp.THT-KL,Sp. THT,halodoc,"Setiabudi, Jakarta Selatan",2025-05-23 11:33:43
dr. Muhammad Pringgo Arifianto Sp.THT-KL,Sp. THT,halodoc,"Setiabudi, Jakarta Selatan",2025-05-23 11:33:43
dr. Nies Endang Mangunkusumo Sp THT,Sp. THT,halodoc,"Setiabudi, Jakarta Selatan",2025-05-23 11:33:43
"Dr. Nugroho Suharsono, SP.THT-KL",Sp. THT,"Dr. Nugroho Suharsono, SP.THT-KL","Mojosari, Kabupaten Mojokerto",2025-05-23 11:33:43
Dr. Olvi Nancy Marimpan Sp.THT-BKL,Sp. THT,halodoc,"Setiabudi, Jakarta Selatan",2025-05-23 11:33:43
dr. Ong Awarudin Sp.THT,Sp. THT,halodoc,"Setiabudi, Jakarta Selatan",2025-05-23 11:33:43
dr. Ong warudin Sp.THT,Sp. THT,halodoc,"Setiabudi, Jakarta Selatan",2025-05-23 11:33:45
Dr. Orlena Dharmantary Kartika Sp.THT-KL,Sp. THT,0,"Bekasi Selatan, Bekasi",2025-05-23 11:33:45
Dr. Pande Made Indra Premana Sp.THT-BKL,Sp. THT,halodoc,"Setiabudi, Jakarta Selatan",2025-05-23 11:33:45
Dr. Pande Nyoman Bayu Tirtayasa Sp.THT-BKL,Sp. THT,halodoc,"Setiabudi, Jakarta Selatan",2025-05-23 11:33:45
dr. Pradhana F. Wicaksana Sp.THT-KL,Sp. THT,halodoc,"Setiabudi, Jakarta Selatan",2025-05-23 11:33:45
Prof Dr Teti Madiadipoera dr Sp THT-KL (K),Sp. THT,halodoc,"Setiabudi, Jakarta Selatan",2025-05-23 11:33:45
"Dr. Pudjo D. Laksono M.Kes, Sp.THT-KL, M.H",Sp. THT,halodoc,"Setiabudi, Jakarta Selatan",2025-05-23 11:33:45
Dr. Putri Arihtalia Br Purba Sp.THT-BKL,Sp. THT,halodoc,"Setiabudi, Jakarta Selatan",2025-05-23 11:33:45
dr. Putri Cita Sari Dewi Sp. THT- KL,Sp. THT,Praktek dr. Putri Citra Sari Sp.THT,"Bandongan, Kabupaten Magelang",2025-05-23 11:33:45
Dr. Putri Citra Sp.THT-KL,Sp. THT,halodoc,"Setiabudi, Jakarta Selatan",2025-05-23 11:33:45
dr. Putu Ayu Ines Sp.THT-KL,Sp. THT,Praktek dokter bersama-,"Ciawi, Kabupaten Bogor",2025-05-23 11:33:47
Dr. Putu Ayu Ines Lassiyani Surya Sp.THT-KL,Sp. THT,halodoc,"Setiabudi, Jakarta Selatan",2025-05-23 11:33:47
Dr. Putu Kanjeng Ayu Pringgandani Sp.THT-KL,Sp. THT,halodoc,"Setiabudi, Jakarta Selatan",2025-05-23 11:33:47
Dr. Rahmat Faradilla Sp.THTBKL,Sp. THT,halodoc,"Setiabudi, Jakarta Selatan",2025-05-23 11:33:47
dr. Rahmat Hidayat Sp.THT-KL,Sp. THT,halodoc,"Setiabudi, Jakarta Selatan",2025-05-23 11:33:47
Dr. Rahmi Surayya Sp.THT-BKL,Sp. THT,halodoc,"Setiabudi, Jakarta Selatan",2025-05-23 11:33:47
Dr. Rano Digdayan Makerto Sp.THT-BKL,Sp. THT,halodoc,"Setiabudi, Jakarta Selatan",2025-05-23 11:33:47
"dr. Ratna Widyaningrum, Sp.THT-BKL",Sp. THT,halodoc,"Setiabudi, Jakarta Selatan",2025-05-23 11:33:47
Dr. Ratna Windyaningrum Sp.THT-BKL,Sp. THT,halodoc,"Setiabudi, Jakarta Selatan",2025-05-23 11:33:47
Dr. Rika Caesaria Sp.THT-BKL,Sp. THT,halodoc,"Setiabudi, Jakarta Selatan",2025-05-23 11:33:47
"dr. Rimelda Aquinas, Sp.THT-KL",Sp. THT,halodoc,"Setiabudi, Jakarta Selatan",2025-05-23 11:33:50
"dr. Rina Desdwi, Sp.THT-KL",Sp. THT,Siloam Hospitals Banjarmasin,"Banjarmasin Tengah, Kota Banjarmasin",2025-05-23 11:33:50
Dr. Rini Kartika Dewi Sp.THT-KL,Sp. THT,halodoc,"Setiabudi, Jakarta Selatan",2025-05-23 11:33:50
"Dr. Riska Handriani Sp.THT-BKL, FICS",Sp. THT,halodoc,"Setiabudi, Jakarta Selatan",2025-05-23 11:33:50
dr. Risman Rais Sp.THT,Sp. THT,halodoc,"Setiabudi, Jakarta Selatan",2025-05-23 11:33:50
"Dr. Rissa Ardika Nasution M.Ked(ORL-HNS), Sp.THT",Sp. THT,halodoc,"Setiabudi, Jakarta Selatan",2025-05-23 11:33:50
Dr. Rizke Ayu Pujiati Sp.THT-BKL,Sp. THT,halodoc,"Setiabudi, Jakarta Selatan",2025-05-23 11:33:50
"dr. Rodrigo Limmon Sp.THT-KL, MARS",Sp. THT,halodoc,"Setiabudi, Jakarta Selatan",2025-05-23 11:33:50
Dr. Ronald Yohanes Febrianto Sp.THT-BKL,Sp. THT,halodoc,"Setiabudi, Jakarta Selatan",2025-05-23 11:33:50
Dr. Ronny M. Simanjuntak Sp. THT,Sp. THT,halodoc,"Setiabudi, Jakarta Selatan",2025-05-23 11:33:50
Dr. Rositania Manyang Budihardjo Sp.THT-BKL,Sp. THT,halodoc,"Setiabudi, Jakarta Selatan",2025-05-23 11:33:52
dr Roy David Sarumpaet Sp. THT-KL,Sp. THT,halodoc,"Setiabudi, Jakarta Selatan",2025-05-23 11:33:52
