name,speciality,hospital,city,timestamp
dr. Rully Satriawan Sp.THT-KL,Sp. THT,halodoc,"Setiabudi, Jakarta Selatan",2025-05-23 11:33:52
dr. Rully Satriawan Sp. THT-KL,Sp. THT,Graha Spesialis Metro,"Metro Pusat, Kota Metro",2025-05-23 11:33:52
"dr. Rusina Hayati, Sp.THT-KL",Sp. THT,Siloam Hospitals Banjarmasin,"Banjarmasin Tengah, Kota Banjarmasin",2025-05-23 11:33:52
dr. SRI MELLA TALA Sp THT KL,Sp. THT,"dr. SRI MELLA TALA, Sp.THT-KL","Medan Amplas, Kota Medan",2025-05-23 11:33:52
Dr. Sadri Yulius Sp.THT-BKL,Sp. THT,halodoc,"Setiabudi, Jakarta Selatan",2025-05-23 11:33:52
Dr. Sari Soeleiman Sp.THT-KL,Sp. THT,halodoc,"Setiabudi, Jakarta Selatan",2025-05-23 11:33:52
dr Selvie Sire Sp. THT BKL,Sp. THT,halodoc,"Setiabudi, Jakarta Selatan",2025-05-23 11:33:52
"dr. Shandi Ari Susanti, Sp.THT",Sp. THT,halodoc,"Setiabudi, Jakarta Selatan",2025-05-23 11:33:52
dr. Shierly Kurniawan Sp.THT-KL,Sp. THT,halodoc,"Setiabudi, Jakarta Selatan",2025-05-23 11:33:54
"dr. Sinta Sari, M.Kes. Sp.THT-KL",Sp. THT,Apotek Serumpun Bambu,"Cimahi Tengah, Kota Cimahi",2025-05-23 11:33:54
Dr. Suryantoko Sp.THT-KL,Sp. THT,halodoc,"Setiabudi, Jakarta Selatan",2025-05-23 11:33:54
Dr. Syahnidel Fita Sp.THT-KL,Sp. THT,halodoc,"Setiabudi, Jakarta Selatan",2025-05-23 11:33:54
Dr. Sylvia Sp.THT-BKL,Sp. THT,halodoc,"Setiabudi, Jakarta Selatan",2025-05-23 11:33:54
Dr. Tanto Sakti Hutama Sp.THT-BKL,Sp. THT,halodoc,"Setiabudi, Jakarta Selatan",2025-05-23 11:33:54
dr. Tantri Kurniawati Sp.THT,Sp. THT,halodoc,"Setiabudi, Jakarta Selatan",2025-05-23 11:33:54
dr. Tantri Kurniawati Sp. THT - KL,Sp. THT,halodoc,"Setiabudi, Jakarta Selatan",2025-05-23 11:33:54
"dr. Trini Melinda M.Ked(ORL-HNS), Sp.THT-KL",Sp. THT,halodoc,"Setiabudi, Jakarta Selatan",2025-05-23 11:33:54
dr. Ulfa Fitriyani Sp. THT,Sp. THT,RS SIAGA MEDIKA PEMALANG,"Pemalang, Kabupaten Pemalang",2025-05-23 11:33:54
dr. Unggul Amartio Sp.THT,Sp. THT,halodoc,"Setiabudi, Jakarta Selatan",2025-05-23 11:33:56
dr. Unggul Amriarto Sp.THT,Sp. THT,halodoc,"Setiabudi, Jakarta Selatan",2025-05-23 11:33:56
Dr. Viika Miftakhul Umami Sp.THT-KL,Sp. THT,halodoc,"Setiabudi, Jakarta Selatan",2025-05-23 11:33:56
Dr. Vithari Anna Sarambu Sp. THT-KL,Sp. THT,halodoc,"Setiabudi, Jakarta Selatan",2025-05-23 11:33:56
Dr. Wahyudi Sp.THT-KL,Sp. THT,halodoc,"Setiabudi, Jakarta Selatan",2025-05-23 11:33:56
Dr. Wahyudi Sp.THT-BKL,Sp. THT,halodoc,"Setiabudi, Jakarta Selatan",2025-05-23 11:33:56
dr. Wawan Siswadi Sp. THT,Sp. THT,halodoc,"Setiabudi, Jakarta Selatan",2025-05-23 11:33:56
Dr. Widia Isa Aprillia Sujana Sp.THT-BKL,Sp. THT,halodoc,"Setiabudi, Jakarta Selatan",2025-05-23 11:33:56
dr Widyana Mulyamin Sp THT,Sp. THT,Apotek Pelita Farma,"Cempaka Putih, Jakarta Pusat",2025-05-23 11:33:56
"dr. Wiliani Risnawati, Sp.THTBKL",Sp. THT,halodoc,"Setiabudi, Jakarta Selatan",2025-05-23 11:33:56
dr. Winulang S N Sp. THT,Sp. THT,Dr. Winulang S N Sp. THT,"Setiabudi, Jakarta Selatan",2025-05-23 11:33:58
dr Yan Wirayudha Sp. THT,Sp. THT,RS PKU Muhammadiyah Kartasura,"Kartasura, Kab Sukoharjo",2025-05-23 11:33:58
Dr. Yerni Karnita Sp.THT-KL,Sp. THT,halodoc,"Setiabudi, Jakarta Selatan",2025-05-23 11:33:58
"dr. Yosa Meyla Puar, Sp.THT",Sp. THT,halodoc,"Setiabudi, Jakarta Selatan",2025-05-23 11:33:58
dr. Yudistira Pratama Sp.THT-KL,Sp. THT,halodoc,"Setiabudi, Jakarta Selatan",2025-05-23 11:33:58
"Dr. Yunaldi Altila S.Ked, Sp.THT-BKL",Sp. THT,halodoc,"Setiabudi, Jakarta Selatan",2025-05-23 11:33:58
Dr. Yurnita Arifin Sp.THT-BKL,Sp. THT,halodoc,"Setiabudi, Jakarta Selatan",2025-05-23 11:33:58
de Emma Savitri SP.THT,Sp. THT,halodoc,"Setiabudi, Jakarta Selatan",2025-05-23 11:33:58
dr Eva Khristi Purbandini Sp.THT-KL,Sp. THT,halodoc,"Setiabudi, Jakarta Selatan",2025-05-23 11:33:58
dr Intan Kartika Nursyahbani Sp.THT -BKL,Sp. THT,halodoc,"Setiabudi, Jakarta Selatan",2025-05-23 11:33:58
dr Muhammad Akbar spTHT,Sp. THT,halodoc,"Setiabudi, Jakarta Selatan",2025-05-23 11:34:00
dr Sugeng Santoso Sp.THT.KL,Sp. THT,halodoc,"Setiabudi, Jakarta Selatan",2025-05-23 11:34:00
dr Sylvia THT,Sp. THT,halodoc,"Setiabudi, Jakarta Selatan",2025-05-23 11:34:00
dr Wardhani Sp.THT,Sp. THT,halodoc,"Setiabudi, Jakarta Selatan",2025-05-23 11:34:00
"dr. Agus Surono, SP.THT",Sp. THT,halodoc,"Setiabudi, Jakarta Selatan",2025-05-23 11:34:00
"dr. Bintari Nareswari, Sp.THT-BKL",Sp. THT,halodoc,"Setiabudi, Jakarta Selatan",2025-05-23 11:34:00
"dr. Diah Hayustiningsih, Sp.THT-KL",Sp. THT,halodoc,"Setiabudi, Jakarta Selatan",2025-05-23 11:34:00
dr. Dini Novianti SpTHT,Sp. THT,dr. Dini Novianti SpTHT,"Makasar, Jakarta Timur",2025-05-23 11:34:00
"dr. Dyah Astri Paramaramya, SP THT-BKL",Sp. THT,0,"Bekasi Selatan, Bekasi",2025-05-23 11:34:00
"dr. Fari Ananda Daud, M.Kes,Sp.THT-KL",Sp. THT,halodoc,"Setiabudi, Jakarta Selatan",2025-05-23 11:34:00
"dr. H. Gunawan D, SpTHT.MARS",Sp. THT,Klinik Pratama Al Masoem Putri Mandiri,"Setiabudi, Jakarta Selatan",2025-05-23 11:34:02
"dr. dr. Hendradi,S, Sp.THT.BKL(K)",Sp. THT,apotek kimia farma -,"Cihara, Kabupaten Lebak",2025-05-23 11:34:02
"dr. Indra Setiawan, Sp.THT",Sp. THT,halodoc,"Setiabudi, Jakarta Selatan",2025-05-23 11:34:02
"dr. Irfan, Sp.THT",Sp. THT,halodoc,"Setiabudi, Jakarta Selatan",2025-05-23 11:34:02
dr. Lisa Herminawaty S. Sp.T.H.T.B.K.L,Sp. THT,0,"Bekasi Selatan, Bekasi",2025-05-23 11:34:02
"dr. Muhammad Yoserizal,SpTHT",Sp. THT,RSUD BALARAJA,"Balaraja, Kabupaten Tangerang",2025-05-23 11:34:02
"dr. NUGROHO SUHARSONO, Sp.THT",Sp. THT,halodoc,"Setiabudi, Jakarta Selatan",2025-05-23 11:34:02
"dr. Nadhila Sharfina Pratiwi, Sp.THT-BKL",Sp. THT,halodoc,"Setiabudi, Jakarta Selatan",2025-05-23 11:34:02
"dr. Novi Padevi, Sp.THT.BKL",Sp. THT,halodoc,"Setiabudi, Jakarta Selatan",2025-05-23 11:34:02
"dr. Putu Ayu Ines Lassiyani Surya, Sp.THT-KL",Sp. THT,halodoc,"Setiabudi, Jakarta Selatan",2025-05-23 11:34:02
"dr. Rahmat Hidayat, Sp.THT-KL",Sp. THT,halodoc,"Setiabudi, Jakarta Selatan",2025-05-23 11:34:04
"dr. Regina Talitha Rosa, Sp.THT",Sp. THT,RS St. Carolus Salemba,"Senen, Jakarta Pusat",2025-05-23 11:34:04
"dr. Ronaldi Tumbel, SpTHT-KL",Sp. THT,halodoc,"Setiabudi, Jakarta Selatan",2025-05-23 11:34:04
dr. Widyana Mulyamin Sp THT,Sp. THT,Apotek Pelita Farma,"Cempaka Putih, Jakarta Pusat",2025-05-23 11:34:04
"dr. Yonlan, Sp.THT",Sp. THT,halodoc,"Setiabudi, Jakarta Selatan",2025-05-23 11:34:04
"dr.Aswaldi Ahmad,SpTHT",Sp. THT,"dr.Aswaldi Ahmad,SpTHT","Menteng, Jakarta Pusat",2025-05-23 11:34:04
"dr.Aswaldi Ahmad,SpTHT",Sp. THT,"dr.Aswaldi Ahmad,SpTHT","Menteng, Jakarta Pusat",2025-05-23 11:34:04
"dr.Roni Iskandar,SpTHT",Sp. THT,"dr.Roni Iskandar,SpTHT","Senen, Jakarta Pusat",2025-05-23 11:34:04
