name,speciality,hospital,city,timestamp
"dr. Raymond Ongkie, Sp.A",Sp. Anak,Siloam Hospitals Lippo Village,"Kelapa Dua, Kabupaten Tangerang",2025-05-22 16:50:34
"dr. Resyana Putri Nugraheni, Sp.A",Sp. Anak,Mayapada Hospital Bogor,"Bogor Timur, Bogor",2025-05-22 16:50:34
"dr. Retno Widyaningsih, Sp.A (K), MPH",Sp. Anak,RS Mitra Keluarga Kelapa Gading,"Kelapa Gading, Jakarta Utara",2025-05-22 16:50:34
dr. Reza Chandra Abdila Sp.A,Sp. Anak,RSIA Amanah Probolinggo,"Mayangan, Kota Probolinggo",2025-05-22 16:50:34
dr. Reza Chandra Abdilla Sp.A,Sp. Anak,RSIA Amanah Probolinggo,"Mayangan, Kota Probolinggo",2025-05-22 16:50:34
"dr. Riadhy B. Prasetyo, Sp.A",Sp. Anak,RS Mitra Keluarga Bekasi Timur,"Bekasi Timur, Bekasi",2025-05-22 16:50:34
"dr. Riana Novy Evijanty, Sp.A",Sp. Anak,RS Mitra Keluarga Bekasi Timur,"Bekasi Timur, Bekasi",2025-05-22 16:50:34
"dr. Rianasyah, Sp.A",Sp. Anak,Siloam Hospitals Bangka,"Pangkalan Baru,  Kabupaten Bangka Tengah",2025-05-22 16:50:36
"dr. Ridhayani, Sp.A",Sp. Anak,Siloam Hospitals Sriwijaya Palembang,"Ilir Barat I, Kota Palembang",2025-05-22 16:50:36
"dr. Ridwan Tjahyadi Sugiarto , Sp.A, FPPS, DAA, DPA",Sp. Anak,RS Mitra Keluarga Gading Serpong,"Pagedangan, Kabupaten Tangerang",2025-05-22 16:50:36
"dr. Rini Kemala Sari Sp.A . M, Kes",Sp. Anak,RS Tiara Sella,"Gading Cempaka, Kota Bengkulu",2025-05-22 16:50:36
dr. Robby Godilef Munshar Sp.A,Sp. Anak,RSIA Bunda Fathia,"Purwakarta, Kabupaten Purwakarta",2025-05-22 16:50:36
"dr. Robby Godlief Munster, Sp.A",Sp. Anak,Siloam Hospitals Purwakarta,"Bungursari, Kabupaten Purwakarta",2025-05-22 16:50:36
"Dr. Rony Adjiova, M.Ked (Ped) Sp. A",Sp. Anak,RS Citra Sari Husada,"Klari, Kabupaten Karawang",2025-05-22 16:50:36
dr. Rony Antonius Padapotan Tamba Sp. A,Sp. Anak,RS Santa Clara,"Manguharjo, Kota Madiun",2025-05-22 16:50:36
"dr. Rosalina Josep, Sp.A",Sp. Anak,RS Mitra Keluarga Kelapa Gading,"Kelapa Gading, Jakarta Utara",2025-05-22 16:50:36
"Dr. dr. Rubiana Sukardi, Sp.A (K)","Sp. Anak, Sp. Jantung & Pembuluh Darah",Siloam Hospitals Lippo Village,"Kelapa Dua, Kabupaten Tangerang",2025-05-22 16:50:36
"dr. Rudi Hartono, Sp.A",Sp. Anak,RS Mitra Keluarga Kemayoran,"Kemayoran, Jakarta Pusat",2025-05-22 16:50:38
dr. Runiawan Sp.A,Sp. Anak,RS Mitra Siaga Tegal,"Kramat, Tegal",2025-05-22 16:50:38
"dr. Ruth Daisy Suriadji, Sp.A",Sp. Anak,Siloam Hospitals Mataram,"Mataram, Kota Mataram",2025-05-22 16:50:38
"dr. S. Tumpal Andreas C, dr., M.Ked (Pedi) Sp.A",Sp. Anak,RS EMC Pekayon,"Bekasi Selatan, Bekasi",2025-05-22 16:50:38
dr Sally Palit Sp. A,Sp. Anak,RS Mitra Family,"Telukjambe Timur, Kabupaten Karawang",2025-05-22 16:50:38
dr. Samuel B. S. Harwin Sp.A,Sp. Anak,RS Sentra Medika Cisalak,"Sukmajaya, Depok",2025-05-22 16:50:38
"dr. Santi Gunarnawi, Sp.A. M.Kes",Sp. Anak,RS. Hamori,"Pagaden, Kabupaten Subang",2025-05-22 16:50:38
"dr. Sari Leily, Sp.A. MHA",Sp. Anak,RS Mutiara Hati Mojokerto,"Gedeg, Kabupaten Mojokerto",2025-05-22 16:50:38
"dr. Sebastianus Hartanto, Sp.A",Sp. Anak,Siloam Hospitals Kebon Jeruk,"Kebon Jeruk, Jakarta Barat",2025-05-22 16:50:38
dr. Septian Tri Muhari Sp.A,Sp. Anak,RS Lira Medika,"Karawang Timur, Kabupaten Karawang",2025-05-22 16:50:38
dr. Septian Tri Muhari Sp. A,Sp. Anak,RS Lira Medika,"Karawang Timur, Kabupaten Karawang",2025-05-22 16:50:40
"dr. Sheila Febrianti, M.Sc SpA",Sp. Anak,RS Santo Borromeus,"Coblong, Kota Bandung",2025-05-22 16:50:40
dr. Shila Puarani ABE Sp.A,Sp. Anak,RSIA Bina Medika,"Pondok Aren, Tangerang Selatan",2025-05-22 16:50:40
Dr. Shita Paurani Abe Sp.A,Sp. Anak,Bintaro Woman and Children Clinic Senayan,"Pondok Aren, Tangerang Selatan",2025-05-22 16:50:40
Dr. Shita Paurani Abe Sp. A,Sp. Anak,Bintaro Woman and Children Clinic Senayan,"Pondok Aren, Tangerang Selatan",2025-05-22 16:50:40
Dr. Shita Paurani Abe Sp.A,Sp. Anak,Bintaro Woman and Children Clinic Senayan,"Pondok Aren, Tangerang Selatan",2025-05-22 16:50:40
Dr. Shita Paurani Abe Sp. A,Sp. Anak,Bintaro Woman and Children Clinic Senayan,"Pondok Aren, Tangerang Selatan",2025-05-22 16:50:40
"dr. Sisca Silvana, M.Ked(Ped), Sp.A (K)",Sp. Anak,Siloam Hospitals Dhirga Surya Medan,"Medan Petisah, Kota Medan",2025-05-22 16:50:40
"dr. Siska Natalia Situmeang, M.Ked (Ped)., Sp.A",Sp. Anak,Siloam Hospitals Mampang,"Pancoran, Jakarta Selatan",2025-05-22 16:50:40
dr. Sita Ariyani Sp.A,Sp. Anak,RS Mitra Keluarga Cikarang,"Cikarang Utara, Kabupaten Bekasi",2025-05-22 16:50:40
"dr. Sita Ariyani, Sp.A",Sp. Anak,RS Mitra Keluarga Cikarang,"Cikarang Utara, Kabupaten Bekasi",2025-05-22 16:50:42
"dr. Soenarto, Sp.A",Sp. Anak,RS Mitra Keluarga Kemayoran,"Kemayoran, Jakarta Pusat",2025-05-22 16:50:42
"dr. Sri Mufti Ardani, Sp.A",Sp. Anak,Mayapada Hospital Jakarta Selatan,"Cilandak, Jakarta Selatan",2025-05-22 16:50:42
dr. Sri Novianty M.Ked (Ped) Sp.A,Sp. Anak,Siloam Hospitals Silampari (Lubuk Linggau),"Lubuk Linggau Timur I, Kota Lubuk Linggau",2025-05-22 16:50:42
"dr. Sri Novianty, M.Ked (Ped)., Sp.A",Sp. Anak,Siloam Hospitals Silampari (Lubuk Linggau),"Lubuk Linggau Timur I, Kota Lubuk Linggau",2025-05-22 16:50:42
dr. Sri Sulastri DSA Sp A (K),Sp. Anak,RS Mitra Keluarga Kelapa Gading,"Kelapa Gading, Jakarta Utara",2025-05-22 16:50:42
dr. Sri Sulastri DSA Sp.A (K),Sp. Anak,RS Mitra Keluarga Kelapa Gading,"Kelapa Gading, Jakarta Utara",2025-05-22 16:50:42
"dr. Sri Sulastri Katarnida, Sp.A (K)",Sp. Anak,RS Mitra Keluarga Kelapa Gading,"Kelapa Gading, Jakarta Utara",2025-05-22 16:50:42
"dr. Sri Wherdani, Sp.A",Sp. Anak,RSIA Andini Pekanbaru,"Marpoyan Damai, Kota Pekanbaru",2025-05-22 16:50:42
"dr. Stephani Dwiastuti, Sp.A",Sp. Anak,RS Mitra Keluarga Surabaya,"Sukomanunggal, Kota Surabaya",2025-05-22 16:50:42
dr. Stephanie Supriadi Sp.A,Sp. Anak,Mayapada Hospital Bandung,"Bandung Kidul, Kota Bandung",2025-05-22 16:50:44
"dr. Stephanie Yulianto, Sp.A",Sp. Anak,RS Mitra Keluarga Kalideres,"Kalideres, Jakarta Barat",2025-05-22 16:50:44
"dr. Stephanie, Sp.A",Sp. Anak,RS Immanuel,"Bojongloa Kidul, Kota Bandung",2025-05-22 16:50:44
dr Steven Tjias Sp. A,Sp. Anak,RSKIA Eka Grand Family,"Penjaringan, Jakarta Utara",2025-05-22 16:50:44
dr Steven Tjla Sp. A,Sp. Anak,RSKIA Eka Grand Family,"Penjaringan, Jakarta Utara",2025-05-22 16:50:44
"dr. Suci Harini Sp.A, Subsp. Neo (K)",Sp. Anak,RS Universitas Islam Indonesia,"Pandak, Kabupaten Bantul",2025-05-22 16:50:44
dr. Suci Saptayini Permadi Sp.A.,Sp. Anak,RSIA Cahaya Bunda,"Kesambi, Kota Cirebon",2025-05-22 16:50:44
dr. Suci Saptyuni Permadi Sp.A,Sp. Anak,RSIA Cahaya Bunda,"Kesambi, Kota Cirebon",2025-05-22 16:50:44
dr. Suci Saptyuni Permadi Sp.A,Sp. Anak,RSIA Cahaya Bunda Tabanan,"Tabanan, Kabupaten Tabanan",2025-05-22 16:50:44
dr. Suci Saptyuni Permadi Sp.A,Sp. Anak,RSIA Cahaya Bunda,"Kesambi, Kota Cirebon",2025-05-22 16:50:44
"dr. Sugianto Wiriadinata, Sp.A",Sp. Anak,Siloam Hospitals Lippo Cikarang,"Cikarang Selatan, Kabupaten Bekasi",2025-05-22 16:50:47
dr Sugijanto Sp. A,Sp. Anak,RSU Wijayakusuma Kebumen,"Kebumen, Kabupaten Kebumen",2025-05-22 16:50:47
"dr. Supriyadi Bektiwibowo, Sp.A",Sp. Anak,RS Bina Husada,"Cibinong, Kabupaten Bogor",2025-05-22 16:50:47
"dr. Susana Farah Diba, Sp.A, M.Kes",Sp. Anak,RS Immanuel,"Bojongloa Kidul, Kota Bandung",2025-05-22 16:50:47
dr. Susanti Halim Sp.A,Sp. Anak,RS Mitra Keluarga Bekasi,"Bekasi Selatan, Bekasi",2025-05-22 16:50:47
"dr. Susanti Himawan, Sp. A",Sp. Anak,RS Mitra Keluarga Kemayoran,"Kemayoran, Jakarta Pusat",2025-05-22 16:50:47
"dr. Susy Putri Wihadi, Sp.A",Sp. Anak,RS Mitra Keluarga Depok,"Pancoran Mas, Depok",2025-05-22 16:50:47
Dr. Syaiful Arief Miraza Sp.A,Sp. Anak,Klinik Utama Rinjani Medika,"Cilacap Tengah, Kabupaten Cilacap",2025-05-22 16:50:47
dr. Syaiful Arief Mirazza Sp.A,Sp. Anak,Klinik Utama Rinjani Medika,"Cilacap Tengah, Kabupaten Cilacap",2025-05-22 16:50:47
dr. Syntia Rizki Heldiana Sp M,Sp. Anak,Klinik Mata SMEC Bekasi,"Medan Satria, Bekasi",2025-05-22 16:50:47
dr. TRIE HARIWENI dr Sp.A,Sp. Anak,RS Pelabuhan Jakarta Utara,"Koja, Jakarta Utara",2025-05-22 16:50:49
dr. Tanty Febriany Sp. A,Sp. Anak,RSU ST Madyang Palopo,"Wara, Kota Palopo",2025-05-22 16:50:49
dr. Tessa Rulianty SpA,Sp. Anak,RS Ummi Bengkulu,"Gading Cempaka, Kota Bengkulu",2025-05-22 16:50:49
"dr. Theresia Santi Dalton, Sp.A",Sp. Anak,Siloam Hospitals Lippo Cikarang,"Cikarang Selatan, Kabupaten Bekasi",2025-05-22 16:50:49
dr. Thomas H. Adoe Sp.A (K),Sp. Anak,RSIA Selasih Medika,"Bekasi Barat, Bekasi",2025-05-22 16:50:49
"dr. Tisa Rori, Sp.A, M.Kes",Sp. Anak,RS Mitra Keluarga Bekasi,"Bekasi Selatan, Bekasi",2025-05-22 16:50:49
"dr. Tjatur Kuat Sucipto, Sp.A",Sp. Anak,RS Sukmul Sisma Medika,"Koja, Jakarta Utara",2025-05-22 16:50:49
dr. Toddy Guntersah Sp. A,Sp. Anak,RS dr. OEN Kandang Sapi Solo,"Jebres, Kota Surakarta",2025-05-22 16:50:49
dr. Tommy Nugrahadi W Sp.A,Sp. Anak,RSU San Medical Center,"Cikampek, Kabupaten Karawang",2025-05-22 16:50:49
dr. Tommy Nugrahadi W. Sp.A,Sp. Anak,RSU San Medical Center,"Cikampek, Kabupaten Karawang",2025-05-22 16:50:49
dr. Tommy Nugrahadi W. Sp.A,Sp. Anak,RSU San Medical Center,"Cikampek, Kabupaten Karawang",2025-05-22 16:50:51
dr Tri Sulaiyarini Sp. A,Sp. Anak,RS QIM Batang,"Batang, Kabupaten Batang",2025-05-22 16:50:51
"Dr. Triana Damayanti, dr. SpA",Sp. Anak,RS Jakarta,"Setiabudi, Jakarta Selatan",2025-05-22 16:50:51
dr Tunjung Wibowo Sp. A (K),Sp. Anak,Cito Bantul Yogyakarta,"Bantul, Kabupaten Bantul",2025-05-22 16:50:51
"dr. Tyas Wuri handayani , Sp.A",Sp. Anak,RS Mitra Keluarga Grand Wisata,"Tambun Selatan, Kabupaten Bekasi",2025-05-22 16:50:51
"dr. Valencia Junita Theno, Sp.A",Sp. Anak,Siloam Hospitals Paal Dua Manado,"Paal Dua, Kota Manado",2025-05-22 16:50:51
"dr. Valencius Sunandar, Sp.A",Sp. Anak,Siloam Hospitals Bogor,"Bogor Tengah, Bogor",2025-05-22 16:50:51
"dr. Veronica Lily Limantara, Sp.A",Sp. Anak,Siloam Hospitals Denpasar,"Kuta, Kabupaten Badung",2025-05-22 16:50:51
"dr. Vicka Farah Diba, M.Sc SpA",Sp. Anak,JIH Jogja,"Kecamatan Depok, Kabupaten Sleman",2025-05-22 16:50:51
dr. Wasis Rohmja Sp.A,Sp. Anak,RS Gading Medika,"Gading Cempaka, Kota Bengkulu",2025-05-22 16:50:51
"dr. Welli Hamik, Sp.A",Sp. Anak,Siloam Hospitals Purwakarta,"Bungursari, Kabupaten Purwakarta",2025-05-22 16:50:53
"dr. Wendi Adam Somantri, Sp.A",Sp. Anak,RS Al-Islam Bandung,"Rancasari, Kota Bandung",2025-05-22 16:50:53
"dr. Winarno, Sp.A",Sp. Anak,RS Mitra Keluarga Bekasi,"Bekasi Selatan, Bekasi",2025-05-22 16:50:53
"dr. Wisvici Yosua Samin, M.Sc., Sp.A",Sp. Anak,Siloam Hospitals Kebon Jeruk,"Kebon Jeruk, Jakarta Barat",2025-05-22 16:50:53
"dr. Wulan Patricia Telew, Sp.A",Sp. Anak,RS Bina Husada,"Cibinong, Kabupaten Bogor",2025-05-22 16:50:53
"dr. Yani Dewi Suryani, Sp.A",Sp. Anak,Mayapada Hospital Bandung,"Bandung Kidul, Kota Bandung",2025-05-22 16:50:53
"dr. Yanitama Putri, Sp.A",Sp. Anak,BIMC Hospitals Kuta,"Kuta, Kabupaten Badung",2025-05-22 16:50:53
dr. Yanizar Saputra W. Sp.A,Sp. Anak,RS Lira Medika,"Karawang Timur, Kabupaten Karawang",2025-05-22 16:50:53
dr. Yanuar Saputra W. Sp.A,Sp. Anak,RS Lira Medika,"Karawang Timur, Kabupaten Karawang",2025-05-22 16:50:53
dr. Yanuar Saputra W. Sp.A,Sp. Anak,RS Lira Medika,"Karawang Timur, Kabupaten Karawang",2025-05-22 16:50:53
dr. Yanuar Saputra Widjaja Sp.A,Sp. Anak,RS Lira Medika,"Karawang Timur, Kabupaten Karawang",2025-05-22 16:50:55
"dr. Yanuar Wahyu Hidayat, Sp.A",Sp. Anak,RS Mitra Keluarga Slawi,"Slawi, Tegal",2025-05-22 16:50:55
dr. Yanuar saputra,Sp. Anak,RS Lira Medika,"Karawang Timur, Kabupaten Karawang",2025-05-22 16:50:55
"dr. Yenny Kumalawati Santosoatmodjo, Sp.A",Sp. Anak,RS Mitra Keluarga Cibubur,"Jatisampurna, Bekasi",2025-05-22 16:50:55
dr. Yetty Movieta Nency Sp. A,Sp. Anak,RS Telogorejo,"Semarang Tengah, Kota Semarang",2025-05-22 16:50:55
"dr. Yogi Prawira, Sp.A (K)",Sp. Anak,Siloam Hospitals TB Simatupang,"Cilandak, Jakarta Selatan",2025-05-22 16:50:55
"dr Yoke Kinanthi Putri, M.Sc. Sp.A",Sp. Anak,Eka Hospital Bekasi,"Tarumajaya, Kabupaten Bekasi",2025-05-22 16:50:55
"dr. Yose Muliawan Pangestu, Sp.A",Sp. Anak,Mayapada Hospital Tangerang,"Tangerang, Tangerang",2025-05-22 16:50:55
"dr. Yosef Yanto Deventer Nyong Oematan, Sp.A",Sp. Anak,Siloam Hospitals Kupang,"Oebobo, Kota Kupang",2025-05-22 16:50:55
dr. Yosiana Liska Sp.A,Sp. Anak,Mandaya Hospital Karawang,"Telukjambe Timur, Kabupaten Karawang",2025-05-22 16:50:55
dr Yosianna Liska Sp.A,Sp. Anak,Mandaya Hospital Karawang,"Telukjambe Timur, Kabupaten Karawang",2025-05-22 16:50:57
"dr. Yulia Antolis, Sp.A",Sp. Anak,RS Mitra Keluarga Cikarang,"Cikarang Utara, Kabupaten Bekasi",2025-05-22 16:50:57
Dr. Yulia Ariani Aswin Sp. A,Sp. Anak,Eka Hospital Bekasi,"Tarumajaya, Kabupaten Bekasi",2025-05-22 16:50:57
"dr. Yulianto Santoso Kurniawan, Sp.A",Sp. Anak,Mayapada Hospital Jakarta Selatan,"Cilandak, Jakarta Selatan",2025-05-22 16:50:57
"dr. Yuly, Sp.A",Sp. Anak,RS Mitra Keluarga Delta Mas,"Cikarang Pusat, Kabupaten Bekasi",2025-05-22 16:50:57
"dr. Yuni Hisbiyah, Sp.A., MMRS",Sp. Anak,RS Mitra Keluarga Pondok Tjandra,"Waru, Kabupaten Sidoarjo",2025-05-22 16:50:57
Dr. Yuni Kurnia P Sp.A,Sp. Anak,RS Meilia,"Cimanggis, Depok",2025-05-22 16:50:57
"dr. Yurita Handoyo, Sp.A",Sp. Anak,Mayapada Hospital Tangerang,"Tangerang, Tangerang",2025-05-22 16:50:57
"dr. Yusnita, Sp.A",Sp. Anak,RS Mitra Keluarga Depok,"Pancoran Mas, Depok",2025-05-22 16:50:57
"dr. Zenia Angelina, Sp.A, M.Biomed",Sp. Anak,RS Mitra Keluarga Pondok Tjandra,"Waru, Kabupaten Sidoarjo",2025-05-22 16:50:57
dr. Zulbakhri Sp.A,Sp. Anak,RS Kenari Graha Medika,"Cileungsi, Kabupaten Bogor",2025-05-22 16:50:59
"dr. d SARI WHARDHANI MAHLIGAI PATERY, MSC, Sp.A",Sp. Anak,RSIA Annisa Pekanbaru,"Marpoyan Damai, Kota Pekanbaru",2025-05-22 16:50:59
dr Leonirman Tengguna M Sc Sp A,Sp. Anak,RSIA Bina Medika,"Pondok Aren, Tangerang Selatan",2025-05-22 16:50:59
dr Liyanthy Chandra Sp. A,Sp. Anak,RS Antam Medika,"Pulo Gadung, Jakarta Timur",2025-05-22 16:50:59
"dr PRIYANTI KISWORINI, M. KES, SP. A (K), DR. MUHAMMAD ALQODRI GANI dr. NUR MILA",Sp. Anak,RS Sari Mulia Banjarmasin,"Banjarmasin Tengah, Kota Banjarmasin",2025-05-22 16:50:59
dr Ramadianty Sp.A,Sp. Anak,RS Simulasi Halodoc,"Setiabudi, Jakarta Selatan",2025-05-22 16:50:59
dr Siska sp.A,Sp. Anak,Tzu Chi Hospital,"Penjaringan, Jakarta Utara",2025-05-22 16:50:59
"dr. ADRIAN JOHAN KHOMAN, Sp.A",Sp. Anak,Murni Teguh Memorial Hospital,"Medan Timur, Kota Medan",2025-05-22 16:50:59
dr. ANASTASIA MAUREEN,Sp. Anak,Mayapada Hospital Tangerang,"Tangerang, Tangerang",2025-05-22 16:50:59
"dr. Adhini Dwirespati, Sp.A",Sp. Anak,Bintaro Woman and Children Clinic Senayan,"Pondok Aren, Tangerang Selatan",2025-05-22 16:50:59
"dr. Agus Budiarto, Sp.A, M.Ked.Klin",Sp. Anak,RS Islam Surabaya,"Wonokromo, Kota Surabaya",2025-05-22 16:51:01
dr. Andi Cahyadi Sp.A,Sp. Anak,Siloam Hospitals Surabaya,"Gubeng, Kota Surabaya",2025-05-22 16:51:01
dr. Andreas Sp.A,Sp. Anak,RSIA Melati Husada,"Klojen, Kota Malang",2025-05-22 16:51:01
"dr. Andy Setiawan, Sp.A",Sp. Anak,RS PIK,"Penjaringan, Jakarta Utara",2025-05-22 16:51:01
"dr. Anis Amiranti, Sp.A",Sp. Anak,RS Wiyung Sejahtera,"Wiyung, Kota Surabaya",2025-05-22 16:51:01
"dr. Ari Mulyani, SpA",Sp. Anak,RS An-Nisa Tangerang,"Cibodas, Tangerang",2025-05-22 16:51:01
"dr. Arie Kurniasih, Sp.A",Sp. Anak,RS Awal Bros A Yani Pekanbaru,"Pekanbaru Kota, Kota Pekanbaru",2025-05-22 16:51:01
"dr. Asri Kartika Putri, M.Med.Sc, Sp.A",Sp. Anak,RS Pondok Indah - Puri Indah,"Kembangan, Jakarta Barat",2025-05-22 16:51:01
dr. Avyandita Meirizkia,Sp. Anak,Siloam Hospitals Sriwijaya Palembang,"Ilir Barat I, Kota Palembang",2025-05-22 16:51:01
"dr. Bagus Samsu Tri Nugroho, Sp.A",Sp. Anak,RSIA Pondok Jati,"Sidoarjo, Kabupaten Sidoarjo",2025-05-22 16:51:01
"dr. Budi Ranu Bedali, Sp.A",Sp. Anak,RS Keluarga Sehat Pati,"Margorejo, Pati",2025-05-22 16:51:03
"dr. Budi Setiawan, Sp.A",Sp. Anak,RS Katolik St. Vincentius a Paulo (RKZ),"Wonokromo, Kota Surabaya",2025-05-22 16:51:03
"dr. Cahya Dewi S M.Kes, Sp.A (K)",Sp. Anak,JIH Jogja,"Kecamatan Depok, Kabupaten Sleman",2025-05-22 16:51:03
"dr. Centaura Naila Affin Camielle, Sp.A. M.Biomed",Sp. Anak,RSIA Puri Malang,"Klojen, Kota Malang",2025-05-22 16:51:03
"dr. Damar Prasetya, Sp.A, M.Psi.T",Sp. Anak,RS Pelni Petamburan,"Palmerah, Jakarta Barat",2025-05-22 16:51:03
"dr. Dessy Anitasari, Sp.A",Sp. Anak,RSIA dr. Djoko Pramono,"Karawang Barat, Kabupaten Karawang",2025-05-22 16:51:03
"dr. Devie Kristiani, Sp.A",Sp. Anak,RS Bethesda Yogyakarta,"Gondokusuman, Kota Yogyakarta",2025-05-22 16:51:03
"dr. Dianto, Sp.A",Sp. Anak,RS PIK,"Penjaringan, Jakarta Utara",2025-05-22 16:51:03
"dr. Edward Lionardus, Sp.A",Sp. Anak,RS Melinda 2,"Cicendo, Kota Bandung",2025-05-22 16:51:03
dr. Elisa Sp.A (K),Sp. Anak,JIH Jogja,"Kecamatan Depok, Kabupaten Sleman",2025-05-22 16:51:03
"dr. Elvira, Sp.A",Sp. Anak,RS PIK,"Penjaringan, Jakarta Utara",2025-05-22 16:51:05
"dr. Emma Fury, Sp.A",Sp. Anak,RS Pertamina Tarakan,"Tarakan Barat, Kota Tarakan",2025-05-22 16:51:05
"dr. Erlina Masniari Napitupulu, M.Ked(Ped), Sp.A",Sp. Anak,RS EMC Sentul,"Babakan Madang, Kabupaten Bogor",2025-05-22 16:51:05
dr. Ery Olivianto Sp.A,Sp. Anak,RSIA Melati Children Hospital,"Klojen, Kota Malang",2025-05-22 16:51:05
dr. Felicia Limantoro,Sp. Anak,National Hospital,"Wiyung, Kota Surabaya",2025-05-22 16:51:05
dr. Felix Candra Sutanto,Sp. Anak,Eka Hospital Bekasi,"Tarumajaya, Kabupaten Bekasi",2025-05-22 16:51:05
"dr. Grace Malinda Limopranoto, Sp.A",Sp. Anak,Mayapada Hospital Surabaya,"Sawahan, Kota Surabaya",2025-05-22 16:51:05
"dr. Gusti Istri Agung Widnyani, Sp.A",Sp. Anak,RSIA Puri Bunda Tabanan,"Kediri, Kabupaten Tabanan",2025-05-22 16:51:05
"dr. Hasan Basri, SpA",Sp. Anak,RSUD R. Syamsudin S.H,"Cikole, Kota Sukabumi",2025-05-22 16:51:05
"dr. Ida Ayu Ariwintan, Sp.A",Sp. Anak,RS Meloy Sangatta,"Sangatta Utara, Kabupaten Kutai Timur",2025-05-22 16:51:05
"dr. Ida Farida Nurohmah, Sp.A",Sp. Anak,RS Indriati Baru Sukoharjo,"Grogol, Kab Sukoharjo",2025-05-22 16:51:08
"dr. Indra Tamboen, Sp.A",Sp. Anak,RSIA Aisyiyah Samarinda,"Samarinda Kota, Kota Samarinda",2025-05-22 16:51:08
"dr. Irna Chandra, Sp.A",Sp. Anak,Siloam Hospitals Bangka,"Pangkalan Baru,  Kabupaten Bangka Tengah",2025-05-22 16:51:08
"dr. Johan Gautama, Sp.A",Sp. Anak,RS Royal Surabaya,"Tenggilis Mejoyo, Kota Surabaya",2025-05-22 16:51:08
"dr. Johnny Nurman, Sp. A",Sp. Anak,RS Abdi Waluyo,"Menteng, Jakarta Pusat",2025-05-22 16:51:08
"dr. Khadijah, Sp.A",Sp. Anak,RSIA Lombok Dua Dua Jl. Flores,"Wonokromo, Kota Surabaya",2025-05-22 16:51:08
dr. Kurniawan Sp.A,Sp. Anak,RS Intan Husada Garut,"Tarogong Kidul, Kabupaten Garut",2025-05-22 16:51:08
"dr. Lesmana Syahrir, SpA, M.Kes",Sp. Anak,RS Mitra Medika Premier,"Medan Petisah, Kota Medan",2025-05-22 16:51:08
dr. Lili Sianawati SpA,Sp. Anak,RS Columbia Asia Semarang,"Semarang Barat, Kota Semarang",2025-05-22 16:51:08
dr. Luthfi Sp.A,Sp. Anak,RSIA Cicik,"Padang Timur, Kota Padang",2025-05-22 16:51:08
"Dr. dr. M.F. Conny Tanjung, Sp.A(K)",Sp. Anak,RS PIK,"Penjaringan, Jakarta Utara",2025-05-22 16:51:10
dr. MARLYN CECILIA MALONDA,Sp. Anak,Mayapada Hospital Tangerang,"Tangerang, Tangerang",2025-05-22 16:51:10
"dr. Margaretha Juliana Sitanggang, Sp.A",Sp. Anak,RS Harapan Bunda Jakarta,"Ciracas, Jakarta Timur",2025-05-22 16:51:10
"dr. Maria Conny, Sp.A",Sp. Anak,RS PIK,"Penjaringan, Jakarta Utara",2025-05-22 16:51:10
"dr. Marlina Tanjung, Sp.A",Sp. Anak,RS Agung,"Setiabudi, Jakarta Selatan",2025-05-22 16:51:10
"dr. Martinus, Sp.A",Sp. Anak,RS Harapan Bunda Jakarta,"Ciracas, Jakarta Timur",2025-05-22 16:51:10
"dr. Mira Hayati Hartadi, Sp.A",Sp. Anak,RSIA Grha Bunda,"Kiaracondong, Kota Bandung",2025-05-22 16:51:10
"dr. Muchammad Fahrul Udin , Sp.A, Subsp. Resp. (K)",Sp. Anak,RS Mitra Keluarga Pondok Tjandra,"Waru, Kabupaten Sidoarjo",2025-05-22 16:51:10
"dr. Muchammad Fahrul Udin , Sp.A, Subsp. Resp. (K)",Sp. Anak,Persada Hospital,"Blimbing, Kota Malang",2025-05-22 16:51:10
"dr. Myrna Soepriadi,Sp.A(K)",Sp. Anak,RSIA Limijati,"Bandung Wetan, Kota Bandung",2025-05-22 16:51:10
"dr. Natali Erica J, Sp.A",Sp. Anak,RS Petrokimia Gresik,"Gresik, Kabupaten Gresik",2025-05-22 16:51:12
"dr. Ni Gusti Ayu Asih Ratnadi, Sp.A",Sp. Anak,Kasih Ibu Hospital Tabanan,"Tabanan, Kabupaten Tabanan",2025-05-22 16:51:12
"dr. Nova Yulia Rita, MKed(Ped), SpA",Sp. Anak,RS Mitra Medika Premier,"Medan Petisah, Kota Medan",2025-05-22 16:51:12
dr. Nugrah Tri Amiranti,Sp. Anak,Eka Hospital Bekasi,"Tarumajaya, Kabupaten Bekasi",2025-05-22 16:51:12
"dr. Nur Faizah, Sp.A",Sp. Anak,RSU Ananda Purwokerto,"Purwokerto Barat, Kabupaten Banyumas",2025-05-22 16:51:12
"dr. Olga Vicetria Putrie Purba, Sp.A",Sp. Anak,Mayapada Hospital Bandung,"Bandung Kidul, Kota Bandung",2025-05-22 16:51:12
"dr. Pebriansyah,Sp.A",Sp. Anak,Mayapada Hospital Jakarta Selatan,"Cilandak, Jakarta Selatan",2025-05-22 16:51:12
"dr. Putri, Sp.A",Sp. Anak,RS Pusat Pertamina,"Kebayoran Baru, Jakarta Selatan",2025-05-22 16:51:12
"dr. Putu Fristia Indarini, Sp.A",Sp. Anak,RSIA JWCC Asih,"Kebayoran Baru, Jakarta Selatan",2025-05-22 16:51:12
dr. RACHMAT KURNIAWAN,Sp. Anak,Mayapada Hospital Tangerang,"Tangerang, Tangerang",2025-05-22 16:51:12
"dr. Raymond Warouw, Sp.A",Sp. Anak,RS Mitra Medika Premier,"Medan Petisah, Kota Medan",2025-05-22 16:51:14
"dr. Resna Nurhantika Sary, Sp.A",Sp. Anak,RS Citama,"Bojonggede, Kabupaten Bogor",2025-05-22 16:51:14
"dr. Ria Puspita Sari, Sp.A",Sp. Anak,RSKIA Eka Grand Family,"Penjaringan, Jakarta Utara",2025-05-22 16:51:14
"dr. Ricki Rajagukguk, Sp.A",Sp. Anak,RSIA Limijati,"Bandung Wetan, Kota Bandung",2025-05-22 16:51:14
"dr. Ricky Hartono, Sp.A",Sp. Anak,RS Santo Yusup,"Cibeunying Kidul, Kota Bandung",2025-05-22 16:51:14
"dr. Rini Wulandari, SpA",Sp. Anak,RSIA As-Syifa Sangatta,"Sangatta Utara, Kabupaten Kutai Timur",2025-05-22 16:51:14
"dr. Riska, SpA",Sp. Anak,RSIA Bunda Aisyah,"Indihiang, Kota Tasikmalaya",2025-05-22 16:51:14
"dr. Roy Frederik Hija, Sp.A",Sp. Anak,RS Santo Yusup,"Cibeunying Kidul, Kota Bandung",2025-05-22 16:51:14
"dr. Rudy Ciulianto, Sp.A",Sp. Anak,RS Ukrida,"Kebon Jeruk, Jakarta Barat",2025-05-22 16:51:14
"dr. Satrio Bhuwono Prakoso, Sp.A",Sp. Anak,RS PMI Bogor,"Bogor Utara, Bogor",2025-05-22 16:51:14
"dr. Sri Murni A Ritonga, Sp.A,M.Kes",Sp. Anak,RSIA Belleza Kedaton,"Kedaton, Kota Bandar Lampung",2025-05-22 16:51:16
"dr. Syaharadian, SpA",Sp. Anak,RS Pelabuhan Jakarta Utara,"Koja, Jakarta Utara",2025-05-22 16:51:16
dr. Syifa Fauziah Safithri,Sp. Anak,RS Intan Husada Garut,"Tarogong Kidul, Kabupaten Garut",2025-05-22 16:51:16
dr. dr. Theresia Santi Sp.A,Sp. Anak,Siloam Clinic Meikarta,"Cikarang Selatan, Kabupaten Bekasi",2025-05-22 16:51:16
"dr. Tri Yuliani M.Sc, Sp.A",Sp. Anak,Mayapada Hospital Bogor,"Bogor Timur, Bogor",2025-05-22 16:51:16
"dr. Vanisia Hayu F, Sp.A",Sp. Anak,RS Gatoel,"Prajurit Kulon, Kota Mojokerto",2025-05-22 16:51:16
"dr. Wahyu Ningsih Lestari, Sp.A",Sp. Anak,RS Restu Ibu Balikpapan,"Balikpapan Tengah, Kota Balikpapan",2025-05-22 16:51:16
"dr. William Grandinata,Sp.A",Sp. Anak,RS Bhakti Yudha,"Pancoran Mas, Depok",2025-05-22 16:51:16
"dr. William Nawawi, Sp.A",Sp. Anak,Charitas Hospital Palembang,"Ilir Timur I, Kota Palembang",2025-05-22 16:51:16
"dr. Winda Paramitha, M.Sc, Sp.A",Sp. Anak,RS Petrokimia Gresik,"Gresik, Kabupaten Gresik",2025-05-22 16:51:16
dr. YOSE MULIAWAN PANGESTU,Sp. Anak,Mayapada Hospital Tangerang,"Tangerang, Tangerang",2025-05-22 16:51:18
"dr. Yuni Kurnia P, Sp A",Sp. Anak,RS Meilia,"Cimanggis, Depok",2025-05-22 16:51:18
"dr. Zulmansjah, SpA",Sp. Anak,RSIA Limijati,"Bandung Wetan, Kota Bandung",2025-05-22 16:51:18
"dr.Evelyn Phangkawira, Sp.A., M.Kes",Sp. Anak,St. Antonius Pontianak,"Pontianak Kota, Kota Pontianak",2025-05-22 16:51:18
"dr.Linda wati, M.Ked(Ped), SP.A",Sp. Anak,RS Utama,"Tanjung Pandan,  Kabupaten Belitung",2025-05-22 16:51:18
"dr.Okkie Prayuda, Sp.A",Sp. Anak,RS Santa Maria Pemalang,"Pemalang, Kabupaten Pemalang",2025-05-22 16:51:18
"dr.Tri Dyah, Sp.A",Sp. Anak,RS Panti Nirmala,"Kedungkandang, Kota Malang",2025-05-22 16:51:18
dr A Khanis Sp A,Sp. Anak,Apotek SARAS SEHAT,"Kebayoran Lama, Jakarta Selatan",2025-05-22 16:51:18
"Dr. A. Nugi Nugraha, SpA",Sp. Anak,Apotek Kimia Farma 167 Cimahi,"Cimahi Tengah, Kota Cimahi",2025-05-22 16:51:18
dr. A. Wisnu Wardhana Sp.A,Sp. Anak,Dr. A. Wisnu Wardhana Sp. A,"Samarinda Kota, Kota Samarinda",2025-05-22 16:51:18
dr. ABDUL HAMID Sp.A,Sp. Anak,Klinik Abdul Hakim,"Dringu, Kota Probolinggo",2025-05-22 16:51:20
"dr. Abdul Hakam, Msi, Med, Sp.A",Sp. Anak,"dr. Abdul Hakam, Msi, Med, Sp.A","Kota Kudus, Kabupaten Kudus",2025-05-22 16:51:20
"dr. Abdullaely, Sp.A",Sp. Anak,halodoc,"Setiabudi, Jakarta Selatan",2025-05-22 16:51:20
Dr. Achirul Bakri Sp.A,Sp. Anak,Praktik dr. Achirul Bakri Sp.A (K),"Ilir Timur II, Kota Palembang",2025-05-22 16:51:20
"dr. Ade Indrisari, Sp.A M.Kes",Sp. Anak,KLINIK PATEN,"Ciracas, Jakarta Timur",2025-05-22 16:51:20
"dr. Ade Indrisari, Sp.A M.Kes",Sp. Anak,"dr. Ade Indrisari, Sp.A, M.Kes","Sleman, Kabupaten Sleman",2025-05-22 16:51:20
Dr. Ade Nur Prihadi Sp.A,Sp. Anak,halodoc,"Setiabudi, Jakarta Selatan",2025-05-22 16:51:20
dr. Ade Nur Prihadi Sutopo Sp.A,Sp. Anak,halodoc,"Setiabudi, Jakarta Selatan",2025-05-22 16:51:20
"Dr. Adhie Nur Radityo Suswihardhyono M.Si.Med, Sp.A(K)",Sp. Anak,halodoc,"Setiabudi, Jakarta Selatan",2025-05-22 16:51:20
Dr. Adhini Dwirespati Sp.A,Sp. Anak,halodoc,"Setiabudi, Jakarta Selatan",2025-05-22 16:51:20
dr. Adhitya Agung Pratama Sp A,Sp. Anak,Klinik Khitan Martadinata,"Kuningan, Kabupaten Kuningan",2025-05-22 16:51:22
dr. Adi Suryadinata Krisetya Sp.A,Sp. Anak,halodoc,"Setiabudi, Jakarta Selatan",2025-05-22 16:51:22
Dr. Adila Nurhadiya Sp.A,Sp. Anak,halodoc,"Setiabudi, Jakarta Selatan",2025-05-22 16:51:22
"dr. Adip Hermawan, MSc SpA",Sp. Anak,"dr ADIP HERMAWAN, MSc, SpA","Polanharjo, Klaten",2025-05-22 16:51:22
"Dr. Adkhiatul Muslihatin M.Ked.Klin, Sp.A",Sp. Anak,halodoc,"Setiabudi, Jakarta Selatan",2025-05-22 16:51:22
