name,speciality,hospital,city,timestamp
Dr. AIDA SOFIATI DAHLAN SURIADIREJA Sp. DV,Sp. Kulit & Kelamin,RS Kanker Dharmais,"Palmerah, Jakarta Barat",2025-05-22 13:37:50
dr. Achmad Satya Negara Sp.DV,Sp. Kulit & Kelamin,RS Permata Medika,"Ngaliyan, Kota Semarang",2025-05-22 13:37:50
"dr. Adi Agung Anantawijaya Daryago, Sp.DV",Sp. Kulit & Kelamin,Siloam Hospitals Bekasi Timur,"Bekasi Timur, Bekasi",2025-05-22 13:37:50
"dr. Adi Gunadi, Sp.KK, FINSDV, FAADV",Sp. Kulit & Kelamin,RS Mitra Keluarga Depok,"Pancoran Mas, Depok",2025-05-22 13:37:50
"dr. Agni Anastasia Sahulata, Sp.KK",Sp. Kulit & Kelamin,RS Mitra Keluarga Bekasi Timur,"Bekasi Timur, Bekasi",2025-05-22 13:37:50
"dr. Alfonsus Rendy Laksditalia Nugroho, Sp.DV",Sp. Kulit & Kelamin,Siloam Hospitals TB Simatupang,"Cilandak, Jakarta Selatan",2025-05-22 13:37:50
"dr. Andy Manggabarani, Sp.KK",Sp. Kulit & Kelamin,Siloam Hospitals Makassar,"Ujung Pandang, Kota Makassar",2025-05-22 13:37:50
dr. Anita Indah Sari Sp.DVE,Sp. Kulit & Kelamin,Ciputra Hospital Citra Raya Tangerang,"Panongan, Kabupaten Tangerang",2025-05-22 13:37:50
"dr. Armansjah Dara Sjahruddin, Sp.KK, M.Kes",Sp. Kulit & Kelamin,Mayapada Hospital Kuningan,"Setiabudi, Jakarta Selatan",2025-05-22 13:37:50
"dr. Armina Haramaini, Sp.KK",Sp. Kulit & Kelamin,Siloam Hospitals Purwakarta,"Bungursari, Kabupaten Purwakarta",2025-05-22 13:37:50
Dr. Armita Asri Apsari Sp.D.V.E,Sp. Kulit & Kelamin,Siloam Hospitals Semarang,"Semarang Selatan, Kota Semarang",2025-05-22 13:38:04
"Dr. Ayu Nur Ain H. Sp.D.V.E, FINSDV",Sp. Kulit & Kelamin,RS Mitra Keluarga Slawi,"Slawi, Tegal",2025-05-22 13:38:04
dr. Bambang Ratio SpM.KK,Sp. Kulit & Kelamin,RS Dewi Sri,"Karawang Barat, Kabupaten Karawang",2025-05-22 13:38:04
"dr. Benjamin Ricardo Rubirosa Lumban T, M.Ked(DV), Sp.DV",Sp. Kulit & Kelamin,RS Mitra Keluarga Kalideres,"Kalideres, Jakarta Barat",2025-05-22 13:38:04
"Dr. Brahm Udumbara Pendit Sp.D.V.E, FINSDV",Sp. Kulit & Kelamin,RS Mitra Keluarga Kemayoran,"Kemayoran, Jakarta Pusat",2025-05-22 13:38:04
Dr. Budi Eko Prasetyo Sp. DV,Sp. Kulit & Kelamin,RSU Islam Harapan Anda Tegal,"Tegal Selatan, Kota Tegal",2025-05-22 13:38:04
"dr. Budi Satria, Sp.DV",Sp. Kulit & Kelamin,Siloam Hospitals Palangka Raya,"Pahandut, Kota Palangka Raya",2025-05-22 13:38:04
"dr. Bunga Sejuk Segar, Sp.KK",Sp. Kulit & Kelamin,RS Mitra Keluarga Bintaro,"Pondok Aren, Tangerang Selatan",2025-05-22 13:38:04
"dr. Bunga Sejuk Segar, Sp.KK., M.Sc",Sp. Kulit & Kelamin,RS Mitra Keluarga Bintaro,"Pondok Aren, Tangerang Selatan",2025-05-22 13:38:04
"dr. Caroline Budiman, Sp.KK",Sp. Kulit & Kelamin,Mayapada Hospital Tangerang,"Tangerang, Tangerang",2025-05-22 13:38:04
Dr. Ching Chin Chwen,Sp. Kulit & Kelamin,Subang Jaya Medical Centre,"Mampang Prapatan, Jakarta Selatan",2025-05-22 13:38:13
dr. Ching Chin Chwen,Sp. Kulit & Kelamin,Subang Jaya Medical Centre,"Mampang Prapatan, Jakarta Selatan",2025-05-22 13:38:13
"dr. Christine Andriyani, Sp.KK",Sp. Kulit & Kelamin,RS Mitra Keluarga Gading Serpong,"Pagedangan, Kabupaten Tangerang",2025-05-22 13:38:13
"dr. Cindy Ariani, M.Biomed, Sp.KK",Sp. Kulit & Kelamin,RS Mitra Keluarga Kalideres,"Kalideres, Jakarta Barat",2025-05-22 13:38:13
Dr. Cindy Cekti Sp. KK,Sp. Kulit & Kelamin,JIH Jogja,"Kecamatan Depok, Kabupaten Sleman",2025-05-22 13:38:13
dr. Dani Djunda Sp.KK,Sp. Kulit & Kelamin,RS Mitra Keluarga Kelapa Gading,"Kelapa Gading, Jakarta Utara",2025-05-22 13:38:13
"dr. Danny Gunawan, Sp.KK",Sp. Kulit & Kelamin,RS Mitra Keluarga Kemayoran,"Kemayoran, Jakarta Pusat",2025-05-22 13:38:13
"dr. Dewi Kusumawati, Sp.KK",Sp. Kulit & Kelamin,RS Mitra Keluarga Pondok Tjandra,"Waru, Kabupaten Sidoarjo",2025-05-22 13:38:13
"dr. Dewi Lastya Sari, Sp.DV., M.Med",Sp. Kulit & Kelamin,Siloam Hospitals Jambi,"Jambi Selatan, Kota Jambi",2025-05-22 13:38:13
"dr. Dian Anggraeni, Sp.KK",Sp. Kulit & Kelamin,Siloam Hospitals Makassar,"Ujung Pandang, Kota Makassar",2025-05-22 13:38:13
"dr. Dian Puspitasari, Sp.DVE",Sp. Kulit & Kelamin,Klinik Utama Medika Antapani,"Kiaracondong, Kota Bandung",2025-05-22 13:38:17
"dr. Dian Puspitasari, Sp.KK",Sp. Kulit & Kelamin,RS Immanuel,"Bojongloa Kidul, Kota Bandung",2025-05-22 13:38:17
"dr. Dina Putri Chandra, Sp.KK",Sp. Kulit & Kelamin,Siloam Hospitals Yogyakarta,"Gondokusuman, Kota Yogyakarta",2025-05-22 13:38:17
dr. Dina Udayani Swadeshi Sp.KK,Sp. Kulit & Kelamin,RS Dewi Sri,"Karawang Barat, Kabupaten Karawang",2025-05-22 13:38:17
dr. Dino Udayani Swodesh Sp.KK,Sp. Kulit & Kelamin,RS Dewi Sri,"Karawang Barat, Kabupaten Karawang",2025-05-22 13:38:17
"dr. Duma Mauliyasari, Sp.DV",Sp. Kulit & Kelamin,RS Mitra Keluarga Delta Mas,"Cikarang Pusat, Kabupaten Bekasi",2025-05-22 13:38:17
"dr. Edwin Tanihaha, Sp.KK, Dip. AAAM, MHKes, FKCCS",Sp. Kulit & Kelamin,Siloam Hospitals TB Simatupang,"Cilandak, Jakarta Selatan",2025-05-22 13:38:17
Dr. Eko Rini Puji Rahayu Sp. DVE,Sp. Kulit & Kelamin,RS Indriati Boyolali,"Mojosongo, Kabupaten Boyolali",2025-05-22 13:38:17
"dr. Elin Herlina, Sp.DV",Sp. Kulit & Kelamin,RS Mitra Keluarga Delta Mas,"Cikarang Pusat, Kabupaten Bekasi",2025-05-22 13:38:17
"dr. Emil Rafian Fadli, Sp.KK",Sp. Kulit & Kelamin,RS Bina Husada,"Cibinong, Kabupaten Bogor",2025-05-22 13:38:17
"dr. Epi Panjaitan, Sp.KK., MSc",Sp. Kulit & Kelamin,Siloam Hospitals Purwakarta,"Bungursari, Kabupaten Purwakarta",2025-05-22 13:38:24
"dr. Erivia Debora Pangkahila, M.Biomed, Sp.KK",Sp. Kulit & Kelamin,RS Mitra Keluarga Cibubur,"Jatisampurna, Bekasi",2025-05-22 13:38:24
"dr. Ermon Naftali Limbara, Sp.KK., M.Biomed",Sp. Kulit & Kelamin,Siloam Hospitals Sentosa Bekasi,"Bekasi Timur, Bekasi",2025-05-22 13:38:24
"dr. Euis Mutmainnah, Sp.DV.,FINSDV",Sp. Kulit & Kelamin,RSIA Sammarie Basra,"Duren Sawit, Jakarta Timur",2025-05-22 13:38:24
dr. Euis Nana Resna Sp.KK.,Sp. Kulit & Kelamin,RS Bina Husada,"Cibinong, Kabupaten Bogor",2025-05-22 13:38:24
"Evelyn Aryani Pranowo,",Sp. Kulit & Kelamin,RS Mitra Keluarga Pamulang,"Pamulang, Tangerang Selatan",2025-05-22 13:38:24
"dr. Evelyn Aryani, Sp.KK",Sp. Kulit & Kelamin,RS Mitra Keluarga Gading Serpong,"Pagedangan, Kabupaten Tangerang",2025-05-22 13:38:24
"dr. Febrina Felicia Somba, Sp.KK., M.Kes",Sp. Kulit & Kelamin,Mayapada Hospital Tangerang,"Tangerang, Tangerang",2025-05-22 13:38:24
"dr. Ferra Olivia Mawu, Sp.KK., M.Med",Sp. Kulit & Kelamin,Siloam Hospitals Manado,"Wenang, Kota Manado",2025-05-22 13:38:24
dr. Fitra Hergayana Sp. KK,Sp. Kulit & Kelamin,RS Lira Medika,"Karawang Timur, Kabupaten Karawang",2025-05-22 13:38:24
dr. Fitra Hergyana Sp.KK,Sp. Kulit & Kelamin,RS Lira Medika,"Karawang Timur, Kabupaten Karawang",2025-05-22 13:38:28
dr. Fitra Hergyana Sp.KK,Sp. Kulit & Kelamin,RS Lira Medika,"Karawang Timur, Kabupaten Karawang",2025-05-22 13:38:28
"dr. Fitriana Yusiyanti Dewi, Sp.KK",Sp. Kulit & Kelamin,RS Mitra Keluarga Tegal,"Tegal Barat, Kota Tegal",2025-05-22 13:38:28
dr. Galih Manggala M. SpKK,Sp. Kulit & Kelamin,RS Permata Depok,"Sawangan, Depok",2025-05-22 13:38:28
"dr. Gayanti Germania, Sp.KK",Sp. Kulit & Kelamin,RS Mitra Keluarga Depok,"Pancoran Mas, Depok",2025-05-22 13:38:28
"dr. Grace Waworuntu, M.Ked, Sp.KK",Sp. Kulit & Kelamin,Siloam Hospitals TB Simatupang,"Cilandak, Jakarta Selatan",2025-05-22 13:38:28
"dr. H. Bambang Rade Selyasyo, Sp.KK. FINSDV",Sp. Kulit & Kelamin,RS Dewi Sri,"Karawang Barat, Kabupaten Karawang",2025-05-22 13:38:28
"dr. H. Bambang Ratio Satyarso, Sp.KK FINSDV",Sp. Kulit & Kelamin,RS Dewi Sri,"Karawang Barat, Kabupaten Karawang",2025-05-22 13:38:28
dr. H. Bambang Ratio Setiyarso Sp. KK,Sp. Kulit & Kelamin,RS Dewi Sri,"Karawang Barat, Kabupaten Karawang",2025-05-22 13:38:28
"dr. H. Bambang Ratio Setiyarso, Sp.KK. FINSDV.",Sp. Kulit & Kelamin,RS Dewi Sri,"Karawang Barat, Kabupaten Karawang",2025-05-22 13:38:28
"dr. H. Bambang Rato Sedrayo, Sp. KK FINSDV",Sp. Kulit & Kelamin,RS Dewi Sri,"Karawang Barat, Kabupaten Karawang",2025-05-22 13:38:32
"dr. H. Bambang Rato Setiyaro, Sp.KK. FINSVD",Sp. Kulit & Kelamin,RS Dewi Sri,"Karawang Barat, Kabupaten Karawang",2025-05-22 13:38:32
"dr. H. Iswani, Sp.KK",Sp. Kulit & Kelamin,RS Mitra Keluarga Tegal,"Tegal Barat, Kota Tegal",2025-05-22 13:38:32
dr HERYANTO SYAMSUDIN SP. KK,Sp. Kulit & Kelamin,RS Pelabuhan Jakarta Utara,"Koja, Jakarta Utara",2025-05-22 13:38:32
"dr. Hasnikmah Mappamasing, Sp.KK(K)., M.Kes., FINSDV",Sp. Kulit & Kelamin,Mayapada Hospital Surabaya,"Sawahan, Kota Surabaya",2025-05-22 13:38:32
"dr. Hendra Gunawan, Sp.KK, (K), Ph.D",Sp. Kulit & Kelamin,RS Advent Bandung,"Coblong, Kota Bandung",2025-05-22 13:38:32
"dr. I Ketut Darya Artana, Sp.KK",Sp. Kulit & Kelamin,Siloam Hospitals Lippo Cikarang,"Cikarang Selatan, Kabupaten Bekasi",2025-05-22 13:38:32
"dr. Icha Aisyah, M.Ked Klin., Sp.KK",Sp. Kulit & Kelamin,Siloam Hospitals Mataram,"Mataram, Kota Mataram",2025-05-22 13:38:32
"dr. Ika Fatimah Damayanti, Sp.KK., M.SC",Sp. Kulit & Kelamin,Siloam Hospitals Yogyakarta,"Gondokusuman, Kota Yogyakarta",2025-05-22 13:38:32
"dr. Imelda Tresia Pardede, M. Gizi, Sp.KK",Sp. Kulit & Kelamin,RS Mitra Keluarga Kelapa Gading,"Kelapa Gading, Jakarta Utara",2025-05-22 13:38:32
"dr. Inda Astri Aryani, Sp.KK., FINSDV",Sp. Kulit & Kelamin,Siloam Hospitals Sriwijaya Palembang,"Ilir Barat I, Kota Palembang",2025-05-22 13:38:34
dr. Indra SM Manulang Sp. DV,Sp. Kulit & Kelamin,Siloam Hospitals Lippo Cikarang,"Cikarang Selatan, Kabupaten Bekasi",2025-05-22 13:38:34
"dr. Indrawati Widjaja, Sp.KK, FINSDV, FAADV",Sp. Kulit & Kelamin,RS Mitra Keluarga Kelapa Gading,"Kelapa Gading, Jakarta Utara",2025-05-22 13:38:34
"dr. Ineke Winda Ferianasari, Sp.KK., M.Kes",Sp. Kulit & Kelamin,Siloam Hospitals Lippo Cikarang,"Cikarang Selatan, Kabupaten Bekasi",2025-05-22 13:38:34
"dr. Irma Suryani Idris, Sp.KK",Sp. Kulit & Kelamin,Siloam Hospitals Makassar,"Ujung Pandang, Kota Makassar",2025-05-22 13:38:34
dr. Irvan Satyawan SpKK,Sp. Kulit & Kelamin,Siloam Hospitals Kebon Jeruk,"Kebon Jeruk, Jakarta Barat",2025-05-22 13:38:34
dr. Irvan Satyawan SpKK,Sp. Kulit & Kelamin,Siloam Hospitals Kebon Jeruk,"Kebon Jeruk, Jakarta Barat",2025-05-22 13:38:34
"dr. Irvan Satyawan, Sp. KK",Sp. Kulit & Kelamin,Siloam Hospitals Kebon Jeruk,"Kebon Jeruk, Jakarta Barat",2025-05-22 13:38:34
Dr. Ivan Daniel Banjarnahor Sp.D.V.E,Sp. Kulit & Kelamin,RS Immanuel,"Bojongloa Kidul, Kota Bandung",2025-05-22 13:38:34
"dr. Ivan Daniel Banjarnahor, Sp.DV (Khusus Praktek Sore)",Sp. Kulit & Kelamin,RS Immanuel,"Bojongloa Kidul, Kota Bandung",2025-05-22 13:38:34
"dr. Ivana Sugiarto, M.Biomed., Sp.KK",Sp. Kulit & Kelamin,RS Mitra Keluarga Kenjeran,"Mulyorejo, Kota Surabaya",2025-05-22 13:38:36
"dr. Jadaru Pudjiwati, Sp.KK",Sp. Kulit & Kelamin,RS Mitra Keluarga Bekasi,"Bekasi Selatan, Bekasi",2025-05-22 13:38:36
dr. Jessica Lie Sp.DVE,Sp. Kulit & Kelamin,RS Pluit,"Penjaringan, Jakarta Utara",2025-05-22 13:38:36
"dr. Jhauharina Rizki Fadhilla, Sp.DV",Sp. Kulit & Kelamin,Siloam Hospitals Mampang,"Pancoran, Jakarta Selatan",2025-05-22 13:38:36
"dr. Joice Sonya Gani Panjaitan, Sp.KK",Sp. Kulit & Kelamin,Siloam Hospitals Dhirga Surya Medan,"Medan Petisah, Kota Medan",2025-05-22 13:38:36
"dr. Juliana, Sp.KK",Sp. Kulit & Kelamin,Mayapada Hospital Kuningan,"Setiabudi, Jakarta Selatan",2025-05-22 13:38:36
dr. Ketut Darya Artana Sp.KK,Sp. Kulit & Kelamin,Siloam Hospitals Lippo Cikarang,"Cikarang Selatan, Kabupaten Bekasi",2025-05-22 13:38:36
"dr. Kharina Yufin Putri, Sp.KK",Sp. Kulit & Kelamin,Siloam Hospitals Dhirga Surya Medan,"Medan Petisah, Kota Medan",2025-05-22 13:38:36
"dr. Kinanti Prabawaningrum, Sp.DV",Sp. Kulit & Kelamin,RS Mitra Keluarga Surabaya,"Sukomanunggal, Kota Surabaya",2025-05-22 13:38:36
"dr. Kun Dewi Wulandari, Sp.KK",Sp. Kulit & Kelamin,RS Mitra Keluarga Pratama Jatiasih,"Jatiasih, Bekasi",2025-05-22 13:38:36
dr. Laksmi Duarsa Sp. KK,Sp. Kulit & Kelamin,BIMC Hospitals Kuta,"Kuta, Kabupaten Badung",2025-05-22 13:38:38
"dr. Lia Kinasih Ayuningati, Sp.KK",Sp. Kulit & Kelamin,RS Mitra Keluarga Kenjeran,"Mulyorejo, Kota Surabaya",2025-05-22 13:38:38
"dr. Liem Fenny, Sp.KK",Sp. Kulit & Kelamin,RS Immanuel,"Bojongloa Kidul, Kota Bandung",2025-05-22 13:38:38
"dr. Lorettha Wijaya, Sp.KK",Sp. Kulit & Kelamin,Siloam Hospitals Kebon Jeruk,"Kebon Jeruk, Jakarta Barat",2025-05-22 13:38:38
"dr. Lulu Dwiarti Ningtias , Sp.DV",Sp. Kulit & Kelamin,RS Mitra Keluarga Bekasi,"Bekasi Selatan, Bekasi",2025-05-22 13:38:38
"dr. Lunni Gayatri, Sp.KK",Sp. Kulit & Kelamin,RS Mitra Keluarga Waru,"Waru, Kabupaten Sidoarjo",2025-05-22 13:38:38
"dr. Lusia Dameria, Sp.KK",Sp. Kulit & Kelamin,RS Mitra Keluarga Gading Serpong,"Pagedangan, Kabupaten Tangerang",2025-05-22 13:38:38
dr Lydia Kurniasari Sp. DV,Sp. Kulit & Kelamin,RSU Fikri Medika,"Klari, Kabupaten Karawang",2025-05-22 13:38:38
"dr. MARIA M HERMAWAN, Sp.DVE M.Kes",Sp. Kulit & Kelamin,Lab Pramita Tasikmalaya,"Tawang, Kota Tasikmalaya",2025-05-22 13:38:38
"dr. Maria Leleury, Sp.DV",Sp. Kulit & Kelamin,RS Mitra Keluarga Cikarang,"Cikarang Utara, Kabupaten Bekasi",2025-05-22 13:38:38
dr. Maria Magdalena Yustin Sumito,Sp. Kulit & Kelamin,RS Harapan Bunda Jakarta,"Ciracas, Jakarta Timur",2025-05-22 13:38:40
"dr. Maria Magdalena Yustin Sumito, Sp.DV",Sp. Kulit & Kelamin,RS Harapan Bunda Jakarta,"Ciracas, Jakarta Timur",2025-05-22 13:38:40
"dr. Marselia Alkadri, Sp.KK",Sp. Kulit & Kelamin,Siloam Hospitals Sriwijaya Palembang,"Ilir Barat I, Kota Palembang",2025-05-22 13:38:40
"dr. Martinus, Sp.KK",Sp. Kulit & Kelamin,Mayapada Hospital Kuningan,"Setiabudi, Jakarta Selatan",2025-05-22 13:38:40
"dr. Mirawati Setyorini, Sp.KK Sp.KK",Sp. Kulit & Kelamin,Klinik Utama White Jasmine,"Pancoran, Jakarta Selatan",2025-05-22 13:38:40
"dr. Mutia Devi, Sp.KK",Sp. Kulit & Kelamin,Siloam Hospitals Sriwijaya Palembang,"Ilir Barat I, Kota Palembang",2025-05-22 13:38:40
"dr NUHRASANAH, SpKK",Sp. Kulit & Kelamin,RS Bayukarta,"Karawang Barat, Kabupaten Karawang",2025-05-22 13:38:40
"dr. Netty Sukmawati, Sp.KK",Sp. Kulit & Kelamin,Siloam Hospitals Jember,"Kaliwates, Kabupaten Jember",2025-05-22 13:38:40
dr. Ni Kadek Tuty Armini Sp.KK. M.Biomed,Sp. Kulit & Kelamin,Siloam Hospitals Labuan Bajo,"Komodo, Kabupaten Manggarai Barat",2025-05-22 13:38:40
"dr. Nila Puspasari Kunta Adjie, M.Biomed., Sp.KK",Sp. Kulit & Kelamin,RS Mitra Keluarga Kemayoran,"Kemayoran, Jakarta Pusat",2025-05-22 13:38:40
"dr. Noerrama Trimoerti Wirjohatmodjo, Sp.KK",Sp. Kulit & Kelamin,Mayapada Hospital Jakarta Selatan,"Cilandak, Jakarta Selatan",2025-05-22 13:38:42
dr. Nofilia citra candra SP DV,Sp. Kulit & Kelamin,RS Taman Harapan Baru,"Medan Satria, Bekasi",2025-05-22 13:38:42
"dr. Nur Fithria Ikaputri, Sp.KK",Sp. Kulit & Kelamin,RS Mitra Keluarga Kenjeran,"Mulyorejo, Kota Surabaya",2025-05-22 13:38:42
"dr. Nurul Rumila Roem, Sp.KK",Sp. Kulit & Kelamin,Siloam Hospitals Makassar,"Ujung Pandang, Kota Makassar",2025-05-22 13:38:42
"dr. Oliviti Natali, Sp.KK",Sp. Kulit & Kelamin,Siloam Hospitals Dhirga Surya Medan,"Medan Petisah, Kota Medan",2025-05-22 13:38:42
"dr. Poppy Syafnita, Sp.KK, FINSDV",Sp. Kulit & Kelamin,RS Mitra Keluarga Kemayoran,"Kemayoran, Jakarta Pusat",2025-05-22 13:38:42
"dr. Prawindra Irawan, Sp.KK, M.Kes",Sp. Kulit & Kelamin,RS Immanuel,"Bojongloa Kidul, Kota Bandung",2025-05-22 13:38:42
"dr. Rachmah Diana Putri, Sp.DVE,MK",Sp. Kulit & Kelamin,Mayapada Hospital Bogor,"Bogor Timur, Bogor",2025-05-22 13:38:42
"dr. Rachmah Diana Putri, Sp.KK, M.Kes, FINSDV",Sp. Kulit & Kelamin,Mayapada Hospital Bogor,"Bogor Timur, Bogor",2025-05-22 13:38:42
"dr. Rachmah Diana Putri, SpDVE, MKes, FINSDV F",Sp. Kulit & Kelamin,Mayapada Hospital Bogor,"Bogor Timur, Bogor",2025-05-22 13:38:42
"dr. Raden Amir Hamzah, Sp.KK., M.Kes",Sp. Kulit & Kelamin,RS Immanuel,"Bojongloa Kidul, Kota Bandung",2025-05-22 13:38:44
"dr. Raden Ayu Lucia Devianty, Sp.KK",Sp. Kulit & Kelamin,Siloam Hospitals Sriwijaya Palembang,"Ilir Barat I, Kota Palembang",2025-05-22 13:38:44
"dr. Renata Mayangsari Pradina Paramita, Sp.KK",Sp. Kulit & Kelamin,RS Mitra Keluarga Surabaya,"Sukomanunggal, Kota Surabaya",2025-05-22 13:38:44
Dr. Retno Mustikaningsih Sp KK,Sp. Kulit & Kelamin,St. Antonius Pontianak,"Pontianak Kota, Kota Pontianak",2025-05-22 13:38:44
"dr. Retno Satuti, Sp.KK",Sp. Kulit & Kelamin,Siloam Hospitals Putera Bahagia Cirebon,"Harjamukti, Kota Cirebon",2025-05-22 13:38:44
"dr. Ridhawati Muchtar, Sp.KK",Sp. Kulit & Kelamin,RS Mitra Keluarga Bekasi Timur,"Bekasi Timur, Bekasi",2025-05-22 13:38:44
"dr. Rikimin Tedja, Sp.KK",Sp. Kulit & Kelamin,RS Mitra Keluarga Surabaya,"Sukomanunggal, Kota Surabaya",2025-05-22 13:38:44
"dr. Rima Tamara, Sp.KK",Sp. Kulit & Kelamin,Siloam Hospitals Lippo Cikarang,"Cikarang Selatan, Kabupaten Bekasi",2025-05-22 13:38:44
"dr. Rima Wardhani, Sp.KK",Sp. Kulit & Kelamin,RS Muhammadiyah Taman Puring,"Kebayoran Baru, Jakarta Selatan",2025-05-22 13:38:44
"dr. Rosita Sari Sutanto, Sp.KK",Sp. Kulit & Kelamin,RS Mitra Keluarga Surabaya,"Sukomanunggal, Kota Surabaya",2025-05-22 13:38:44
dr Rudi Hermawan P Sp.KK,Sp. Kulit & Kelamin,RS Permata Bekasi,"Mustika Jaya, Bekasi",2025-05-22 13:38:46
"Dr. dr. Savitri Restu Wardhani, Sp.KK",Sp. Kulit & Kelamin,RS Immanuel,"Bojongloa Kidul, Kota Bandung",2025-05-22 13:38:46
"dr. Selvi Chandra Gunawa, Sp.DV",Sp. Kulit & Kelamin,RS Mitra Keluarga Bintaro,"Pondok Aren, Tangerang Selatan",2025-05-22 13:38:46
Dr. Shela Mareta Sp.D.V.E,Sp. Kulit & Kelamin,RS Mitra Keluarga Grand Wisata,"Tambun Selatan, Kabupaten Bekasi",2025-05-22 13:38:46
"dr. Silvia Mandasari, Sp.DV",Sp. Kulit & Kelamin,RS Mitra Keluarga Pamulang,"Pamulang, Tangerang Selatan",2025-05-22 13:38:46
"dr. Siti Efrida Fiqnasyani, Sp. DVE",Sp. Kulit & Kelamin,RS Baptis Kediri,"Pesantren, Kota Kediri",2025-05-22 13:38:46
"Dr. dr. Sri Linuwih Menaldi, Sp.KK (K)",Sp. Kulit & Kelamin,RS Mitra Keluarga Kelapa Gading,"Kelapa Gading, Jakarta Utara",2025-05-22 13:38:46
"dr. Stephen Akihiro Wirya, Sp.KK",Sp. Kulit & Kelamin,Mayapada Hospital Kuningan,"Setiabudi, Jakarta Selatan",2025-05-22 13:38:46
"dr. Subagio, Sp.KK",Sp. Kulit & Kelamin,Siloam Hospitals Jambi,"Jambi Selatan, Kota Jambi",2025-05-22 13:38:46
"dr. Subijanto Widagdo, Sp.KK, FINSDV, FAADV",Sp. Kulit & Kelamin,Mayapada Hospital Jakarta Selatan,"Cilandak, Jakarta Selatan",2025-05-22 13:38:46
"Dr. dr. Sukmawati Tansil Tan, Sp.KK",Sp. Kulit & Kelamin,Mayapada Hospital Tangerang,"Tangerang, Tangerang",2025-05-22 13:38:49
dr. Sylvia Tan Sp.DVE,Sp. Kulit & Kelamin,Siloam Hospitals Lippo Village,"Kelapa Dua, Kabupaten Tangerang",2025-05-22 13:38:49
dr. Teguh Priyanto SpKK,Sp. Kulit & Kelamin,Siloam Hospitals Semarang,"Semarang Selatan, Kota Semarang",2025-05-22 13:38:49
"dr. Teguh Priyanto, Sp.KK",Sp. Kulit & Kelamin,Siloam Hospitals Semarang,"Semarang Selatan, Kota Semarang",2025-05-22 13:38:49
"Prof. Dr. dr. Theresia Saur Manna L. Toruan, Sp.KK (K)",Sp. Kulit & Kelamin,Siloam Hospitals Sriwijaya Palembang,"Ilir Barat I, Kota Palembang",2025-05-22 13:38:49
"dr. Tia Febrianti, Sp.KK",Sp. Kulit & Kelamin,RS Mitra Keluarga Kelapa Gading,"Kelapa Gading, Jakarta Utara",2025-05-22 13:38:49
Dr. Tjut Nurul Alam Jacoeb Sp KK,Sp. Kulit & Kelamin,RSIA Sammarie Basra,"Duren Sawit, Jakarta Timur",2025-05-22 13:38:49
"dr. Tjut Nurul Alam Jacoeb, Sp.KK (K)",Sp. Kulit & Kelamin,RSIA Sammarie Basra,"Duren Sawit, Jakarta Timur",2025-05-22 13:38:49
"dr. Tri Wilujeng, Sp.KK",Sp. Kulit & Kelamin,RS Pusat Pertamina,"Kebayoran Baru, Jakarta Selatan",2025-05-22 13:38:49
"Dr. Vania Vashti Lasrindy, Sp.KK",Sp. Kulit & Kelamin,Siloam Hospitals Bangka,"Pangkalan Baru,  Kabupaten Bangka Tengah",2025-05-22 13:38:49
"dr. Vonny Indriati Widjojo, Sp.KK",Sp. Kulit & Kelamin,RS Mitra Keluarga Bekasi Timur,"Bekasi Timur, Bekasi",2025-05-22 13:38:51
"dr. Wigih Wuryaningrum, Sp.KK",Sp. Kulit & Kelamin,RS Mitra Keluarga Waru,"Waru, Kabupaten Sidoarjo",2025-05-22 13:38:51
dr. Wilson Loginus SPKK,Sp. Kulit & Kelamin,RS Mitra Keluarga Bintaro,"Pondok Aren, Tangerang Selatan",2025-05-22 13:38:51
"dr. Wisnu Triadi Nugroho, Sp.DV",Sp. Kulit & Kelamin,RS Mitra Keluarga Pondok Tjandra,"Waru, Kabupaten Sidoarjo",2025-05-22 13:38:51
"dr. Wulan Yuwita, Sp.KK",Sp. Kulit & Kelamin,RS Immanuel,"Bojongloa Kidul, Kota Bandung",2025-05-22 13:38:51
"dr. Wulan Yuwita, Sp.KK (KHUSUS PRAKTEK SIANG)",Sp. Kulit & Kelamin,RS Immanuel,"Bojongloa Kidul, Kota Bandung",2025-05-22 13:38:51
"dr. Yeyen Yovita Mulyana, Sp. KK",Sp. Kulit & Kelamin,Siloam Hospitals Kebon Jeruk,"Kebon Jeruk, Jakarta Barat",2025-05-22 13:38:51
dr. Yuliana Teguh Sp.KK,Sp. Kulit & Kelamin,RS Mitra Medika Pontianak,"Pontianak Kota, Kota Pontianak",2025-05-22 13:38:51
"dr. Yuri Yogya, Sp.KK",Sp. Kulit & Kelamin,Siloam Hospitals Kebon Jeruk,"Kebon Jeruk, Jakarta Barat",2025-05-22 13:38:51
"dr. Amir Hamzah, Sp.KK",Sp. Kulit & Kelamin,Klinik Jaya Abadi,"Lengkong, Kota Bandung",2025-05-22 13:38:51
dr. Atika Kamilia Sp.DVE,Sp. Kulit & Kelamin,Mayapada Hospital Kuningan,"Setiabudi, Jakarta Selatan",2025-05-22 13:38:53
"dr. Dewi Lestarini, SpKK. MARS",Sp. Kulit & Kelamin,RS Puri Cinere,"Cinere, Depok",2025-05-22 13:38:53
"dr. Endang Soekmawati, SpKK",Sp. Kulit & Kelamin,RS Mardi Rahayu,"Jati, Kabupaten Kudus",2025-05-22 13:38:53
"dr. Evelyn, Sp.KK",Sp. Kulit & Kelamin,Tzu Chi Hospital,"Penjaringan, Jakarta Utara",2025-05-22 13:38:53
"dr. Fenny Leets Santoso, Sp.D.V.E",Sp. Kulit & Kelamin,National Hospital,"Wiyung, Kota Surabaya",2025-05-22 13:38:53
"dr. Gabriel Erny, Sp.KK",Sp. Kulit & Kelamin,RS Bethesda Yogyakarta,"Gondokusuman, Kota Yogyakarta",2025-05-22 13:38:53
"dr. Heryanto, Sp.KK",Sp. Kulit & Kelamin,RS Islam Jakarta Sukapura,"Cilincing, Jakarta Utara",2025-05-22 13:38:53
"dr. Kaorie Bunga Saviestya, Sp.DVE",Sp. Kulit & Kelamin,RS Delta Surya,"Sidoarjo, Kabupaten Sidoarjo",2025-05-22 13:38:53
"dr. Lusia Dameria, Sp.KK",Sp. Kulit & Kelamin,RS Mitra Keluarga Kelapa Gading,"Kelapa Gading, Jakarta Utara",2025-05-22 13:38:53
"dr. Melly Anggraeni Sembiring Meliala, Sp.DVE",Sp. Kulit & Kelamin,RS Cahya Kawaluyan,"Padalarang, Kabupaten Bandung Barat",2025-05-22 13:38:53
Dr. dr. Muljani Enggalhardjo SpDVE,Sp. Kulit & Kelamin,Siloam Hospitals Lippo Village,"Kelapa Dua, Kabupaten Tangerang",2025-05-22 13:38:55
"dr. Nanny Shoraya, Sp.KK",Sp. Kulit & Kelamin,RSAB Harapan Kita,"Palmerah, Jakarta Barat",2025-05-22 13:38:55
"dr. Primedhia Virdiono, SpKK",Sp. Kulit & Kelamin,RSIA Limijati,"Bandung Wetan, Kota Bandung",2025-05-22 13:38:55
"dr. Pusfana Meidelia, MM, SpKK",Sp. Kulit & Kelamin,RSIA Grha Bunda,"Kiaracondong, Kota Bandung",2025-05-22 13:38:55
"dr. Reni Fajarwati, Sp.KK",Sp. Kulit & Kelamin,RS Muhammadiyah Taman Puring,"Kebayoran Baru, Jakarta Selatan",2025-05-22 13:38:55
"dr. Sada Barira, Sp. DVE",Sp. Kulit & Kelamin,RS Awal Bros Batam,"Lubuk Baja, Kota Batam",2025-05-22 13:38:55
"dr. Syifa Komalasari, Sp.KK",Sp. Kulit & Kelamin,Ciputra Hospital Citra Raya Tangerang,"Panongan, Kabupaten Tangerang",2025-05-22 13:38:55
"dr. Vika Fintaru, Sp.DV",Sp. Kulit & Kelamin,RS Syafira,"Marpoyan Damai, Kota Pekanbaru",2025-05-22 13:38:55
"dr.Muljaningsih, Sp.DVE",Sp. Kulit & Kelamin,RS Cahya Kawaluyan,"Padalarang, Kabupaten Bandung Barat",2025-05-22 13:38:55
dr. tjut nurul alam Sp.DV,Sp. Kulit & Kelamin,RSIA Sammarie Basra,"Duren Sawit, Jakarta Timur",2025-05-22 13:38:55
Dr. A. Rina Angreni Sp.D.V.E,Sp. Kulit & Kelamin,halodoc,"Setiabudi, Jakarta Selatan",2025-05-22 13:38:57
Dr. A. Rina Angreni Sp.DV,Sp. Kulit & Kelamin,halodoc,"Setiabudi, Jakarta Selatan",2025-05-22 13:38:57
dr. Achmad Satya Negara Sp.D.V.,Sp. Kulit & Kelamin,RSU Permata Medika Kebumen.,"Kebumen, Kabupaten Kebumen",2025-05-22 13:38:57
dr. Achmad Satya Negara Sp.D.V.,Sp. Kulit & Kelamin,halodoc,"Setiabudi, Jakarta Selatan",2025-05-22 13:38:57
dr. Achmad Satya Negara Sp.D.V.,Sp. Kulit & Kelamin,RSU Permata Medika Kebumen.,"Kebumen, Kabupaten Kebumen",2025-05-22 13:38:57
dr. Achmad Satya Negara Sp.D.V.,Sp. Kulit & Kelamin,RSU Permata Medika Kebumen.,"Kebumen, Kabupaten Kebumen",2025-05-22 13:38:57
Dr. Achmad Satyanegara Sp.DV,Sp. Kulit & Kelamin,RSU Permata Medika Kebumen.,"Kebumen, Kabupaten Kebumen",2025-05-22 13:38:57
"Dr. Ade Fernandes M.Ked.Klin, Sp.D.V.E",Sp. Kulit & Kelamin,halodoc,"Setiabudi, Jakarta Selatan",2025-05-22 13:38:57
"Dr. Ade Fitriyani Lubis M.Ked(DV), Sp.D.V.E",Sp. Kulit & Kelamin,halodoc,"Setiabudi, Jakarta Selatan",2025-05-22 13:38:57
"Dr. Ade Indrayani Sp.D.V.E, M.Kes",Sp. Kulit & Kelamin,halodoc,"Setiabudi, Jakarta Selatan",2025-05-22 13:38:57
Dr. Adelia Hanung Puspaningtyas Sp.D.V.E,Sp. Kulit & Kelamin,halodoc,"Setiabudi, Jakarta Selatan",2025-05-22 13:38:59
Dr. Adelia Martalova Sp. DVE,Sp. Kulit & Kelamin,APOTEK AGUNG KOBAR,"Pontianak Kota, Kota Pontianak",2025-05-22 13:38:59
"Dr. Adi Agung Anantawijaya Daryago MM, Sp.D.V.E",Sp. Kulit & Kelamin,halodoc,"Setiabudi, Jakarta Selatan",2025-05-22 13:38:59
"Dr. Adi Agung Anantawijaya Daryago MM, Sp.KK",Sp. Kulit & Kelamin,halodoc,"Setiabudi, Jakarta Selatan",2025-05-22 13:38:59
Dr. Adityawarman Sp.DV,Sp. Kulit & Kelamin,Praktek dr.Aditya Akhmad Tri Pratama,"Cimaung, Kabupaten Bandung",2025-05-22 13:38:59
Dr. Adya Sitaresmi Sp.D.V.E,Sp. Kulit & Kelamin,halodoc,"Setiabudi, Jakarta Selatan",2025-05-22 13:38:59
Dr. Agita Danaparamita Dharsono Sp.D.V.E,Sp. Kulit & Kelamin,halodoc,"Setiabudi, Jakarta Selatan",2025-05-22 13:38:59
Dr. Agnes Kartini Sp.KK,Sp. Kulit & Kelamin,Apotek Kimia Farma Palmerah,"Palmerah, Jakarta Barat",2025-05-22 13:38:59
"Dr. Agnes Tasia Valentine M.Sc, Sp.DV",Sp. Kulit & Kelamin,halodoc,"Setiabudi, Jakarta Selatan",2025-05-22 13:38:59
"Dr. Agnes Tasia Valentine M.Sc, Sp.DV",Sp. Kulit & Kelamin,halodoc,"Setiabudi, Jakarta Selatan",2025-05-22 13:38:59
"Dr. Agnes Tasia Valentine M.Sc, Sp.D.V.E",Sp. Kulit & Kelamin,halodoc,"Setiabudi, Jakarta Selatan",2025-05-22 13:39:01
Dr. Agung Mohamad Rheza Sp.D.V.E,Sp. Kulit & Kelamin,halodoc,"Setiabudi, Jakarta Selatan",2025-05-22 13:39:01
Dr. Agung Triana Hartaty Sp.D.V.E,Sp. Kulit & Kelamin,halodoc,"Setiabudi, Jakarta Selatan",2025-05-22 13:39:01
