name,speciality,hospital,city,timestamp
Dr. Agustina Tripujiastuti Sp.D.V.E,Sp. Kulit & Kelamin,halodoc,"Setiabudi, Jakarta Selatan",2025-05-22 13:39:01
dr. Aidha Juniar Sp.DEV,Sp. Kulit & Kelamin,halodoc,"Setiabudi, Jakarta Selatan",2025-05-22 13:39:01
dr. Albert Susanto Sp.KK,Sp. Kulit & Kelamin,"PRAKTEK Dr. ALBERT SUSANTO, SpKK","Tangerang, Tangerang",2025-05-22 13:39:01
"dr. Albert Susanto, Sp.KK",Sp. Kulit & Kelamin,"PRAKTEK Dr. ALBERT SUSANTO, SpKK","Tangerang, Tangerang",2025-05-22 13:39:01
dr. Alexander Chandra Sp.KK,Sp. Kulit & Kelamin,halodoc,"Setiabudi, Jakarta Selatan",2025-05-22 13:39:01
Dr. Alfred Setyono Sp.D.V.E,Sp. Kulit & Kelamin,halodoc,"Setiabudi, Jakarta Selatan",2025-05-22 13:39:01
"Dr. Alvian Arifin Saiboo M.Ked.Klin, Sp.D.V.E",Sp. Kulit & Kelamin,halodoc,"Setiabudi, Jakarta Selatan",2025-05-22 13:39:01
Dr. Amalia Rositawati Sp.D.V.E,Sp. Kulit & Kelamin,halodoc,"Setiabudi, Jakarta Selatan",2025-05-22 13:39:03
Dr. Amalia Rositawati Sp.KK,Sp. Kulit & Kelamin,halodoc,"Setiabudi, Jakarta Selatan",2025-05-22 13:39:03
Dr. Ambar Aliwardani Sp.D.V.E,Sp. Kulit & Kelamin,halodoc,"Setiabudi, Jakarta Selatan",2025-05-22 13:39:03
Dr. Ambar Aliwardani Sp.DV,Sp. Kulit & Kelamin,halodoc,"Setiabudi, Jakarta Selatan",2025-05-22 13:39:03
Dr. Amelia Frischananta Sp.D.V.E,Sp. Kulit & Kelamin,halodoc,"Setiabudi, Jakarta Selatan",2025-05-22 13:39:03
Dr. Amelia Setiawati Soebyanto Sp.D.V.E,Sp. Kulit & Kelamin,halodoc,"Setiabudi, Jakarta Selatan",2025-05-22 13:39:03
Dr. Anak Agung Gede Kresna Naria Putra Sp.D.V.E,Sp. Kulit & Kelamin,halodoc,"Setiabudi, Jakarta Selatan",2025-05-22 13:39:03
Dr. Ance Imelda Betaubun Sp.D.V.E,Sp. Kulit & Kelamin,halodoc,"Setiabudi, Jakarta Selatan",2025-05-22 13:39:03
Dr. Andi Hardianty Sp.D.V.E,Sp. Kulit & Kelamin,halodoc,"Setiabudi, Jakarta Selatan",2025-05-22 13:39:03
Dr. Andi Nurhaerani Zainuddin Sp.D.V.E,Sp. Kulit & Kelamin,halodoc,"Setiabudi, Jakarta Selatan",2025-05-22 13:39:03
Dr. Andi Nurhaerani Zainuddin Sp.DV,Sp. Kulit & Kelamin,halodoc,"Setiabudi, Jakarta Selatan",2025-05-22 13:39:05
Dr. Andi Putri Dahliana Sp.D.V.E,Sp. Kulit & Kelamin,halodoc,"Setiabudi, Jakarta Selatan",2025-05-22 13:39:05
Dr. Andravita Fenti Mitaart Sp.D.V.E,Sp. Kulit & Kelamin,halodoc,"Setiabudi, Jakarta Selatan",2025-05-22 13:39:05
"dr. Andravita Fenti Mitaart, Sp.KK",Sp. Kulit & Kelamin,Siloam Hospitals Balikpapan,"Balikpapan Selatan, Kota Balikpapan",2025-05-22 13:39:05
"Dr. Andre Yuindartanto Sp.DV, M.Ked.Klin",Sp. Kulit & Kelamin,halodoc,"Setiabudi, Jakarta Selatan",2025-05-22 13:39:05
"Dr. Andy Manggabarani Sp.D.V.E, M.Kes, FINSDV",Sp. Kulit & Kelamin,halodoc,"Setiabudi, Jakarta Selatan",2025-05-22 13:39:05
"Dr. Angela Sandi Tagaroi Rahasia M.Biomed, Sp.D.V.E",Sp. Kulit & Kelamin,halodoc,"Setiabudi, Jakarta Selatan",2025-05-22 13:39:05
Dr. Anita Berliana Sp.D.V.E,Sp. Kulit & Kelamin,halodoc,"Setiabudi, Jakarta Selatan",2025-05-22 13:39:05
Dr. Annisa Anjani Ramadhan Sp.D.V.E,Sp. Kulit & Kelamin,halodoc,"Setiabudi, Jakarta Selatan",2025-05-22 13:39:05
Dr. Annisa Fildza Hashfi Sp.D.V.E,Sp. Kulit & Kelamin,halodoc,"Setiabudi, Jakarta Selatan",2025-05-22 13:39:05
Dr. Annisa Sundani Sp.D.V.E,Sp. Kulit & Kelamin,halodoc,"Setiabudi, Jakarta Selatan",2025-05-22 13:39:07
Dr. Anthony Surya Wibawa Darmawan Sp.D.V.E,Sp. Kulit & Kelamin,halodoc,"Setiabudi, Jakarta Selatan",2025-05-22 13:39:07
"Dr. Ar. Ridha Hutami Putri M.Ked(DV), Sp.DV",Sp. Kulit & Kelamin,halodoc,"Setiabudi, Jakarta Selatan",2025-05-22 13:39:07
Dr. Ardelia Dyah Ayu Puspita Sari Sp.D.V.E,Sp. Kulit & Kelamin,halodoc,"Setiabudi, Jakarta Selatan",2025-05-22 13:39:07
Dr. Ardelia Dyah Ayu Puspita Sari Sp.DV,Sp. Kulit & Kelamin,halodoc,"Setiabudi, Jakarta Selatan",2025-05-22 13:39:07
"Dr. Arifiana Wungu Kartika Dewi M.Ked.Klin., Sp.D.V.E",Sp. Kulit & Kelamin,halodoc,"Setiabudi, Jakarta Selatan",2025-05-22 13:39:07
Dr. Arisia Fadila Sp.D.V.E,Sp. Kulit & Kelamin,halodoc,"Setiabudi, Jakarta Selatan",2025-05-22 13:39:07
"Dr. Armyta Denissafitri M.Ked.Klin, Sp.D.V.E",Sp. Kulit & Kelamin,halodoc,"Setiabudi, Jakarta Selatan",2025-05-22 13:39:07
Dr. Asmahani Thohiroh Sp.D.V.E,Sp. Kulit & Kelamin,halodoc,"Setiabudi, Jakarta Selatan",2025-05-22 13:39:07
dr. Astri Adelia Sp.DV,Sp. Kulit & Kelamin,RS Adhyaksa Jakarta,"Kramat Jati, Jakarta Timur",2025-05-22 13:39:07
Dr. Asvina Anis Sp.D.V.E,Sp. Kulit & Kelamin,halodoc,"Setiabudi, Jakarta Selatan",2025-05-22 13:39:09
Dr. Asvina Anis Sp.DV,Sp. Kulit & Kelamin,halodoc,"Setiabudi, Jakarta Selatan",2025-05-22 13:39:09
Dr. Atika Damayanti SP DV,Sp. Kulit & Kelamin,Skin 3 Clinic,"Kramat Jati, Jakarta Timur",2025-05-22 13:39:09
Dr. Atika Kamilia Sp.D.V.E,Sp. Kulit & Kelamin,halodoc,"Setiabudi, Jakarta Selatan",2025-05-22 13:39:09
Dr. Audi Sugiharto Sp.D.V.E,Sp. Kulit & Kelamin,halodoc,"Setiabudi, Jakarta Selatan",2025-05-22 13:39:09
Dr. Aulia Rahman Sp.DV,Sp. Kulit & Kelamin,halodoc,"Setiabudi, Jakarta Selatan",2025-05-22 13:39:09
Dr. Aulia Rosa Amelinda Sp.D.V.E,Sp. Kulit & Kelamin,halodoc,"Setiabudi, Jakarta Selatan",2025-05-22 13:39:09
Dr. Ayuda Febriliani Mardana Sp.D.V.E,Sp. Kulit & Kelamin,halodoc,"Setiabudi, Jakarta Selatan",2025-05-22 13:39:09
Dr. Ayunita Mayasari Sp.D.V.E,Sp. Kulit & Kelamin,halodoc,"Setiabudi, Jakarta Selatan",2025-05-22 13:39:09
"Dr. Benjamin Ricardo M.Ked(DV), Sp.D.V.E",Sp. Kulit & Kelamin,halodoc,"Setiabudi, Jakarta Selatan",2025-05-22 13:39:09
"dr. Benjamin Ricardo R. Lbn Tobing, M.Ked(DV) SpDV",Sp. Kulit & Kelamin,RS St. Carolus Salemba,"Senen, Jakarta Pusat",2025-05-22 13:39:12
"dr. Benny Winata, Sp.KK",Sp. Kulit & Kelamin,Siloam Hospitals Balikpapan,"Balikpapan Selatan, Kota Balikpapan",2025-05-22 13:39:12
Dr. Bobby Febrianto Sp.D.V.E,Sp. Kulit & Kelamin,halodoc,"Setiabudi, Jakarta Selatan",2025-05-22 13:39:12
"Dr. Boy Ardi Rohanda M.Ked(DV), Sp.D.V.E",Sp. Kulit & Kelamin,halodoc,"Setiabudi, Jakarta Selatan",2025-05-22 13:39:12
Dr. Brigita Ika R. Sp.D.V.E,Sp. Kulit & Kelamin,halodoc,"Setiabudi, Jakarta Selatan",2025-05-22 13:39:12
Dr. Budi Satria Sp.D.V.E,Sp. Kulit & Kelamin,halodoc,"Setiabudi, Jakarta Selatan",2025-05-22 13:39:12
"Dr. Calvin Santosa M.Biomed, Sp.D.V.E",Sp. Kulit & Kelamin,RS St. Carolus Salemba,"Senen, Jakarta Pusat",2025-05-22 13:39:12
Dr. Caroline Budiman Sp.D.V.E,Sp. Kulit & Kelamin,halodoc,"Setiabudi, Jakarta Selatan",2025-05-22 13:39:12
Dr. Caroline Oktarina Sp.D.V.E,Sp. Kulit & Kelamin,halodoc,"Setiabudi, Jakarta Selatan",2025-05-22 13:39:12
"Dr. Charly Meilany Korompis M.Kes, Sp.D.V.E",Sp. Kulit & Kelamin,halodoc,"Setiabudi, Jakarta Selatan",2025-05-22 13:39:12
Dr. Christa Claudia Sondakh Sp.D.V.E,Sp. Kulit & Kelamin,halodoc,"Setiabudi, Jakarta Selatan",2025-05-22 13:39:14
Dr. Christina Indrayanti Sp.D.V.E,Sp. Kulit & Kelamin,halodoc,"Setiabudi, Jakarta Selatan",2025-05-22 13:39:14
Dr. Christopher Toshihiro Wirya Sp.D.V.E,Sp. Kulit & Kelamin,halodoc,"Setiabudi, Jakarta Selatan",2025-05-22 13:39:14
dr. Christopher Toshihiro Wirya Sp.DVE,Sp. Kulit & Kelamin,DVX Medical Clinic Jakarta Selatan,"Kebayoran Baru, Jakarta Selatan",2025-05-22 13:39:14
"Dr. Citra Dwi Harningtyas Sp.D.V.E, M.Ked.Klin",Sp. Kulit & Kelamin,halodoc,"Setiabudi, Jakarta Selatan",2025-05-22 13:39:14
"Dr. Cut Samira Samsul M.Ked(DV), Sp.D.V.E",Sp. Kulit & Kelamin,halodoc,"Setiabudi, Jakarta Selatan",2025-05-22 13:39:14
Dr. Cynthia Natalia Wibowo Sp.D.V.E,Sp. Kulit & Kelamin,halodoc,"Setiabudi, Jakarta Selatan",2025-05-22 13:39:14
Dr. Cynthia Oktarisza Sp.D.V.E,Sp. Kulit & Kelamin,halodoc,"Setiabudi, Jakarta Selatan",2025-05-22 13:39:14
Dr. Cyntya Sari Sovianti Sp.D.V.E,Sp. Kulit & Kelamin,halodoc,"Setiabudi, Jakarta Selatan",2025-05-22 13:39:14
"Dr. Danny Gunawan Sp.D.V.E, FINSDV",Sp. Kulit & Kelamin,halodoc,"Setiabudi, Jakarta Selatan",2025-05-22 13:39:14
Dr. Danu Yuliarto Sp.D.V.E,Sp. Kulit & Kelamin,halodoc,"Setiabudi, Jakarta Selatan",2025-05-22 13:39:16
Dr. Deisy Vania Kianindra Sp.D.V.E,Sp. Kulit & Kelamin,halodoc,"Setiabudi, Jakarta Selatan",2025-05-22 13:39:16
Dr. Desak Nyoman Trisepti Utami Sp.D.V.E,Sp. Kulit & Kelamin,halodoc,"Setiabudi, Jakarta Selatan",2025-05-22 13:39:16
"Dr. Desiana Widityaning Sari M.Ked.Klin, Sp.D.V.E",Sp. Kulit & Kelamin,halodoc,"Setiabudi, Jakarta Selatan",2025-05-22 13:39:16
"dr. Detty Dwi K, Sp.DV",Sp. Kulit & Kelamin,halodoc,"Setiabudi, Jakarta Selatan",2025-05-22 13:39:16
Dr. Devy Caroline Sp.D.V.E,Sp. Kulit & Kelamin,halodoc,"Setiabudi, Jakarta Selatan",2025-05-22 13:39:16
Dr. Dewi Nur Komalasari Sp.D.V.E,Sp. Kulit & Kelamin,halodoc,"Setiabudi, Jakarta Selatan",2025-05-22 13:39:16
Dr. Dhamayanti R.D Sp.KK,Sp. Kulit & Kelamin,Praktek dokter bersama-,"Ciawi, Kabupaten Bogor",2025-05-22 13:39:16
"Dr. Dhea Medisika Hertanti M.Ked.Klin, Sp.D.V.E",Sp. Kulit & Kelamin,halodoc,"Setiabudi, Jakarta Selatan",2025-05-22 13:39:16
Dr. Dhian Takarina Sp.D.V.E,Sp. Kulit & Kelamin,halodoc,"Setiabudi, Jakarta Selatan",2025-05-22 13:39:16
"Dr. Diah Ngesti Kumalasari Sp.D.V.E., M.Ked.klin",Sp. Kulit & Kelamin,halodoc,"Setiabudi, Jakarta Selatan",2025-05-22 13:39:18
Dr. Diah Shinta Kartikasari Sp.D.V.E,Sp. Kulit & Kelamin,halodoc,"Setiabudi, Jakarta Selatan",2025-05-22 13:39:18
"Dr. Dian Erisyawanty M.Kes, Sp.D.V.E",Sp. Kulit & Kelamin,halodoc,"Setiabudi, Jakarta Selatan",2025-05-22 13:39:18
"Dr. Dian Erisyawanty, M.Kes, Sp.D.V.E",Sp. Kulit & Kelamin,Halodoc Teleconsultation,"Setiabudi, Jakarta Selatan",2025-05-22 13:39:18
dr. Dian Mariasari SPKKL,Sp. Kulit & Kelamin,Praktek Pribadi dr. Dian Mariasari Sp.KKLP,"Bandar Mataram, Kabupaten Lampung Tengah",2025-05-22 13:39:18
Dr. Dina Febriani Sp.D.V.E,Sp. Kulit & Kelamin,halodoc,"Setiabudi, Jakarta Selatan",2025-05-22 13:39:18
Dr. Dina Febriani Sp.DV,Sp. Kulit & Kelamin,halodoc,"Setiabudi, Jakarta Selatan",2025-05-22 13:39:18
dr. Dina Udayani Swadeshi SpDV,Sp. Kulit & Kelamin,halodoc,"Setiabudi, Jakarta Selatan",2025-05-22 13:39:18
Dr. Ditta Harnindya Purwadi Sp.D.V.E,Sp. Kulit & Kelamin,halodoc,"Setiabudi, Jakarta Selatan",2025-05-22 13:39:18
"Dr. Agnes Tasia Valentine M.Sc, Sp.DV",Sp. Kulit & Kelamin,halodoc,"Setiabudi, Jakarta Selatan",2025-05-22 13:39:18
Dr. Arie Kusumawardani SpKK,Sp. Kulit & Kelamin,Dr. Arie Kusumawardani SpKK,"Serengan, Kota Surakarta",2025-05-22 13:39:20
"Dr. Carolina, Sp Dve",Sp. Kulit & Kelamin,0,"Bekasi Selatan, Bekasi",2025-05-22 13:39:20
"Dr. David Sudarto Oeiria, Sp.DVE",Sp. Kulit & Kelamin,"Dr. David Sudarto Oeiria, Sp.DVE","Tegalsari, Kota Surabaya",2025-05-22 13:39:20
"Dr. Duma Wenty Irene Sinambela M.Ked(DV), Sp.D.V.E",Sp. Kulit & Kelamin,halodoc,"Setiabudi, Jakarta Selatan",2025-05-22 13:39:20
Dr. Dyah Ayu Nirmalasari Sp.D.V.E,Sp. Kulit & Kelamin,halodoc,"Setiabudi, Jakarta Selatan",2025-05-22 13:39:20
"Dr. Dyah Ayu S M.Sc, Sp.D.V.E",Sp. Kulit & Kelamin,halodoc,"Setiabudi, Jakarta Selatan",2025-05-22 13:39:20
DR. ENDANG SOEKMAWATI Sp KK,Sp. Kulit & Kelamin,Praktek dokter.,"Bukit Raya, Kota Pekanbaru",2025-05-22 13:39:20
Dr. Eka Devinta Novi Diana Sp.D.V.E,Sp. Kulit & Kelamin,halodoc,"Setiabudi, Jakarta Selatan",2025-05-22 13:39:20
Dr. Elin Herlina Sp.D.V.E,Sp. Kulit & Kelamin,halodoc,"Setiabudi, Jakarta Selatan",2025-05-22 13:39:20
Dr. Elin Herlina Sp.D.V.E,Sp. Kulit & Kelamin,halodoc,"Setiabudi, Jakarta Selatan",2025-05-22 13:39:20
Dr. Elisabeth Ryan Sp.D.V.E,Sp. Kulit & Kelamin,halodoc,"Setiabudi, Jakarta Selatan",2025-05-22 13:39:22
Dr. Ellen Gunawan Sp.D.V.E,Sp. Kulit & Kelamin,halodoc,"Setiabudi, Jakarta Selatan",2025-05-22 13:39:22
Dr. Elok Nurfaiqoh Sp.D.V.E,Sp. Kulit & Kelamin,halodoc,"Setiabudi, Jakarta Selatan",2025-05-22 13:39:22
dr Endang Hariadi Sp.KK,Sp. Kulit & Kelamin,Dr endang Hariadi Sp.KK,"Magelang Tengah, Kota Magelang",2025-05-22 13:39:22
dr. Ennesta Asri Sp. KK,Sp. Kulit & Kelamin,Praktek Pribadi dr. Ernesta Asri Sp.KK,"Setiabudi, Jakarta Selatan",2025-05-22 13:39:22
Dr. Epi Panjaitan Sp.D.V.E,Sp. Kulit & Kelamin,halodoc,"Setiabudi, Jakarta Selatan",2025-05-22 13:39:22
dr. Epi Panjaitan Sp.KK,Sp. Kulit & Kelamin,Halodoc Teleconsultation,"Setiabudi, Jakarta Selatan",2025-05-22 13:39:22
Dr. Erien Afrinia Asri Sp.D.V.E,Sp. Kulit & Kelamin,halodoc,"Setiabudi, Jakarta Selatan",2025-05-22 13:39:22
"Dr. Erivia D Pangkahila M.Biomed, Sp.KK",Sp. Kulit & Kelamin,halodoc,"Setiabudi, Jakarta Selatan",2025-05-22 13:39:22
Dr. Erlian Dimas Anggraini Sp.D.V.E,Sp. Kulit & Kelamin,halodoc,"Setiabudi, Jakarta Selatan",2025-05-22 13:39:22
"Dr. Ervina Rosmarwati M.Biomed, Sp.D.V.E",Sp. Kulit & Kelamin,halodoc,"Setiabudi, Jakarta Selatan",2025-05-22 13:39:24
Dr. Eunice Gunawan Sp.D.V.E,Sp. Kulit & Kelamin,halodoc,"Setiabudi, Jakarta Selatan",2025-05-22 13:39:24
Dr. Eunice Gunawan Sp.DV,Sp. Kulit & Kelamin,halodoc,"Setiabudi, Jakarta Selatan",2025-05-22 13:39:24
"dr. F.X. Sutardi Santosa, Sp.KK, FINSDV",Sp. Kulit & Kelamin,RS St. Carolus Salemba,"Senen, Jakarta Pusat",2025-05-22 13:39:24
"Dr. Fadhli Aulia Mughni MSc, Sp.D.V.E",Sp. Kulit & Kelamin,halodoc,"Setiabudi, Jakarta Selatan",2025-05-22 13:39:24
"dr. Fanny Bratadjaja, Sp.KK",Sp. Kulit & Kelamin,RS St. Carolus Salemba,"Senen, Jakarta Pusat",2025-05-22 13:39:24
Dr. Farah MF Sp.D.V.E,Sp. Kulit & Kelamin,halodoc,"Setiabudi, Jakarta Selatan",2025-05-22 13:39:24
Dr. Farah MF Sp.DV,Sp. Kulit & Kelamin,halodoc,"Setiabudi, Jakarta Selatan",2025-05-22 13:39:24
Dr. Fauzana Nazifah Sp.D.V.E,Sp. Kulit & Kelamin,halodoc,"Setiabudi, Jakarta Selatan",2025-05-22 13:39:24
dr Febrina Sp. KK,Sp. Kulit & Kelamin,APOTEK LIDO,"Koja, Jakarta Utara",2025-05-22 13:39:24
dr. Febrina R P M Sp.KK,Sp. Kulit & Kelamin,APOTEK LIDO,"Koja, Jakarta Utara",2025-05-22 13:39:27
"Dr. Febrina Tritama Kurniasih M.Ked(DV), Sp.D.V.E",Sp. Kulit & Kelamin,halodoc,"Setiabudi, Jakarta Selatan",2025-05-22 13:39:27
"dr. Febrina, P.M.Sc. Sp.KK",Sp. Kulit & Kelamin,APOTEK LIDO,"Koja, Jakarta Utara",2025-05-22 13:39:27
"Dr. Felicia Oei M.Ked(DV), Sp.D.V.E",Sp. Kulit & Kelamin,halodoc,"Setiabudi, Jakarta Selatan",2025-05-22 13:39:27
"Dr. Fenni Rinanda Sp.KK, M.Ked(DV)",Sp. Kulit & Kelamin,halodoc,"Setiabudi, Jakarta Selatan",2025-05-22 13:39:27
dr. Fifi Mithahuda Sp. KK,Sp. Kulit & Kelamin,RSUD Tugu Koja,"Koja, Jakarta Utara",2025-05-22 13:39:27
dr. Finisia Angkasa Sp DV,Sp. Kulit & Kelamin,Apotik Asean Jaya,"Medan Kota, Kota Medan",2025-05-22 13:39:27
Dr. Firman Parrol Sp.D.V.E,Sp. Kulit & Kelamin,halodoc,"Setiabudi, Jakarta Selatan",2025-05-22 13:39:27
Dr. Firsza Yulina Endah Budiati Sp.D.V.E,Sp. Kulit & Kelamin,halodoc,"Setiabudi, Jakarta Selatan",2025-05-22 13:39:27
Dr. Fiska Rosita Sp.D.V.E,Sp. Kulit & Kelamin,halodoc,"Setiabudi, Jakarta Selatan",2025-05-22 13:39:27
Dr. Fiska Rosita Sp.DV,Sp. Kulit & Kelamin,halodoc,"Setiabudi, Jakarta Selatan",2025-05-22 13:39:29
Dr. Fiska Rosita Sp.D.V.E,Sp. Kulit & Kelamin,halodoc,"Setiabudi, Jakarta Selatan",2025-05-22 13:39:29
"Dr. Fitra Aina Hidayat M.Ked(DV), Sp.D.V.E",Sp. Kulit & Kelamin,halodoc,"Setiabudi, Jakarta Selatan",2025-05-22 13:39:29
Dr. Fitri Kasmitasari Sp.D.V.E,Sp. Kulit & Kelamin,halodoc,"Setiabudi, Jakarta Selatan",2025-05-22 13:39:29
"Dr. Fitri Puspita M.Ked(DV), Sp.D.V.E",Sp. Kulit & Kelamin,halodoc,"Setiabudi, Jakarta Selatan",2025-05-22 13:39:29
"DR. Dr. Fitria Salim Sp.D.V.E, FINSDV, FAADV",Sp. Kulit & Kelamin,halodoc,"Setiabudi, Jakarta Selatan",2025-05-22 13:39:29
"Dr. Fitria Salim Sp.D.V.E, FINSDV, FAADV",Sp. Kulit & Kelamin,halodoc,"Setiabudi, Jakarta Selatan",2025-05-22 13:39:29
Dr. Fitria Sartika Sp.D.V.E,Sp. Kulit & Kelamin,halodoc,"Setiabudi, Jakarta Selatan",2025-05-22 13:39:29
Dr. Fitriah Sp.D.V.E,Sp. Kulit & Kelamin,halodoc,"Setiabudi, Jakarta Selatan",2025-05-22 13:39:29
"Dr. Fitriana Yusiyanti Dewi Sp.D.V.E, FINSDV",Sp. Kulit & Kelamin,halodoc,"Setiabudi, Jakarta Selatan",2025-05-22 13:39:29
"dr. Flora Anisah Rakhmawati, Sp.KK",Sp. Kulit & Kelamin,halodoc,"Setiabudi, Jakarta Selatan",2025-05-22 13:39:31
dr. Fransica N. Sp. DV,Sp. Kulit & Kelamin,Tasik Farma,"Cihideung, Kota Tasikmalaya",2025-05-22 13:39:31
dr. Fransica N. Sp. DV,Sp. Kulit & Kelamin,Tasik Farma,"Cihideung, Kota Tasikmalaya",2025-05-22 13:39:31
dr. Fransica N. Sp. DV,Sp. Kulit & Kelamin,Tasik Farma,"Cihideung, Kota Tasikmalaya",2025-05-22 13:39:31
Dr. Frieda Sp.D.V.E,Sp. Kulit & Kelamin,halodoc,"Setiabudi, Jakarta Selatan",2025-05-22 13:39:31
Dr. Frizam Dwindamuldan Sutisna Sp.D.V.E,Sp. Kulit & Kelamin,halodoc,"Setiabudi, Jakarta Selatan",2025-05-22 13:39:31
Dr. Gabiela Reginata Sp.DV,Sp. Kulit & Kelamin,halodoc,"Setiabudi, Jakarta Selatan",2025-05-22 13:39:31
Dr. Gabriela Reginata Sp.D.V.E,Sp. Kulit & Kelamin,halodoc,"Setiabudi, Jakarta Selatan",2025-05-22 13:39:31
Dr. Gabriela Reginata Sp.DV,Sp. Kulit & Kelamin,halodoc,"Setiabudi, Jakarta Selatan",2025-05-22 13:39:31
"Dr. Gina Triana Sutedja Sp.D.V.E, FINSDV",Sp. Kulit & Kelamin,halodoc,"Setiabudi, Jakarta Selatan",2025-05-22 13:39:31
Dr. Gita Hening Bunga Sp.D.V.E,Sp. Kulit & Kelamin,halodoc,"Setiabudi, Jakarta Selatan",2025-05-22 13:39:33
Dr. Grady Garfendo Sp.D.V.E,Sp. Kulit & Kelamin,halodoc,"Setiabudi, Jakarta Selatan",2025-05-22 13:39:33
Dr. Gusti Agung Ayu Sriyani Sp.D.V.E,Sp. Kulit & Kelamin,halodoc,"Setiabudi, Jakarta Selatan",2025-05-22 13:39:33
Dr. Gusti Ayu Anggawati Sp.D.V.E,Sp. Kulit & Kelamin,halodoc,"Setiabudi, Jakarta Selatan",2025-05-22 13:39:33
"Dr. Hadi Firmansyah Sp.D.V.E, M.Kes",Sp. Kulit & Kelamin,halodoc,"Setiabudi, Jakarta Selatan",2025-05-22 13:39:33
Dr. Haken Tennizar Toena Sp.D.V.E,Sp. Kulit & Kelamin,halodoc,"Setiabudi, Jakarta Selatan",2025-05-22 13:39:33
Dr. Halim Perdana Kusuma Sp.D.V.E,Sp. Kulit & Kelamin,halodoc,"Setiabudi, Jakarta Selatan",2025-05-22 13:39:33
Dr. Halim Perdana Kusuma Sp.DV,Sp. Kulit & Kelamin,halodoc,"Setiabudi, Jakarta Selatan",2025-05-22 13:39:33
"Dr. Hamidah Luthfidyaningrum Sp.D.V.E, M.Ked.Klin",Sp. Kulit & Kelamin,halodoc,"Setiabudi, Jakarta Selatan",2025-05-22 13:39:33
Dr. Hayra Avianggi Sp.D.V.E,Sp. Kulit & Kelamin,halodoc,"Setiabudi, Jakarta Selatan",2025-05-22 13:39:33
Dr. Heffi Anindya Putri Sp.DV,Sp. Kulit & Kelamin,halodoc,"Setiabudi, Jakarta Selatan",2025-05-22 13:39:35
Dr. Herkamela Sp.D.V.E,Sp. Kulit & Kelamin,halodoc,"Setiabudi, Jakarta Selatan",2025-05-22 13:39:35
dr. Herkamela Sp.KK,Sp. Kulit & Kelamin,halodoc,"Setiabudi, Jakarta Selatan",2025-05-22 13:39:35
"Dr. Heruni Amalia Sp.D.V.E, M.Kes",Sp. Kulit & Kelamin,halodoc,"Setiabudi, Jakarta Selatan",2025-05-22 13:39:35
"Dr. Hilmiah Sp.D.V.E, M.Kes",Sp. Kulit & Kelamin,halodoc,"Setiabudi, Jakarta Selatan",2025-05-22 13:39:35
"Dr. Hilmiah Sp.KK, M.Kes",Sp. Kulit & Kelamin,halodoc,"Setiabudi, Jakarta Selatan",2025-05-22 13:39:35
"Dr. Hj Sri Rimayani Malik Sp.D.V.E, M.Tr.Adm.Kes",Sp. Kulit & Kelamin,halodoc,"Setiabudi, Jakarta Selatan",2025-05-22 13:39:35
Dr. I G A A Mini Laksmi Sp.D.V.E,Sp. Kulit & Kelamin,halodoc,"Setiabudi, Jakarta Selatan",2025-05-22 13:39:35
"Dr. I Gusti Ketut Darmada , SpKK",Sp. Kulit & Kelamin,"dr. I Gusti Ketut Darmada , SpKK","Denpasar Selatan, Kota Denpasar",2025-05-22 13:39:35
Dr. I Gusti Ngurah Ariwangsa Asbita Sp.D.V.E,Sp. Kulit & Kelamin,halodoc,"Setiabudi, Jakarta Selatan",2025-05-22 13:39:35
Dr. I Made Birawan Sp.D.V.E,Sp. Kulit & Kelamin,halodoc,"Setiabudi, Jakarta Selatan",2025-05-22 13:39:37
"Dr. I Putu Artana Sp.D.V.E, FINSDV, FAADV",Sp. Kulit & Kelamin,halodoc,"Setiabudi, Jakarta Selatan",2025-05-22 13:39:37
"dr. INDAH PERMATA SARI, SPKK",Sp. Kulit & Kelamin,APOTEK ADHITIA,"Bukit Kecil, Kota Palembang",2025-05-22 13:39:37
Dr. Ibrahim Budiman Pandit Sp.KK,Sp. Kulit & Kelamin,Prodia Lebak Bulus,"Kebayoran Baru, Jakarta Selatan",2025-05-22 13:39:37
Dr. Ibrahim Usmanba Pandit Sp.KK,Sp. Kulit & Kelamin,halodoc,"Setiabudi, Jakarta Selatan",2025-05-22 13:39:37
Dr. Ida Ayu Citra Prawitasari Manuaba Sp.D.V.E,Sp. Kulit & Kelamin,halodoc,"Setiabudi, Jakarta Selatan",2025-05-22 13:39:37
dr. Ika Anggraini Sp. DVE,Sp. Kulit & Kelamin,Bamed Healh Care,"Kembangan, Jakarta Barat",2025-05-22 13:39:37
"dr. Ika Fatimah Damayanti, MSc SpDV",Sp. Kulit & Kelamin,Siloam Hospitals Yogyakarta -,"Tegalrejo, Kota Yogyakarta",2025-05-22 13:39:37
dr Ika Midiasari Sp. DV,Sp. Kulit & Kelamin,Rumah Sakit Umum Daerah (RSUD) dr. R. Goeteng Taroenadibrata,"Karangmoncol, Kabupaten Purbalingga",2025-05-22 13:39:37
dr. Indra Teguh Sp DVE,Sp. Kulit & Kelamin,Apotek Berlian,"Tanjung Karang Timur, Kota Bandar Lampung",2025-05-22 13:39:37
Dr. Indri Widya Sari Sp.DV,Sp. Kulit & Kelamin,halodoc,"Setiabudi, Jakarta Selatan",2025-05-22 13:39:39
Dr. Indria Intan Kartini Sp.D.V.E,Sp. Kulit & Kelamin,halodoc,"Setiabudi, Jakarta Selatan",2025-05-22 13:39:39
Dr. Indry Salonika Sutiawan Sp.D.V.E,Sp. Kulit & Kelamin,halodoc,"Setiabudi, Jakarta Selatan",2025-05-22 13:39:39
Dr. Irene Ardiani Pramudya Wardhani Sp.D.V.E,Sp. Kulit & Kelamin,halodoc,"Setiabudi, Jakarta Selatan",2025-05-22 13:39:39
Dr. Irma Amalia Sp.D.V.E,Sp. Kulit & Kelamin,halodoc,"Setiabudi, Jakarta Selatan",2025-05-22 13:39:39
"dr. Irma Fachroza, Sp.DV",Sp. Kulit & Kelamin,Apotek Wira Prima Garut,"Pamulihan, Kabupaten Garut",2025-05-22 13:39:39
dr. Irvan Satyawan SpKK,Sp. Kulit & Kelamin,APOTEK YAKIN SEHAT,"Prabumulih Barat, Kota Prabumulih",2025-05-22 13:39:39
Dr. Irvin Aldikha Sp.D.V.E,Sp. Kulit & Kelamin,halodoc,"Setiabudi, Jakarta Selatan",2025-05-22 13:39:39
Dr. Ivon Setiawan Sp.D.V.E,Sp. Kulit & Kelamin,halodoc,"Setiabudi, Jakarta Selatan",2025-05-22 13:39:39
Dr. Jeffrey Giantoro Sp.D.V.E,Sp. Kulit & Kelamin,halodoc,"Setiabudi, Jakarta Selatan",2025-05-22 13:39:39
Dr. Jennifer Michelle Widysanto Sp.D.V.E,Sp. Kulit & Kelamin,halodoc,"Setiabudi, Jakarta Selatan",2025-05-22 13:39:42
Dr. Jessica Tania Sp.D.V.E,Sp. Kulit & Kelamin,halodoc,"Setiabudi, Jakarta Selatan",2025-05-22 13:39:42
Dr Jhauharina Rizki Fadhilla Sp.D.V.E,Sp. Kulit & Kelamin,halodoc,"Setiabudi, Jakarta Selatan",2025-05-22 13:39:42
Dr. Juliana Sp.D.V.E,Sp. Kulit & Kelamin,halodoc,"Setiabudi, Jakarta Selatan",2025-05-22 13:39:42
"dr. Juliana, Sp.DV, MH.KES",Sp. Kulit & Kelamin,halodoc,"Setiabudi, Jakarta Selatan",2025-05-22 13:39:42
dr. Julianus Sp.KK,Sp. Kulit & Kelamin,halodoc,"Setiabudi, Jakarta Selatan",2025-05-22 13:39:42
Dr. July Iriani Rahardja Sp.DV,Sp. Kulit & Kelamin,halodoc,"Setiabudi, Jakarta Selatan",2025-05-22 13:39:42
Dr. Kalista Yuniar Sp.KK,Sp. Kulit & Kelamin,halodoc,"Setiabudi, Jakarta Selatan",2025-05-22 13:39:42
Dr. Karlina Novianti Kasim Sp.D.V.E,Sp. Kulit & Kelamin,halodoc,"Setiabudi, Jakarta Selatan",2025-05-22 13:39:42
Dr. Keshia Amalia Mivina Mudia Sp.D.V.E,Sp. Kulit & Kelamin,halodoc,"Setiabudi, Jakarta Selatan",2025-05-22 13:39:42
Dr. Kiki Septiafni Sp.D.V.E,Sp. Kulit & Kelamin,halodoc,"Setiabudi, Jakarta Selatan",2025-05-22 13:39:44
Dr. Kristina Sihaloho Sp.D.V.E,Sp. Kulit & Kelamin,halodoc,"Setiabudi, Jakarta Selatan",2025-05-22 13:39:44
Dr. Kun Dewi Sp.D.V.E,Sp. Kulit & Kelamin,halodoc,"Setiabudi, Jakarta Selatan",2025-05-22 13:39:44
Dr. Kun Dewi Sp.KK,Sp. Kulit & Kelamin,halodoc,"Setiabudi, Jakarta Selatan",2025-05-22 13:39:44
"Dr. Kusuma Dewi M.Sc, Sp.D.V.E",Sp. Kulit & Kelamin,halodoc,"Setiabudi, Jakarta Selatan",2025-05-22 13:39:44
"Dr. Kusuma Dewi M.Sc, Sp.DV",Sp. Kulit & Kelamin,halodoc,"Setiabudi, Jakarta Selatan",2025-05-22 13:39:44
dr. Lely Sp. KK,Sp. Kulit & Kelamin,halodoc,"Setiabudi, Jakarta Selatan",2025-05-22 13:39:44
"Dr. Leny Indriani Lubis MKed.(DV), Sp.D.V.E",Sp. Kulit & Kelamin,halodoc,"Setiabudi, Jakarta Selatan",2025-05-22 13:39:44
Dr. Lidya Togelang Sp.D.V.E,Sp. Kulit & Kelamin,halodoc,"Setiabudi, Jakarta Selatan",2025-05-22 13:39:44
"Dr. Lintang Desi Ariyanti Putri M.H., Sp.D.V.E",Sp. Kulit & Kelamin,halodoc,"Setiabudi, Jakarta Selatan",2025-05-22 13:39:44
"Dr. Lodika Handayani M.Ked(DV), Sp.DV",Sp. Kulit & Kelamin,halodoc,"Setiabudi, Jakarta Selatan",2025-05-22 13:39:46
"Dr. Lukman Ariwibowo M.Sc, Sp.D.V.E, FINSDV",Sp. Kulit & Kelamin,halodoc,"Setiabudi, Jakarta Selatan",2025-05-22 13:39:46
"Dr. Lukman Ariwibowo M.Sc, Sp.DVE, FINSDV",Sp. Kulit & Kelamin,halodoc,"Setiabudi, Jakarta Selatan",2025-05-22 13:39:46
Dr. Lunardi Bintanjoyo Sp.D.V.E,Sp. Kulit & Kelamin,halodoc,"Setiabudi, Jakarta Selatan",2025-05-22 13:39:46
Dr. Lydia Kurniasari Sp.DVE,Sp. Kulit & Kelamin,halodoc,"Setiabudi, Jakarta Selatan",2025-05-22 13:39:46
dr. M. Mukti Sp.PD KKV,Sp. Kulit & Kelamin,RSUD DR. H .MOHAMAD RABAIN,"Muara Enim, Kabupaten Muara Enim",2025-05-22 13:39:46
"Dr. M. Veranita Kris Dwijayanti.S M.Biomed., Sp.D.V.E",Sp. Kulit & Kelamin,halodoc,"Setiabudi, Jakarta Selatan",2025-05-22 13:39:46
Dr. M. Yoga Adi Waskito Sp.D.V.E,Sp. Kulit & Kelamin,halodoc,"Setiabudi, Jakarta Selatan",2025-05-22 13:39:46
"Dr. Made Martina W. M.Biomed, Sp.D.V.E",Sp. Kulit & Kelamin,halodoc,"Setiabudi, Jakarta Selatan",2025-05-22 13:39:46
"Dr. Made Martina Windari M.Biomed, Sp.DV",Sp. Kulit & Kelamin,halodoc,"Setiabudi, Jakarta Selatan",2025-05-22 13:39:46
Dr. Made Sanitca Indah Sp.D.V.E,Sp. Kulit & Kelamin,halodoc,"Setiabudi, Jakarta Selatan",2025-05-22 13:39:48
dr. Maharani SP.DV,Sp. Kulit & Kelamin,Klinik Medivita,"Kebon Jeruk, Jakarta Barat",2025-05-22 13:39:48
dr. Maria Sp.KK,Sp. Kulit & Kelamin,apotik mitraku,"Taman Sari, Jakarta Barat",2025-05-22 13:39:48
"Dr. Marissa Astari Rubianti M.Ked.Klin, Sp.D.V.E",Sp. Kulit & Kelamin,halodoc,"Setiabudi, Jakarta Selatan",2025-05-22 13:39:48
"Dr. Marissa Astari Rubianti M.Ked.Klin, Sp.DV",Sp. Kulit & Kelamin,halodoc,"Setiabudi, Jakarta Selatan",2025-05-22 13:39:48
Dr. Marissa Gondo Suwito Sp.D.V.E,Sp. Kulit & Kelamin,halodoc,"Setiabudi, Jakarta Selatan",2025-05-22 13:39:48
"Dr. Maristella Rosalina Mked.DV, Sp.D.V.E",Sp. Kulit & Kelamin,halodoc,"Setiabudi, Jakarta Selatan",2025-05-22 13:39:48
Dr. Marrietta Sugiarti Sadeli Sp.D.V.E,Sp. Kulit & Kelamin,halodoc,"Setiabudi, Jakarta Selatan",2025-05-22 13:39:48
Dr. Marvin Giantoro Sp.D.V.E,Sp. Kulit & Kelamin,halodoc,"Setiabudi, Jakarta Selatan",2025-05-22 13:39:48
"Dr. Maryam Albaar Sp.D.V.E, M.Kes",Sp. Kulit & Kelamin,halodoc,"Setiabudi, Jakarta Selatan",2025-05-22 13:39:48
