name,speciality,hospital,city,timestamp
dr. Gabriel Angel Mustakia Sp.A,Sp. Anak,halodoc,"Setiabudi, Jakarta Selatan",2025-05-22 16:52:15
Dr. Galuh Martin Maytasari Sp.A,Sp. Anak,halodoc,"Setiabudi, Jakarta Selatan",2025-05-22 16:52:15
"dr. George Mogi, Sp.A",Sp. Anak,RS St. Carolus Salemba,"Senen, Jakarta Pusat",2025-05-22 16:52:15
"dr. Ghaisani Fadiana, Sp.A(K)",Sp. Anak,"Klinik Utama AP&AP Pediatric, Growth and Diabetes Center","Setiabudi, Jakarta Selatan",2025-05-22 16:52:15
dr. Gita Widypuri Sp.A,Sp. Anak,halodoc,"Setiabudi, Jakarta Selatan",2025-05-22 16:52:15
"Dr. Glabela Christiana Pandango Sp.A., M.Ked.Klin",Sp. Anak,halodoc,"Setiabudi, Jakarta Selatan",2025-05-22 16:52:15
Dr. Gondo Sp. A,Sp. Anak,KLINIK NADIRA KARAWANG,"Banyusari, Kabupaten Karawang",2025-05-22 16:52:15
dr Gracia Deswita Natalya Fau Sp. A,Sp. Anak,Apotek Halomedika Pekayon,"Jatiasih, Bekasi",2025-05-22 16:52:15
dr Gracia Deswita Natalya Sp. A,Sp. Anak,Kimia Farma Cisaat,"Cicurug, Kabupaten Sukabumi",2025-05-22 16:52:17
Dr. Gregory Joey Sp.A,Sp. Anak,halodoc,"Setiabudi, Jakarta Selatan",2025-05-22 16:52:17
Dr. Gustian R Tiballa Sp.A,Sp. Anak,halodoc,"Setiabudi, Jakarta Selatan",2025-05-22 16:52:17
dr. H Delyuzar Dahlan Sp.A,Sp. Anak,Apotik Media,"Majalaya, Kabupaten Bandung",2025-05-22 16:52:17
dr. H Muhammad Mukhson Sp.A,Sp. Anak,Apotek Dar Al- Khaer Purwokerto,"Purworejo, Kabupaten Purworejo",2025-05-22 16:52:17
dr. H. Achirul Bakri Sp.A (K),Sp. Anak,Praktik dr. Achirul Bakri Sp.A (K),"Ilir Timur II, Kota Palembang",2025-05-22 16:52:17
dr. H. Hadrian Ananta Putra Sp.A,Sp. Anak,Praktek Pribadi dr. Irawan Anasta Putra Sp.A,"Pasar Jambi, Kota Jambi",2025-05-22 16:52:17
"Dr. H. Irman Permana, M.KES, SPA SUBSP.NEO",Sp. Anak,halodoc,"Setiabudi, Jakarta Selatan",2025-05-22 16:52:17
Dr. H. Johnwan Usman Sp.A,Sp. Anak,DR H. JOHNWAN USMAN SPA,"Kebayoran Baru, Jakarta Selatan",2025-05-22 16:52:17
Dr. H. Johnwan Usman SpA,Sp. Anak,Apotek Nuansa Sehat.,"Koja, Jakarta Utara",2025-05-22 16:52:17
Dr. H. Johnwan Usman SpA.,Sp. Anak,APOTEK LIDO,"Koja, Jakarta Utara",2025-05-22 16:52:19
Dr. H. Johnwan Usman Sp.A,Sp. Anak,Apotek Nuansa Sehat.,"Koja, Jakarta Utara",2025-05-22 16:52:19
dr. H. M. Budi Susatyo Sp. A,Sp. Anak,apotek permata,"Klari, Kabupaten Karawang",2025-05-22 16:52:19
"Dr. H. Metrizal, SpA",Sp. Anak,"Dr. H. Metrizal, SpA","Aur Birugo Tigo Baleh, Kota Bukittinggi",2025-05-22 16:52:19
Dr. H. Pandji Purnama K Sp.A,Sp. Anak,Apotek Medika Utama,"Tawang, Kota Tasikmalaya",2025-05-22 16:52:19
Dr. H. Pandji Purnama K Sp.A,Sp. Anak,Apotek Medika Utama,"Tawang, Kota Tasikmalaya",2025-05-22 16:52:19
Dr. H. Suryono Wibowo Sp.A,Sp. Anak,Suryono Wibowo H Dr,"Duren Sawit, Jakarta Timur",2025-05-22 16:52:19
dr. H.M. Chalim Sp.A,Sp. Anak,"dr. H. M. Chalim, Sp.A","Boyolangu, Kabupaten Tulungagung",2025-05-22 16:52:19
dr. H.R.Setyadi Sp. A,Sp. Anak,Apotik Santoso Farma,"Tegal Selatan, Kota Tegal",2025-05-22 16:52:19
Dr. HEKA MAYASARI Sp A,Sp. Anak,APOTEK CIMAYA,"Tanggeung, Kabupaten Cianjur",2025-05-22 16:52:19
Dr. HEKA MAYASARI SpA,Sp. Anak,APOTEK CIMAYA,"Tanggeung, Kabupaten Cianjur",2025-05-22 16:52:21
Dr. HEKA MAYASARI SpA,Sp. Anak,halodoc,"Setiabudi, Jakarta Selatan",2025-05-22 16:52:21
"Dr. Hajrin Pajri Asra M.Ked (Ped), Sp.A",Sp. Anak,halodoc,"Setiabudi, Jakarta Selatan",2025-05-22 16:52:21
Dr. Hambrah Sri Atriadewi Sp.A,Sp. Anak,halodoc,"Setiabudi, Jakarta Selatan",2025-05-22 16:52:21
"Dr. Hana C.E. Sembiring M.Ked(Ped), Sp.A",Sp. Anak,halodoc,"Setiabudi, Jakarta Selatan",2025-05-22 16:52:21
"dr. Hana Sofia Rachman, Sp.A",Sp. Anak,RSUD Al Ihsan Provinsi Jawa Barat,"Baleendah, Kabupaten Bandung",2025-05-22 16:52:21
Dr. Handoko Lowis Sp.A,Sp. Anak,halodoc,"Setiabudi, Jakarta Selatan",2025-05-22 16:52:21
Dr. Handoyo Sp.A,Sp. Anak,halodoc,"Setiabudi, Jakarta Selatan",2025-05-22 16:52:21
Prof. Dr. dr. Hanifah Oswari SpA (K),Sp. Anak,Kiddie Care Center,"Tanjung Priok, Jakarta Utara",2025-05-22 16:52:21
"Prof. Dr. dr. Hanifah Oswari, Sp.A (K)",Sp. Anak,Kiddie Care Center,"Tanjung Priok, Jakarta Utara",2025-05-22 16:52:21
"Dr. Hans Natanael Sp.A, BCCS, CIMI, CBATR",Sp. Anak,halodoc,"Setiabudi, Jakarta Selatan",2025-05-22 16:52:23
Dr. Hanum Ferdian Sp.A,Sp. Anak,halodoc,"Setiabudi, Jakarta Selatan",2025-05-22 16:52:23
Dr. Hardiman Widjaja Sp.A,Sp. Anak,halodoc,"Setiabudi, Jakarta Selatan",2025-05-22 16:52:23
"Dr. Hardiyanti Ari W. M.Sc., Sp.A",Sp. Anak,halodoc,"Setiabudi, Jakarta Selatan",2025-05-22 16:52:23
dr. Hartono Sp. A,Sp. Anak,Apotek Manshurin,"Tembalang, Kota Semarang",2025-05-22 16:52:23
"dr. Harun Albar M.Kes, Sp.A",Sp. Anak,halodoc,"Setiabudi, Jakarta Selatan",2025-05-22 16:52:23
"Dr. Harun Arrasyid Rydha Albar, M.Kes Sp.A",Sp. Anak,halodoc,"Setiabudi, Jakarta Selatan",2025-05-22 16:52:23
Dr. Heka Mayasari SpA,Sp. Anak,APOTEK CIMAYA,"Tanggeung, Kabupaten Cianjur",2025-05-22 16:52:23
Dr. Heka Mayasari SpA,Sp. Anak,APOTEK CIMAYA,"Tanggeung, Kabupaten Cianjur",2025-05-22 16:52:23
Dr. Heka Mayasari SpA,Sp. Anak,APOTEK CIMAYA,"Tanggeung, Kabupaten Cianjur",2025-05-22 16:52:23
Dr. Heka Mayasari Sp.A,Sp. Anak,halodoc,"Setiabudi, Jakarta Selatan",2025-05-22 16:52:26
Dr. Heka Mayasari Sp.A,Sp. Anak,halodoc,"Setiabudi, Jakarta Selatan",2025-05-22 16:52:26
Dr. Heka Mayasari Sp.A,Sp. Anak,halodoc,"Setiabudi, Jakarta Selatan",2025-05-22 16:52:26
"dr. Heka Mayasari, Sp.A",Sp. Anak,APOTEK CIMAYA,"Tanggeung, Kabupaten Cianjur",2025-05-22 16:52:26
"dr. Heka Mayasari, Sp.A",Sp. Anak,APOTEK CIMAYA,"Tanggeung, Kabupaten Cianjur",2025-05-22 16:52:26
"Dr. Helmitri Sp.A, M.Sc",Sp. Anak,halodoc,"Setiabudi, Jakarta Selatan",2025-05-22 16:52:26
dr. Hendra SpA,Sp. Anak,Praktek Dokter dr. Hendra Hibrata Sp.A,"Babelan, Kabupaten Bekasi",2025-05-22 16:52:26
Hendra Herata Sp.A,Sp. Anak,Praktek Dokter dr. Hendra Hibrata Sp.A,"Babelan, Kabupaten Bekasi",2025-05-22 16:52:26
dr Hendra Hibrata Sp.A,Sp. Anak,Apotik Karitas,"Gedangan, Kabupaten Sidoarjo",2025-05-22 16:52:26
"dr. Hendra Hibrata, Sp.A",Sp. Anak,"praktek Dr. Hendra Hibrata, Sp.A","Bekasi Barat, Bekasi",2025-05-22 16:52:26
dr. Henny Rosita Sp A,Sp. Anak,0,"Bekasi Selatan, Bekasi",2025-05-22 16:52:28
dr. Henny Rosita Sp A-K,Sp. Anak,0,"Bekasi Selatan, Bekasi",2025-05-22 16:52:28
dr. Hery Susanto Sp.A,Sp. Anak,Praktek dokter.,"Bukit Raya, Kota Pekanbaru",2025-05-22 16:52:28
dr. Hetty Wati Napitupulu Sp.A,Sp. Anak,halodoc,"Setiabudi, Jakarta Selatan",2025-05-22 16:52:28
Dr. Hilda Anelin Tasiringan Sp.A,Sp. Anak,halodoc,"Setiabudi, Jakarta Selatan",2025-05-22 16:52:28
dr. Hj. Sukartini Sp.A.,Sp. Anak,Apotek Merak,"Samarinda Seberang, Kota Samarinda",2025-05-22 16:52:28
dr. Hj. Tin Suhartini Sp.A,Sp. Anak,"Praktek Pribadi dr. Tin Suhartini, SpA","Bogor Utara, Bogor",2025-05-22 16:52:28
"dr. Hj.Yoyoh Yusroh, Sp.A",Sp. Anak,RSUD Al Ihsan Provinsi Jawa Barat,"Baleendah, Kabupaten Bandung",2025-05-22 16:52:28
Dr. Holly Sanusi Sp.A,Sp. Anak,halodoc,"Setiabudi, Jakarta Selatan",2025-05-22 16:52:28
dr. I Gede Kade Dwi Darma Kayika Sp.A,Sp. Anak,Rumah Sakit Ibu Dan Anak Puri Bunda,"Blimbing, Kota Malang",2025-05-22 16:52:28
Dr. I Made Dikky Kalsa Sp.A,Sp. Anak,halodoc,"Setiabudi, Jakarta Selatan",2025-05-22 16:52:30
dr. I Nyoman Putra Arcana Sp. A,Sp. Anak,"dr. I Nyoman Putra Arcana, Sp.A","Selemadeg, Kabupaten Tabanan",2025-05-22 16:52:30
Dr. I Nyoman Sudiatmika Sp A,Sp. Anak,RSIA Nabasa,"Kuala Mandor-B, Kabupaten Kubu Raya",2025-05-22 16:52:30
dr. I Nyoman Sudiatmika SpA,Sp. Anak,RSIA Nabasa,"Kuala Mandor-B, Kabupaten Kubu Raya",2025-05-22 16:52:30
Dr. I Putu Gede Agus Suryatama Dharmadi Sp.A,Sp. Anak,halodoc,"Setiabudi, Jakarta Selatan",2025-05-22 16:52:30
dr I. G. A. S. Setyadi Sp.A,Sp. Anak,Klinik Sudirman,"Banjarsari, Kabupaten Ciamis",2025-05-22 16:52:30
dr. I. Made Darma Yuda Sp.A,Sp. Anak,Apotek Anugerah Ayani,"Denpasar Utara, Kota Denpasar",2025-05-22 16:52:30
I. Made Darma Yuda,Sp. Anak,Apotek Anugerah Ayani,"Denpasar Utara, Kota Denpasar",2025-05-22 16:52:30
dr. IRIANI SIOMBO SP.A,Sp. Anak,Klinik Dr Iriani Siombo SpA,"Kota Tengah, Kota Gorontalo",2025-05-22 16:52:30
"Dr. Ian Suryadi Suteja M.Med Sc, Sp.A",Sp. Anak,halodoc,"Setiabudi, Jakarta Selatan",2025-05-22 16:52:30
Dr. Idha Yulfiwanti Sp.A,Sp. Anak,halodoc,"Setiabudi, Jakarta Selatan",2025-05-22 16:52:32
dr. Idham Amir Sp.A(K),Sp. Anak,halodoc,"Setiabudi, Jakarta Selatan",2025-05-22 16:52:32
"dr. Ilham Lie M.Kes, Sp.A",Sp. Anak,Apotek AG FARMA,"Makassar, Kota Makassar",2025-05-22 16:52:32
Dr. Inayah Djabir Sp.A,Sp. Anak,halodoc,"Setiabudi, Jakarta Selatan",2025-05-22 16:52:32
"Dr. Indah Khairani Nasution M.Ked(Ped), Sp.A",Sp. Anak,halodoc,"Setiabudi, Jakarta Selatan",2025-05-22 16:52:32
Dr. Indah Megawati Sp.A,Sp. Anak,halodoc,"Setiabudi, Jakarta Selatan",2025-05-22 16:52:32
Dr. Indah Nurhayati Sp.A,Sp. Anak,halodoc,"Setiabudi, Jakarta Selatan",2025-05-22 16:52:32
dr Indah Septiane Sp. A,Sp. Anak,halodoc,"Setiabudi, Jakarta Selatan",2025-05-22 16:52:32
dr Indiana Aulia M. Ked. Sp. A,Sp. Anak,Apotik Central farma,"Indrapuri, Kabupaten Aceh Besar",2025-05-22 16:52:32
Dr. Intani Dewi Sp.A,Sp. Anak,halodoc,"Setiabudi, Jakarta Selatan",2025-05-22 16:52:32
"Dr. Ira Furnia Sp.A, M.Kes",Sp. Anak,halodoc,"Setiabudi, Jakarta Selatan",2025-05-22 16:52:34
dr Ireska Sp. A,Sp. Anak,Apotik K24 Rawamangun,"Pulo Gadung, Jakarta Timur",2025-05-22 16:52:34
Dr. Irma Arniawati Sp.A,Sp. Anak,halodoc,"Setiabudi, Jakarta Selatan",2025-05-22 16:52:34
Dr. Irma Irawati Soelistiyo Sp.A,Sp. Anak,halodoc,"Setiabudi, Jakarta Selatan",2025-05-22 16:52:34
Dr. Irma Rochima Puspita SPA,Sp. Anak,halodoc,"Setiabudi, Jakarta Selatan",2025-05-22 16:52:34
Dr. Irma Yenni Sp.A,Sp. Anak,halodoc,"Setiabudi, Jakarta Selatan",2025-05-22 16:52:34
Dr. Iskandar B. Palar Sp.A,Sp. Anak,APOTEK JAYA,"Banjarmasin Barat, Kota Banjarmasin",2025-05-22 16:52:34
dr. Ismi Nita Sp A,Sp. Anak,Klinik Utama Sejahtera Ciracas,"Ciracas, Jakarta Timur",2025-05-22 16:52:34
"dr. Ismi Nita, Sp.A",Sp. Anak,Klinik Utama Sejahtera Ciracas,"Ciracas, Jakarta Timur",2025-05-22 16:52:34
Dr. Isti Ansharina Kathin Sp.A,Sp. Anak,halodoc,"Setiabudi, Jakarta Selatan",2025-05-22 16:52:34
dr. Istika Wulandari Sp.A,Sp. Anak,Praktek dokter.,"Bukit Raya, Kota Pekanbaru",2025-05-22 16:52:36
Dr. Ivan Rachmat Bachtiar Sp.A,Sp. Anak,halodoc,"Setiabudi, Jakarta Selatan",2025-05-22 16:52:36
dr. Ivan Veriswan Sp.A,Sp. Anak,Apotek Citra Mulia,"Cikupa, Kabupaten Tangerang",2025-05-22 16:52:36
"Dr. Ivanny Khosasih Sp.A, CIMI",Sp. Anak,halodoc,"Setiabudi, Jakarta Selatan",2025-05-22 16:52:36
dr. Janaka Sp.A,Sp. Anak,Apotek Nusa Sehat 2,"Senen, Jakarta Pusat",2025-05-22 16:52:36
"dr. Jeanne Laurensie Sihombing, Sp.A",Sp. Anak,RS St. Carolus Salemba,"Senen, Jakarta Pusat",2025-05-22 16:52:36
"dr. Jeannette Mila Hardiani Cahyaningrum, Sp.A., M.Kes.",Sp. Anak,RS St. Carolus Salemba,"Senen, Jakarta Pusat",2025-05-22 16:52:36
"Dr. Jessica Ginting M.Ked(Ped), Sp.A",Sp. Anak,halodoc,"Setiabudi, Jakarta Selatan",2025-05-22 16:52:36
Dr. Jessica Irawan Sp.A,Sp. Anak,halodoc,"Setiabudi, Jakarta Selatan",2025-05-22 16:52:36
Dr. Jessica Sugiharto Sp.A,Sp. Anak,halodoc,"Setiabudi, Jakarta Selatan",2025-05-22 16:52:36
"dr. Johan Christian Silaen, M.Ked (Ped) Sp. A",Sp. Anak,"Praktek Pribadi dr. Johan Christian Silaen, M.Ked (Ped), Sp. A","Medan Petisah, Kota Medan",2025-05-22 16:52:38
"Dr. Johannes Octan Daniel M.Res, M.Med.Sc, Sp.A",Sp. Anak,halodoc,"Setiabudi, Jakarta Selatan",2025-05-22 16:52:38
dr. Johny Gunawan Sp.A,Sp. Anak,Praktek dokter mandiri,"Cileunyi, Kabupaten Bandung",2025-05-22 16:52:38
"dr. Joko Kurniawan, M.Sc Sp.A",Sp. Anak,RUMAH SAKIT ASSUYUTHIYYAH,"Pati, Kabupaten Pati",2025-05-22 16:52:38
"dr. Joko Purnomo Heroanto, Sp.A, CIMI, CBATR",Sp. Anak,halodoc,"Setiabudi, Jakarta Selatan",2025-05-22 16:52:38
"Prof. Dr. dr. Jose R. L. Batubara, Sp.A(K), Ph.D",Sp. Anak,halodoc,"Setiabudi, Jakarta Selatan",2025-05-22 16:52:38
Prof. dr. Jose Rizal Latief Batubara Sp.A (K),Sp. Anak,halodoc,"Setiabudi, Jakarta Selatan",2025-05-22 16:52:38
"Prof.dr. Jose Rizal Latief Batubara, Sp.A(K)",Sp. Anak,Prodia,"Makassar, Kota Makassar",2025-05-22 16:52:38
Dr. Josephine Juliana Sibarani Sp. A,Sp. Anak,halodoc,"Setiabudi, Jakarta Selatan",2025-05-22 16:52:38
Dr. Junifer Aritonang Sp.A,Sp. Anak,halodoc,"Setiabudi, Jakarta Selatan",2025-05-22 16:52:38
Dr. Kamajaya Mulyana Sp.A,Sp. Anak,halodoc,"Setiabudi, Jakarta Selatan",2025-05-22 16:52:40
dr Kania Adhyansitha Sp. A,Sp. Anak,RS ANNA,"Bekasi Barat, Bekasi",2025-05-22 16:52:40
dr. Kartikaningsih Sp.A,Sp. Anak,KLINIK HARAPAN SEHATI,"Kelapa Dua, Kabupaten Tangerang",2025-05-22 16:52:40
dr. Ketut Widiasa SpA,Sp. Anak,APOTEK SERUNI,"Cilincing, Jakarta Utara",2025-05-22 16:52:40
dr. Kharmina Chatar Sp.A,Sp. Anak,KLINIK KINDY CARE,"Pancoran Mas, Depok",2025-05-22 16:52:40
Dr. Kissinger Pugoh Sp.A,Sp. Anak,Praktek dokter mandiri,"Cileunyi, Kabupaten Bandung",2025-05-22 16:52:40
Dr. Kissinger Puguh Sp.A,Sp. Anak,Apotek Keluarga Kediri,"Grogol, Kabupaten Kediri",2025-05-22 16:52:40
"Dr. Kristian Wongso Giamto DTM&H, M.Sc, Sp.A",Sp. Anak,halodoc,"Setiabudi, Jakarta Selatan",2025-05-22 16:52:40
"dr. Kristiantini Dewi, Sp.A",Sp. Anak,halodoc,"Setiabudi, Jakarta Selatan",2025-05-22 16:52:40
"dr. Kriston Silitonga, Sp.A",Sp. Anak,Kimia Farma Depok,"Sukmajaya, Depok",2025-05-22 16:52:40
"dr. Kriston Silitonga, Sp.A",Sp. Anak,halodoc,"Setiabudi, Jakarta Selatan",2025-05-22 16:52:42
"dr. Kriston Silitonga, Sp.A",Sp. Anak,Apotek Kimia Farma 202 Kejayaan,"Sukmajaya, Depok",2025-05-22 16:52:42
Dr. Kurniawan Adi Putranto Sp.A,Sp. Anak,halodoc,"Setiabudi, Jakarta Selatan",2025-05-22 16:52:42
dr. Kurniawan Tan SpA,Sp. Anak,APOTEK ANAK JAYA,"Senapelan, Kota Pekanbaru",2025-05-22 16:52:42
Dr. Laila Fitri Ibbihah Sp.A,Sp. Anak,MND Clinic,"Kramat Jati, Jakarta Timur",2025-05-22 16:52:42
Dr. Laurentia Yustiana Setiono Sp.A,Sp. Anak,halodoc,"Setiabudi, Jakarta Selatan",2025-05-22 16:52:42
dr. Laury Cahyadi Sp.A,Sp. Anak,halodoc,"Setiabudi, Jakarta Selatan",2025-05-22 16:52:42
dr. Laury Cahyadi Sp.A,Sp. Anak,halodoc,"Setiabudi, Jakarta Selatan",2025-05-22 16:52:42
Dr. Ledy Novanty Tandiawan Sp.A,Sp. Anak,halodoc,"Setiabudi, Jakarta Selatan",2025-05-22 16:52:42
Dr. Leny Ambarwati Sp.A,Sp. Anak,halodoc,"Setiabudi, Jakarta Selatan",2025-05-22 16:52:42
Dr. Leny Angkawijaya Sp.A,Sp. Anak,halodoc,"Setiabudi, Jakarta Selatan",2025-05-22 16:52:44
"Dr. Leonardo Ferryanto M. Samadhi Sp.A, M.Ked. Klin",Sp. Anak,halodoc,"Setiabudi, Jakarta Selatan",2025-05-22 16:52:44
dr. Lia Amalia Sp. A,Sp. Anak,Praktik Dokter Spesialis Anak dr Lia Amalia Sp. A,"Cimahi Utara, Kota Cimahi",2025-05-22 16:52:44
dr. Lia Rhodia Sp.A,Sp. Anak,KLINIK UTAMA RAWAT INAP AIRLANGGA,"Pasar Rebo, Jakarta Timur",2025-05-22 16:52:44
Dr. Lia Rhodia Sp.A,Sp. Anak,MND Clinic,"Kramat Jati, Jakarta Timur",2025-05-22 16:52:44
Dr. Lies Indriyati Sp.A,Sp. Anak,halodoc,"Setiabudi, Jakarta Selatan",2025-05-22 16:52:44
Dr. Lilis Chalisah Sp.A,Sp. Anak,halodoc,"Setiabudi, Jakarta Selatan",2025-05-22 16:52:44
"dr. Lilis Chalisah, Sp.A",Sp. Anak,Apotek Helios Medika Sukmajaya,"Sukmajaya, Depok",2025-05-22 16:52:44
dr. Lilis D Hendrawati Sp.A,Sp. Anak,halodoc,"Setiabudi, Jakarta Selatan",2025-05-22 16:52:44
dr. Lilis D Hendrawati Sp.A (K),Sp. Anak,halodoc,"Setiabudi, Jakarta Selatan",2025-05-22 16:52:44
"dr. Lilis Siti Asiyani, Msc Sp.A",Sp. Anak,halodoc,"Setiabudi, Jakarta Selatan",2025-05-22 16:52:47
Dr. Lina Ninditya Sp.A,Sp. Anak,halodoc,"Setiabudi, Jakarta Selatan",2025-05-22 16:52:47
"Dr. Lina Purnamasari MH.Kes, Sp.A",Sp. Anak,halodoc,"Setiabudi, Jakarta Selatan",2025-05-22 16:52:47
Dr. Linda Oktaviana SC Sp.A,Sp. Anak,halodoc,"Setiabudi, Jakarta Selatan",2025-05-22 16:52:47
Dr. Lingga Pradipta Sp.A,Sp. Anak,halodoc,"Setiabudi, Jakarta Selatan",2025-05-22 16:52:47
Dr. Lingga Pradipta Sp.A,Sp. Anak,Kinder I care,"Astanaanyar, Kota Bandung",2025-05-22 16:52:47
Dr. Lingga Pradipta Sp.A,Sp. Anak,Kinder I care,"Astanaanyar, Kota Bandung",2025-05-22 16:52:47
"dr. Lita Siulan Tanang, Sp.A",Sp. Anak,Siloam Hospitals Balikpapan,"Balikpapan Selatan, Kota Balikpapan",2025-05-22 16:52:47
"dr. Lola Purnama Dewi, Sp.A Subsp. ERIA",Sp. Anak,halodoc,"Setiabudi, Jakarta Selatan",2025-05-22 16:52:47
dr. Lussy Arijanty Sp.A,Sp. Anak,Kiddie Care Center,"Tanjung Priok, Jakarta Utara",2025-05-22 16:52:47
dr Lusty Evi Wulandari Sp.A.,Sp. Anak,Klinik Asta Ceria,"Sidoarjo, Kabupaten Sidoarjo",2025-05-22 16:52:49
dr. Luszy A Sp. A,Sp. Anak,Kiddie Care Center,"Tanjung Priok, Jakarta Utara",2025-05-22 16:52:49
dr. Luszy Arijanty Sp.A,Sp. Anak,Kiddie Care Center,"Tanjung Priok, Jakarta Utara",2025-05-22 16:52:49
dr. Luszy Arijanty Sp.A,Sp. Anak,Kiddie Care Center,"Tanjung Priok, Jakarta Utara",2025-05-22 16:52:49
dr. Luszy Arijanty,Sp. Anak,Apotek Alvin Farma,"Kelapa Gading, Jakarta Utara",2025-05-22 16:52:49
Dr. M. Farid Huzein Sp.A,Sp. Anak,halodoc,"Setiabudi, Jakarta Selatan",2025-05-22 16:52:49
Dr. M. Farid Huzein Sp.A,Sp. Anak,halodoc,"Setiabudi, Jakarta Selatan",2025-05-22 16:52:49
dr. M. Hidayat M. Ked (Ped) Sp. A,Sp. Anak,Klinik Utama ARNI MEDIKA,"Wanareja, Kabupaten Cilacap",2025-05-22 16:52:49
"Dr. M. Taufik Wirawan M.Med.Sc, Sp.A",Sp. Anak,halodoc,"Setiabudi, Jakarta Selatan",2025-05-22 16:52:49
Dr. Made Laksmi Dewi Adnyana Sp.A,Sp. Anak,halodoc,"Setiabudi, Jakarta Selatan",2025-05-22 16:52:49
dr. Made Suderata Sp.A,Sp. Anak,Klinik Gayaza,"Paiton, Kota Probolinggo",2025-05-22 16:52:51
"Dr. Made Supartha M.Sc, Sp.A",Sp. Anak,halodoc,"Setiabudi, Jakarta Selatan",2025-05-22 16:52:51
Dr. Mahafendy Suryamanika Tukan Sp.A,Sp. Anak,halodoc,"Setiabudi, Jakarta Selatan",2025-05-22 16:52:51
Dr. Maharani Risiska Utami Sp.A,Sp. Anak,halodoc,"Setiabudi, Jakarta Selatan",2025-05-22 16:52:51
dr. Mahbub Muhammady Sp. A,Sp. Anak,Apotik Idaman,"Taraju, Kabupaten Tasikmalaya",2025-05-22 16:52:51
Dr. Mahmudah Sp.A,Sp. Anak,halodoc,"Setiabudi, Jakarta Selatan",2025-05-22 16:52:51
"dr. Margareta Yuliani, Sp.A",Sp. Anak,RS Bethesda Yogya,"Kraton, Kota Yogyakarta",2025-05-22 16:52:51
Dr. Maria Angela Fernandez Sp.A,Sp. Anak,halodoc,"Setiabudi, Jakarta Selatan",2025-05-22 16:52:51
Dr. Maria C. Shycha Moenardi Sp.A,Sp. Anak,halodoc,"Setiabudi, Jakarta Selatan",2025-05-22 16:52:51
dr. Maria Martha S Sp.A,Sp. Anak,halodoc,"Setiabudi, Jakarta Selatan",2025-05-22 16:52:51
dr. Maria Martina Siboe Sp.A,Sp. Anak,Klinik Luvia,"Senen, Jakarta Pusat",2025-05-22 16:52:53
dr. Maria Martina Siboe Sp.A,Sp. Anak,halodoc,"Setiabudi, Jakarta Selatan",2025-05-22 16:52:53
"dr. Maria Martina Siboe, Sp.A",Sp. Anak,RS St. Carolus Salemba,"Senen, Jakarta Pusat",2025-05-22 16:52:53
Dr. Maria Natalia Indawati Sp.A,Sp. Anak,halodoc,"Setiabudi, Jakarta Selatan",2025-05-22 16:52:53
Dr. Maria Priskila Sp.A,Sp. Anak,halodoc,"Setiabudi, Jakarta Selatan",2025-05-22 16:52:53
"Dr. Maria Rulina Yudi Artanti M.Sc, Sp.A",Sp. Anak,halodoc,"Setiabudi, Jakarta Selatan",2025-05-22 16:52:53
dr. Marilyn Cecilia Malonda Sp.A,Sp. Anak,Kiddie Care Center,"Tanjung Priok, Jakarta Utara",2025-05-22 16:52:53
dr Marina Rahasati Sp.A,Sp. Anak,RS Anugerah Pekalongan,"Pekalongan Barat, Kota Pekalongan",2025-05-22 16:52:53
Dr. Marlene Adriani Sutanto Sp.A,Sp. Anak,halodoc,"Setiabudi, Jakarta Selatan",2025-05-22 16:52:53
dr. Marshalla Agnes Sp. A,Sp. Anak,Kehamilan Sehat Ceger,"Pondok Aren, Tangerang Selatan",2025-05-22 16:52:53
Dr. Marta Sigit Sp.A,Sp. Anak,halodoc,"Setiabudi, Jakarta Selatan",2025-05-22 16:52:55
"dr. Martin Satriyadi, Sp.A M.Kes",Sp. Anak,"Praktek dr Martin Satriyadi, Sp.A, M.Kes","Prabumulih Timur, Kota Prabumulih",2025-05-22 16:52:55
Dr. Masayu Mutiara Puspasari Sp.A,Sp. Anak,halodoc,"Setiabudi, Jakarta Selatan",2025-05-22 16:52:55
Dr. Medina Athiah Sp.A,Sp. Anak,halodoc,"Setiabudi, Jakarta Selatan",2025-05-22 16:52:55
Dr. Melan Sari Kahiking Sp.A,Sp. Anak,halodoc,"Setiabudi, Jakarta Selatan",2025-05-22 16:52:55
dr. Melanie Yudiana Iskandar Sp.A,Sp. Anak,halodoc,"Setiabudi, Jakarta Selatan",2025-05-22 16:52:55
"Dr. Melati Dinihari M.Sc, Sp.A",Sp. Anak,halodoc,"Setiabudi, Jakarta Selatan",2025-05-22 16:52:55
"dr. Melia Yunita, M.Sc. Sp.A",Sp. Anak,halodoc,"Setiabudi, Jakarta Selatan",2025-05-22 16:52:55
"dr. Melisa Anggraeni, M.Biomed Sp.A",Sp. Anak,Klinik Ananda,"Gambir, Jakarta Pusat",2025-05-22 16:52:55
dr. Melisa Lilisari Sp.A M.Kes,Sp. Anak,Bintaro Women & Children Clinic Bandung,"Batununggal, Kota Bandung",2025-05-22 16:52:55
Dr. Merry Mawardi SpA,Sp. Anak,klinik Dr Merry Mawardi SpA,"Malalayang, Kota Manado",2025-05-22 16:52:57
"Dr. Mike Lauda M.Med.Sc, Sp.A",Sp. Anak,halodoc,"Setiabudi, Jakarta Selatan",2025-05-22 16:52:57
Dr. Mina Sp.A,Sp. Anak,halodoc,"Setiabudi, Jakarta Selatan",2025-05-22 16:52:57
"dr. Mira Christiyani Santoso, Sp.A",Sp. Anak,Miracle Healthy Mom & kids,"Cipondoh, Tangerang",2025-05-22 16:52:57
"dr. Mira Fauziah, M.Ked (Ped) Sp.A",Sp. Anak,Klinik Hilda Anaira,"Tanjung Priok, Jakarta Utara",2025-05-22 16:52:57
"dr. Mira Fauziah, M.Ked (Pedi) Sp.A",Sp. Anak,Klinik & Apotek Hilda Alnaira,"Koja, Jakarta Utara",2025-05-22 16:52:57
dr. Miranti Frity Medyatama Sp. A,Sp. Anak,Sehati Klinik,"Cibitung, Kabupaten Bekasi",2025-05-22 16:52:57
dr. Miranti Risya Mediaty Sp.A,Sp. Anak,Klinik Sehati,"Cakung, Jakarta Timur",2025-05-22 16:52:57
"Dr. Mislina Munir M.Ked(Ped), Sp.A",Sp. Anak,halodoc,"Setiabudi, Jakarta Selatan",2025-05-22 16:52:57
"dr. Monique Christiany, Sp.A M.Kes",Sp. Anak,halodoc,"Setiabudi, Jakarta Selatan",2025-05-22 16:52:57
Dr. Muda Isa Ariantana Sp.A,Sp. Anak,halodoc,"Setiabudi, Jakarta Selatan",2025-05-22 16:52:59
Dr. Muhammad A. Kevin Sp.A,Sp. Anak,halodoc,"Setiabudi, Jakarta Selatan",2025-05-22 16:52:59
"Dr. Muhammad Jalul M M.Med.Sc, Sp.A",Sp. Anak,halodoc,"Setiabudi, Jakarta Selatan",2025-05-22 16:52:59
Dr. Muhammad Kautsar Sp.A,Sp. Anak,halodoc,"Setiabudi, Jakarta Selatan",2025-05-22 16:52:59
"dr. Muhammad Rinaldhi Akbat Martiano , SpA",Sp. Anak,halodoc,"Setiabudi, Jakarta Selatan",2025-05-22 16:52:59
dr Muhammad Riza Sp. A,Sp. Anak,Klinik Narraya,"Laweyan, Kota Surakarta",2025-05-22 16:52:59
"Dr. Muhammad Tsani Arsyad M.Med.Sc, Sp.A",Sp. Anak,halodoc,"Setiabudi, Jakarta Selatan",2025-05-22 16:52:59
Dr. Muhrodji Sp.A,Sp. Anak,halodoc,"Setiabudi, Jakarta Selatan",2025-05-22 16:52:59
"Dr. Munira Ulfah M.Ked(Ped), Sp.A",Sp. Anak,halodoc,"Setiabudi, Jakarta Selatan",2025-05-22 16:52:59
Dr. NINA L. M. sc. Sp. A,Sp. Anak,halodoc,"Setiabudi, Jakarta Selatan",2025-05-22 16:52:59
"Dr. Nadhira Lesarina M.Ked(Ped), Sp.A",Sp. Anak,halodoc,"Setiabudi, Jakarta Selatan",2025-05-22 16:53:01
Nadine Shakina Dr Sp.A,Sp. Anak,0,"Bekasi Selatan, Bekasi",2025-05-22 16:53:01
Nadine Shakina Tabit Dr. SpA,Sp. Anak,0,"Bekasi Selatan, Bekasi",2025-05-22 16:53:01
dr Nahari Arifin Sp A,Sp. Anak,0,"Bekasi Selatan, Bekasi",2025-05-22 16:53:01
"Prof. Dr. dr Najib Advani, Sp.A(K), MMed., (Paed)",Sp. Anak,Apotek Nasha,"Cibodas, Tangerang",2025-05-22 16:53:01
"Najib Advani, Prof., Dr., dr., Sp.A (K), M.Med (Paed)",Sp. Anak,halodoc,"Setiabudi, Jakarta Selatan",2025-05-22 16:53:01
Dr. Nanda Juwita Sp.A,Sp. Anak,halodoc,"Setiabudi, Jakarta Selatan",2025-05-22 16:53:01
"dr. Natasha Amalda, Sp.A",Sp. Anak,halodoc,"Setiabudi, Jakarta Selatan",2025-05-22 16:53:01
dr. Nenvy G. Wantouw Sp.A,Sp. Anak,"dr. Nenvy Gracia Wantouw, Sp. A","Tegalsari, Kota Surabaya",2025-05-22 16:53:01
Dr. Ni Kadek Wiwik Agustini Sp.A,Sp. Anak,halodoc,"Setiabudi, Jakarta Selatan",2025-05-22 16:53:01
Dr. Ni Luh Ayu Sumbia Indriani Sp.A,Sp. Anak,halodoc,"Setiabudi, Jakarta Selatan",2025-05-22 16:53:03
dr Ni Luh Made Diah Wulandari Sp. A,Sp. Anak,KLINIK NURJAYA,"Mengwi, Kabupaten Badung",2025-05-22 16:53:03
"Dr. Ni Putu Aniek Mahayani M.Si.Med, Sp.A",Sp. Anak,halodoc,"Setiabudi, Jakarta Selatan",2025-05-22 16:53:03
Dr. Ni Putu Indah Kusumadewi Riandra Sp.A,Sp. Anak,halodoc,"Setiabudi, Jakarta Selatan",2025-05-22 16:53:03
Dr. Nicholas Hartanto Prawoto Sp.A,Sp. Anak,halodoc,"Setiabudi, Jakarta Selatan",2025-05-22 16:53:03
dr. Nieken Susanti SpA. M.Biomed,Sp. Anak," Dr. Nieken Susanti, Sp.A, M.Biomed","Kediri Kota, Kota Kediri",2025-05-22 16:53:03
dr. Nieken Susanti Sp. A,Sp. Anak,KIMIA FARMA MOJOROTO,"Mojoroto, Kota Kediri",2025-05-22 16:53:03
Dr. Nike Dewi Anggraini Sp A,Sp. Anak,BWCC Bekasi,"Bekasi Selatan, Bekasi",2025-05-22 16:53:03
"Dr. Niken Iswarajati MSc, Sp.A",Sp. Anak,halodoc,"Setiabudi, Jakarta Selatan",2025-05-22 16:53:03
Dr. Nilasari Udiantara Sp. A,Sp. Anak,"dr, Nilasari, SpA","Penjaringan, Jakarta Utara",2025-05-22 16:53:03
Dr. Nilasari Udiantara Sp.A,Sp. Anak,dr. Nilasari Udiantara SpA,"Sukawangi, Kabupaten Bekasi",2025-05-22 16:53:05
Dr. Nina L. M.sc. Sp.A,Sp. Anak,APOTEK GRAHA INTERNA,"Sidorejo, Kota Salatiga",2025-05-22 16:53:05
"dr. Nina Natalia, Sp.A",Sp. Anak,Siloam Hospitals Balikpapan,"Balikpapan Selatan, Kota Balikpapan",2025-05-22 16:53:05
dr. Ninny M. Pelupessy (Unil) Sp.A,Sp. Anak,Klinik Efbifor,"Panakkukang, Kota Makassar",2025-05-22 16:53:05
"Dr. Nirmalia Husin M.Ked(Ped), Sp.A",Sp. Anak,halodoc,"Setiabudi, Jakarta Selatan",2025-05-22 16:53:05
dr Nita Ratna Dewanti Sp A,Sp. Anak,0,"Bekasi Selatan, Bekasi",2025-05-22 16:53:05
Dr. Noldy Octovianus Sp.A,Sp. Anak,halodoc,"Setiabudi, Jakarta Selatan",2025-05-22 16:53:05
dr. Noor Widiastuti SpA,Sp. Anak,dr. Suwandy Hermanto Bun,"Cengkareng, Jakarta Barat",2025-05-22 16:53:05
dr. Novita Dewi Sp. A,Sp. Anak,halodoc,"Setiabudi, Jakarta Selatan",2025-05-22 16:53:05
"dr. Novita Donnawati Damanik, Sp.A",Sp. Anak,Rumah Sakit Umum Wijayakusuma,"Kebumen, Kabupaten Kebumen",2025-05-22 16:53:05
"dr. Nunki Andria, Sp.A",Sp. Anak,Rumah Vaksinasi Ciledug,"Ciledug, Tangerang",2025-05-22 16:53:08
"Dr. Nur Hidayati Azhar Sp.A, M.Biomed",Sp. Anak,halodoc,"Setiabudi, Jakarta Selatan",2025-05-22 16:53:08
Dr. Nurhidayah Sp.A,Sp. Anak,halodoc,"Setiabudi, Jakarta Selatan",2025-05-22 16:53:08
dr. Nurhidayat Sp.A,Sp. Anak,APOTEK LIDO,"Koja, Jakarta Utara",2025-05-22 16:53:08
