name,speciality,hospital,city,timestamp
dr. Adrian W. Tarigan Sp.OT,Sp. Orthopaedi & Traumatologi,RS Jakarta,"Setiabudi, Jakarta Selatan",2025-05-23 15:58:36
"dr. Adrianto Prasetya Perbowo, Sp.OT",Sp. Orthopaedi & Traumatologi,RS Mitra Keluarga Pondok Tjandra,"Waru, Kabupaten Sidoarjo",2025-05-23 15:58:36
"dr. Albertus Djarot Noersasongko, Sp.OT",Sp. Orthopaedi & Traumatologi,Siloam Hospitals Manado,"Wenang, Kota Manado",2025-05-23 15:58:36
"dr. Alvin Danio Harta Da Costa, Sp.OT (K) Sport",Sp. Orthopaedi & Traumatologi,RS Immanuel,"Bojongloa Kidul, Kota Bandung",2025-05-23 15:58:36
"dr. Andi Bahauddin Fahmi, Sp.OT","Sp. Orthopaedi & Traumatologi, Dokter Bedah",RS Mitra Keluarga Waru,"Waru, Kabupaten Sidoarjo",2025-05-23 15:58:36
"Dr. dr. Andjar Bhawono , Sp.OT",Sp. Orthopaedi & Traumatologi,RS Mitra Keluarga Cibubur,"Jatisampurna, Bekasi",2025-05-23 15:58:36
"dr. Andre Chandra Parluhutan Sihombing, Sp.OT","Sp. Orthopaedi & Traumatologi, Dokter Bedah",RS Mitra Keluarga Bekasi Timur,"Bekasi Timur, Bekasi",2025-05-23 15:58:36
"dr. Andre Triadi Desnantyo, Sp.OT (K)",Sp. Orthopaedi & Traumatologi,RS Mitra Keluarga Kenjeran,"Mulyorejo, Kota Surabaya",2025-05-23 15:58:36
"dr. Andre Triadi Desnantyo, Sp.OT(K)",Sp. Orthopaedi & Traumatologi,Mayapada Hospital Surabaya,"Sawahan, Kota Surabaya",2025-05-23 15:58:36
"dr. Andriandi, Sp.OT","Sp. Orthopaedi & Traumatologi, Dokter Bedah",Siloam Hospitals Dhirga Surya Medan,"Medan Petisah, Kota Medan",2025-05-23 15:58:36
dr. Anita Kurnianti Sp.OT,Sp. Orthopaedi & Traumatologi,RS Mitra Keluarga Kalideres,"Kalideres, Jakarta Barat",2025-05-23 15:58:43
"dr. Anita Kurniawan , Sp.OT",Sp. Orthopaedi & Traumatologi,RS Mitra Keluarga Kalideres,"Kalideres, Jakarta Barat",2025-05-23 15:58:43
"dr. Ardi Setiawan, Sp.OT","Sp. Orthopaedi & Traumatologi, Dokter Bedah",Siloam Hospitals TB Simatupang,"Cilandak, Jakarta Selatan",2025-05-23 15:58:43
"dr. Arnold Darmawan Thioritz, Sp.OT","Sp. Orthopaedi & Traumatologi, Dokter Bedah",RS Mitra Keluarga Gading Serpong,"Pagedangan, Kabupaten Tangerang",2025-05-23 15:58:43
"dr. Aryo Nugroho Triyudanto, Sp.OT","Sp. Orthopaedi & Traumatologi, Dokter Bedah",RS Mitra Keluarga Kalideres,"Kalideres, Jakarta Barat",2025-05-23 15:58:43
"dr. Bambang Nugroho, Sp.OT (K)","Sp. Orthopaedi & Traumatologi, Dokter Bedah",Mayapada Hospital Jakarta Selatan,"Cilandak, Jakarta Selatan",2025-05-23 15:58:43
"Dr. Bayu Antara Hadi, M.Ked, Klin SpOT",Sp. Orthopaedi & Traumatologi,Mandaya Hospital Karawang,"Telukjambe Timur, Kabupaten Karawang",2025-05-23 15:58:43
"dr. Benny, Sp.OT",Sp. Orthopaedi & Traumatologi,Siloam Hospitals Dhirga Surya Medan,"Medan Petisah, Kota Medan",2025-05-23 15:58:43
"dr. Benyamin Parsaoran Simatupang, Sp.OT",Sp. Orthopaedi & Traumatologi,RS Immanuel,"Bojongloa Kidul, Kota Bandung",2025-05-23 15:58:43
"dr. Carles Siagian, Sp.OT (K)","Sp. Orthopaedi & Traumatologi, Dokter Bedah",Siloam Hospitals Kebon Jeruk,"Kebon Jeruk, Jakarta Barat",2025-05-23 15:58:43
"dr. Cokorda Gde Oka Darmayuda, Sp.OT",Sp. Orthopaedi & Traumatologi,BIMC Hospitals Kuta,"Kuta, Kabupaten Badung",2025-05-23 15:58:48
"DR. dr.Edi Mustamsir, Sp.OT (K)",Sp. Orthopaedi & Traumatologi,Persada Hospital,"Blimbing, Kota Malang",2025-05-23 15:58:48
"dr. Daly Hanafiah, Sp.OT(K)",Sp. Orthopaedi & Traumatologi,RS Khusus Bedah Halmahera Siaga,"Bandung Wetan, Kota Bandung",2025-05-23 15:58:48
"dr. Damiarta, Sp.OT","Sp. Orthopaedi & Traumatologi, Dokter Bedah",Mayapada Hospital Kuningan,"Setiabudi, Jakarta Selatan",2025-05-23 15:58:48
"dr. Danang Diandaru, Sp.OT","Sp. Orthopaedi & Traumatologi, Dokter Bedah",RS Mitra Keluarga Waru,"Waru, Kabupaten Sidoarjo",2025-05-23 15:58:48
"dr. Daniel Petrus Marpaung, Sp.OT (K)","Sp. Orthopaedi & Traumatologi, Dokter Bedah",Siloam Hospitals Kebon Jeruk,"Kebon Jeruk, Jakarta Barat",2025-05-23 15:58:48
"dr. Demy Faheem Dasril, Sp.OT",Sp. Orthopaedi & Traumatologi,Mayapada Hospital Kuningan,"Setiabudi, Jakarta Selatan",2025-05-23 15:58:48
"dr. Deri Mulyadi, Sp.OT., M.Kes","Sp. Orthopaedi & Traumatologi, Dokter Bedah",Siloam Hospitals Jambi,"Jambi Selatan, Kota Jambi",2025-05-23 15:58:48
"dr. Dimas Radithya Boedijono, Sp.OT (K)","Sp. Orthopaedi & Traumatologi, Dokter Bedah",Mayapada Hospital Jakarta Selatan,"Cilandak, Jakarta Selatan",2025-05-23 15:58:48
"dr. Djuniper Hasudungan Sagala, Sp.OT (K)","Sp. Orthopaedi & Traumatologi, Dokter Bedah",Siloam Hospitals Palangka Raya,"Pahandut, Kota Palangka Raya",2025-05-23 15:58:48
"dr. Donny Bastian, Sp.OT","Sp. Orthopaedi & Traumatologi, Dokter Bedah",Siloam Hospitals Palangka Raya,"Pahandut, Kota Palangka Raya",2025-05-23 15:58:51
Dr Chee Chia Shing,Sp. Orthopaedi & Traumatologi,Sunway Medical Centre,"Mampang Prapatan, Jakarta Selatan",2025-05-23 15:58:51
"Dr L. Andre Pontoh, Dr. dr. Sp. OT. (K)",Sp. Orthopaedi & Traumatologi,RS Pondok Indah - Pondok Indah,"Kebayoran Lama, Jakarta Selatan",2025-05-23 15:58:51
Dr Lee Keat Hwa,Sp. Orthopaedi & Traumatologi,Island Hospital Penang,"Mampang Prapatan, Jakarta Selatan",2025-05-23 15:58:51
Dr Ng Khai oon,Sp. Orthopaedi & Traumatologi,Island Hospital Penang,"Mampang Prapatan, Jakarta Selatan",2025-05-23 15:58:51
Dr. Sherly Sp.OT,Sp. Orthopaedi & Traumatologi,Bogor Senior Hospital,"Bogor Selatan, Bogor",2025-05-23 15:58:51
"dr. Dwi Purnomo Setyo Budi, Sp.OT (K)",Sp. Orthopaedi & Traumatologi,Siloam Hospitals ASRI,"Pancoran, Jakarta Selatan",2025-05-23 15:58:51
"dr. Edwin William Thioritz, Sp.OT","Sp. Orthopaedi & Traumatologi, Dokter Bedah",RS Mitra Keluarga Gading Serpong,"Pagedangan, Kabupaten Tangerang",2025-05-23 15:58:51
"dr. Erick Wonggokusuma, Sp.OT (K)",Sp. Orthopaedi & Traumatologi,Siloam Hospitals Kebon Jeruk,"Kebon Jeruk, Jakarta Barat",2025-05-23 15:58:51
"dr. Erwin Ramawan, Sp.OT (K) Hand., FCIS","Sp. Orthopaedi & Traumatologi, Dokter Bedah",RS Mitra Keluarga Surabaya,"Sukomanunggal, Kota Surabaya",2025-05-23 15:58:51
"dr. Ery Satriawan, SpOT",Sp. Orthopaedi & Traumatologi,RS Panti Nirmala,"Kedungkandang, Kota Malang",2025-05-23 15:58:58
"dr. Fachrisal Ipang, Sp.OT (K) Spine","Sp. Orthopaedi & Traumatologi, Dokter Bedah",RS Mitra Keluarga Kemayoran,"Kemayoran, Jakarta Pusat",2025-05-23 15:58:58
"dr. Fadli Yogi Arif, M.Ked (Surg), Sp.OT",Sp. Orthopaedi & Traumatologi,RS Mitra Keluarga Tegal,"Tegal Barat, Kota Tegal",2025-05-23 15:58:58
"dr. Fathurrahman, Sp.OT","Sp. Orthopaedi & Traumatologi, Dokter Bedah",Siloam Hospitals Purwakarta,"Bungursari, Kabupaten Purwakarta",2025-05-23 15:58:58
"dr. Febrian Brahmana, Sp.OT","Sp. Orthopaedi & Traumatologi, Dokter Bedah",RS Mitra Keluarga Pondok Tjandra,"Waru, Kabupaten Sidoarjo",2025-05-23 15:58:58
"dr. Fidelis Heru Wicaksono, Sp.OT",Sp. Orthopaedi & Traumatologi,Siloam Hospitals Bogor,"Bogor Tengah, Bogor",2025-05-23 15:58:58
"Dr. dr. Franky Hartono, Sp. OT(K)",Sp. Orthopaedi & Traumatologi,Siloam Hospitals Kebon Jeruk,"Kebon Jeruk, Jakarta Barat",2025-05-23 15:58:58
"dr. Gerald Wonggokusuma, Sp.OT",Sp. Orthopaedi & Traumatologi,Siloam Hospitals Mampang,"Pancoran, Jakarta Selatan",2025-05-23 15:58:58
"dr. Gestana Retaha Wardana, Sp.OT","Sp. Orthopaedi & Traumatologi, Dokter Bedah",RS Mitra Keluarga Gading Serpong,"Pagedangan, Kabupaten Tangerang",2025-05-23 15:58:58
dr Happy Chandra Waskita Sp. OT,Sp. Orthopaedi & Traumatologi,Mandaya Hospital Karawang,"Telukjambe Timur, Kabupaten Karawang",2025-05-23 15:58:58
"dr. Husnul Fuad Albar, Sp.OT",Sp. Orthopaedi & Traumatologi,Siloam Hospitals Dhirga Surya Medan,"Medan Petisah, Kota Medan",2025-05-23 15:59:06
"dr. I G.B.I. Angganugraha P.J., Sp.OT",Sp. Orthopaedi & Traumatologi,Siloam Hospitals Jember,"Kaliwates, Kabupaten Jember",2025-05-23 15:59:06
"dr. I Gusti Made Febry Siswanto, Sp.OT",Sp. Orthopaedi & Traumatologi,RS Mitra Keluarga Cibubur,"Jatisampurna, Bekasi",2025-05-23 15:59:06
"dr. I Gusti Ngurah Wien Aryana, Sp.OT (K)",Sp. Orthopaedi & Traumatologi,BIMC Hospitals Kuta,"Kuta, Kabupaten Badung",2025-05-23 15:59:06
"dr. I Komang Agus Krisna Saputra, Sp.OT","Sp. Orthopaedi & Traumatologi, Dokter Bedah",BIMC Hospitals Nusa Dua,"Kuta Selatan, Kabupaten Badung",2025-05-23 15:59:06
"dr. I Made Artana, M.Biomed, Sp.OT (K)","Sp. Orthopaedi & Traumatologi, Dokter Bedah",Siloam Hospitals Mataram,"Mataram, Kota Mataram",2025-05-23 15:59:06
"dr. I Wayan Murjana, Sp.OT","Sp. Orthopaedi & Traumatologi, Dokter Bedah",BIMC Hospitals Nusa Dua,"Kuta Selatan, Kabupaten Badung",2025-05-23 15:59:06
"dr. IGBA Juniantara, SpOT.,MARS","Sp. Orthopaedi & Traumatologi, Dokter Bedah",Mayapada Hospital Bogor,"Bogor Timur, Bogor",2025-05-23 15:59:06
"dr. Ida Ayu Ratna Dewi Arrisna Artha, Sp.OT (K)",Sp. Orthopaedi & Traumatologi,Siloam Hospitals Denpasar,"Kuta, Kabupaten Badung",2025-05-23 15:59:06
"dr. Ihsan Oesman, Sp.OT (K) Foot & Ankle",Sp. Orthopaedi & Traumatologi,MRCCC Siloam Hospitals Semanggi,"Setiabudi, Jakarta Selatan",2025-05-23 15:59:06
"dr. Immanuel Panca Sitorus, SpOT (K) Hip & Knee",Sp. Orthopaedi & Traumatologi,RS Mitra Keluarga Depok,"Pancoran Mas, Depok",2025-05-23 15:59:08
"dr. Irwan Yusuf, Sp.OT",Sp. Orthopaedi & Traumatologi,Siloam Hospitals Bekasi Sepanjang Jaya,"Rawalumbu, Bekasi",2025-05-23 15:59:08
dr. Januar Chrisant Fladimir Sp.OT,Sp. Orthopaedi & Traumatologi,RS Melati Tangerang,"Karawaci, Tangerang",2025-05-23 15:59:08
"Dr. dr. John Christian Parsaoran Butar Butar, Sp.OT (K)",Sp. Orthopaedi & Traumatologi,Siloam Hospitals Lippo Village,"Kelapa Dua, Kabupaten Tangerang",2025-05-23 15:59:08
"dr. Juliando, Sp.OT",Sp. Orthopaedi & Traumatologi,RS Mitra Keluarga Grand Wisata,"Tambun Selatan, Kabupaten Bekasi",2025-05-23 15:59:08
"dr. Karina Evyline Margaret Besinga, Sp.OT (K)",Sp. Orthopaedi & Traumatologi,Siloam Hospitals Kebon Jeruk,"Kebon Jeruk, Jakarta Barat",2025-05-23 15:59:08
"dr. Karuniawan Purwantono, Sp.OT","Sp. Orthopaedi & Traumatologi, Dokter Bedah",RS Mitra Keluarga Kelapa Gading,"Kelapa Gading, Jakarta Utara",2025-05-23 15:59:08
"dr. Kerwin Halim, Sp.OT",Sp. Orthopaedi & Traumatologi,Siloam Hospitals Kelapa Dua,"Kelapa Dua, Kabupaten Tangerang",2025-05-23 15:59:08
"dr. Langga Sintong, Sp.OT (K)",Sp. Orthopaedi & Traumatologi,Siloam Hospitals Kebon Jeruk,"Kebon Jeruk, Jakarta Barat",2025-05-23 15:59:08
"dr. Lia Marliana, Sp.OT","Sp. Orthopaedi & Traumatologi, Dokter Bedah",RS Mitra Keluarga Cibubur,"Jatisampurna, Bekasi",2025-05-23 15:59:08
dr. M. Sadabaskara Sp OT,Sp. Orthopaedi & Traumatologi,MRCCC Siloam Hospitals Semanggi,"Setiabudi, Jakarta Selatan",2025-05-23 15:59:10
"dr. Made Bramantya Karna, Sp.OT",Sp. Orthopaedi & Traumatologi,BIMC Hospitals Kuta,"Kuta, Kabupaten Badung",2025-05-23 15:59:10
"dr. Made Wirabhawa, M.Biomed, Sp.OT",Sp. Orthopaedi & Traumatologi,Mayapada Hospital Bogor,"Bogor Timur, Bogor",2025-05-23 15:59:10
"dr. Margaretta Silvia Yolanda, Sp.OT",Sp. Orthopaedi & Traumatologi,RS Mitra Keluarga Bintaro,"Pondok Aren, Tangerang Selatan",2025-05-23 15:59:10
"dr. Maruli Oloan Tua, Sp.OT",Sp. Orthopaedi & Traumatologi,RS Mitra Keluarga Delta Mas,"Cikarang Pusat, Kabupaten Bekasi",2025-05-23 15:59:10
"Dr. Maruli Oloan Tua, M.Kes Sp.OT",Sp. Orthopaedi & Traumatologi,RS Permata Keluarga Karawang,"Telukjambe Timur, Kabupaten Karawang",2025-05-23 15:59:10
"dr. Marvin Pilli, Sp.OT",Sp. Orthopaedi & Traumatologi,Mayapada Hospital Kuningan,"Setiabudi, Jakarta Selatan",2025-05-23 15:59:10
"dr. Meirizal, Sp.OT","Sp. Orthopaedi & Traumatologi, Dokter Bedah",Siloam Hospitals Yogyakarta,"Gondokusuman, Kota Yogyakarta",2025-05-23 15:59:10
dr. Mirna Phandu Sp.OT,Sp. Orthopaedi & Traumatologi,Siloam Hospitals Lippo Village,"Kelapa Dua, Kabupaten Tangerang",2025-05-23 15:59:10
"dr. Mirna Phandu, Sp.OT",Sp. Orthopaedi & Traumatologi,Siloam Hospitals Lippo Village,"Kelapa Dua, Kabupaten Tangerang",2025-05-23 15:59:10
"dr. Mochamad Sadabaskara, Sp.OT (K)",Sp. Orthopaedi & Traumatologi,Siloam Hospitals TB Simatupang,"Cilandak, Jakarta Selatan",2025-05-23 15:59:12
dr. Much Sofwan Sp.OT (K),Sp. Orthopaedi & Traumatologi,RS Mitra Keluarga Cibubur,"Jatisampurna, Bekasi",2025-05-23 15:59:12
dr. Muki Partono Sp.OT,Sp. Orthopaedi & Traumatologi,RS Jakarta,"Setiabudi, Jakarta Selatan",2025-05-23 15:59:12
"dr. Naharudin I., Sp.OT., M.Kes",Sp. Orthopaedi & Traumatologi,RS Mitra Keluarga Tegal,"Tegal Barat, Kota Tegal",2025-05-23 15:59:12
"dr. Nario Gunawan, Sp.OT","Sp. Orthopaedi & Traumatologi, Dokter Bedah",RS Mitra Keluarga Surabaya,"Sukomanunggal, Kota Surabaya",2025-05-23 15:59:12
dr. Nia Irayati Sp.OT,Sp. Orthopaedi & Traumatologi,Siloam Hospitals ASRI,"Pancoran, Jakarta Selatan",2025-05-23 15:59:12
"Dr. dr. Norman Zainal, Sp.OT, M.Kes, CCD, FICS",Sp. Orthopaedi & Traumatologi,Siloam Hospitals Agora,"Cempaka Putih, Jakarta Pusat",2025-05-23 15:59:12
"dr. Notinas Horas, Sp.OT",Sp. Orthopaedi & Traumatologi,Siloam Hospitals Makassar,"Ujung Pandang, Kota Makassar",2025-05-23 15:59:12
"dr. Nur Flora Nita TB Sinaga, Sp.OT",Sp. Orthopaedi & Traumatologi,RS Mitra Keluarga Waru,"Waru, Kabupaten Sidoarjo",2025-05-23 15:59:12
"dr. Nurjaya Yudya Agni, Sp.OT",Sp. Orthopaedi & Traumatologi,Mayapada Hospital Bogor,"Bogor Timur, Bogor",2025-05-23 15:59:12
"dr. Oryza Satria, Sp.OT (K)","Sp. Orthopaedi & Traumatologi, Dokter Bedah",Mayapada Hospital Jakarta Selatan,"Cilandak, Jakarta Selatan",2025-05-23 15:59:14
"dr. Peterson Sidabutar, Sp.OT",Sp. Orthopaedi & Traumatologi,Siloam Hospitals Bogor,"Bogor Tengah, Bogor",2025-05-23 15:59:14
dr. Poeranto Hari Nugroho SpOT,Sp. Orthopaedi & Traumatologi,Siloam Hospitals Lippo Cikarang,"Cikarang Selatan, Kabupaten Bekasi",2025-05-23 15:59:14
"dr. Poetranto Hari Nugroho, Sp.OT",Sp. Orthopaedi & Traumatologi,Siloam Hospitals Lippo Cikarang,"Cikarang Selatan, Kabupaten Bekasi",2025-05-23 15:59:14
"dr. Posma Simandjuntak, Sp.B, Sp.BO",Sp. Orthopaedi & Traumatologi,RS Immanuel,"Bojongloa Kidul, Kota Bandung",2025-05-23 15:59:14
"dr. Pradhana Wijayanta, Sp.OT","Sp. Orthopaedi & Traumatologi, Dokter Bedah",Mayapada Hospital Tangerang,"Tangerang, Tangerang",2025-05-23 15:59:14
"dr. Pramono Ari Wibowo, Sp.OT",Sp. Orthopaedi & Traumatologi,RS Mitra Keluarga Kenjeran,"Mulyorejo, Kota Surabaya",2025-05-23 15:59:14
"dr. Primadika Rubiansyah, Sp.OT",Sp. Orthopaedi & Traumatologi,Siloam Hospitals Sriwijaya Palembang,"Ilir Barat I, Kota Palembang",2025-05-23 15:59:14
"dr. Putu Bagus Didiet Khresna Wibawa, Sp.OT","Sp. Orthopaedi & Traumatologi, Dokter Bedah",Mayapada Hospital Kuningan,"Setiabudi, Jakarta Selatan",2025-05-23 15:59:14
"dr. Putut Sugiantoro Sp OT, K",Sp. Orthopaedi & Traumatologi,Siloam Hospitals Lippo Village,"Kelapa Dua, Kabupaten Tangerang",2025-05-23 15:59:14
"dr. Putut Sugiantoro, Sp.OT (K)",Sp. Orthopaedi & Traumatologi,Siloam Hospitals Lippo Village,"Kelapa Dua, Kabupaten Tangerang",2025-05-23 15:59:16
"dr. Putut Sugiantoro, Sp.OT.K K",Sp. Orthopaedi & Traumatologi,Siloam Hospitals Lippo Village,"Kelapa Dua, Kabupaten Tangerang",2025-05-23 15:59:16
"R. Permana Yudhadibrata, Sp.OT",Sp. Orthopaedi & Traumatologi,RS Setiabudi,"Medan Sunggal, Kota Medan",2025-05-23 15:59:16
"dr. R. Rahendra Pratama , Sp.OT (K)",Sp. Orthopaedi & Traumatologi,RS Mitra Keluarga Kalideres,"Kalideres, Jakarta Barat",2025-05-23 15:59:16
"dr. Rady Dwipayana, M.Kes, Sp.OT",Sp. Orthopaedi & Traumatologi,Siloam Hospitals Surabaya,"Gubeng, Kota Surabaya",2025-05-23 15:59:16
dr. Randy Presly Octavianus Sp OT,Sp. Orthopaedi & Traumatologi,Siloam Hospitals Semarang,"Semarang Selatan, Kota Semarang",2025-05-23 15:59:16
"dr. Randy Presly Octavianus, Sp.OT",Sp. Orthopaedi & Traumatologi,Siloam Hospitals Semarang,"Semarang Selatan, Kota Semarang",2025-05-23 15:59:16
dr. Rendy Cahya Soetanto Sp. OT,Sp. Orthopaedi & Traumatologi,Mayapada Hospital Bandung,"Bandung Kidul, Kota Bandung",2025-05-23 15:59:16
"dr. Reyner Valiant Tumbelaka, M.Ked.Klien., Sp.OT","Sp. Orthopaedi & Traumatologi, Dokter Bedah",Mayapada Hospital Surabaya,"Sawahan, Kota Surabaya",2025-05-23 15:59:16
"dr. Ricky Wibowo, Sp.OT",Sp. Orthopaedi & Traumatologi,Siloam Hospitals Sriwijaya Palembang,"Ilir Barat I, Kota Palembang",2025-05-23 15:59:16
"dr. Riky Febriansyah Saleh, Sp.OT",Sp. Orthopaedi & Traumatologi,Siloam Hospitals Mampang,"Pancoran, Jakarta Selatan",2025-05-23 15:59:19
Rizki Hidayat Sp.OT,Sp. Orthopaedi & Traumatologi,RS Keluarga Sehat Pati,"Margorejo, Pati",2025-05-23 15:59:19
dr. Robert Manahan Sp.OT,Sp. Orthopaedi & Traumatologi,Rspad Gatot Subroto (Paviliun),"Senen, Jakarta Pusat",2025-05-23 15:59:19
"dr. Robert Martua, Sp.OT",Sp. Orthopaedi & Traumatologi,Siloam Hospitals Purwakarta,"Bungursari, Kabupaten Purwakarta",2025-05-23 15:59:19
Dr. Rollando Erric Manibuy sp OT,Sp. Orthopaedi & Traumatologi,RS Vania,"Bogor Timur, Bogor",2025-05-23 15:59:19
"dr. Rudi Febrianto, Sp.OT",Sp. Orthopaedi & Traumatologi,Siloam Hospitals Mataram,"Mataram, Kota Mataram",2025-05-23 15:59:19
"dr. Safrinal Sofian, Sp.OT",Sp. Orthopaedi & Traumatologi,Klinik Utama Bidakara Medical Center & Apotek Farmarin Bidakara,"Tebet, Jakarta Selatan",2025-05-23 15:59:19
"dr. Samuel Jason Rolando T., Sp.OT",Sp. Orthopaedi & Traumatologi,RS Immanuel,"Bojongloa Kidul, Kota Bandung",2025-05-23 15:59:19
dr. Satria Prawira Putra Sp.OT (K),Sp. Orthopaedi & Traumatologi,RS Mitra Keluarga Bekasi Timur,"Bekasi Timur, Bekasi",2025-05-23 15:59:19
"dr. Sigit Wedhanto, Sp.OT","Sp. Orthopaedi & Traumatologi, Dokter Bedah",Mayapada Hospital Jakarta Selatan,"Cilandak, Jakarta Selatan",2025-05-23 15:59:19
"dr. Soegiarto Soerodjojo, Sp.OT",Sp. Orthopaedi & Traumatologi,Siloam Hospitals Sriwijaya Palembang,"Ilir Barat I, Kota Palembang",2025-05-23 15:59:21
"dr. Stephanus Hendrata Darmadi, Sp.OT., M.Kes","Sp. Orthopaedi & Traumatologi, Dokter Bedah",Siloam Hospitals Surabaya,"Gubeng, Kota Surabaya",2025-05-23 15:59:21
"dr. Sumpada Priambudi, Sp.OT","Sp. Orthopaedi & Traumatologi, Dokter Bedah",Mayapada Hospital Jakarta Selatan,"Cilandak, Jakarta Selatan",2025-05-23 15:59:21
"dr. Sunaryo Kusumo, Sp.OT (K) Hip., M.Kes","Sp. Orthopaedi & Traumatologi, Dokter Bedah",Mayapada Hospital Jakarta Selatan,"Cilandak, Jakarta Selatan",2025-05-23 15:59:21
"dr. Syaiful Hadi, Sp.OT","Sp. Orthopaedi & Traumatologi, Dokter Bedah",RS Mitra Keluarga Depok,"Pancoran Mas, Depok",2025-05-23 15:59:21
"dr. Taufin Warindra, Sp.OT","Sp. Orthopaedi & Traumatologi, Dokter Bedah",RS Mitra Keluarga Surabaya,"Sukomanunggal, Kota Surabaya",2025-05-23 15:59:21
"dr. Teddy Heri Wardhana, Sp.OT","Sp. Orthopaedi & Traumatologi, Dokter Bedah",Siloam Hospitals Surabaya,"Gubeng, Kota Surabaya",2025-05-23 15:59:21
"dr. Theri Effendi, Sp.OT (K) Hand",Sp. Orthopaedi & Traumatologi,RS Orthopedi & Traumatologi Surabaya,"Lakarsantri, Kota Surabaya",2025-05-23 15:59:21
"dr. Tito Sulaksito, Sp.B, Sp.OT, FICS",Sp. Orthopaedi & Traumatologi,RS Mitra Keluarga Bekasi,"Bekasi Selatan, Bekasi",2025-05-23 15:59:21
"dr. Triarto Budi Susanto, Sp.OT","Sp. Orthopaedi & Traumatologi, Dokter Bedah",RS Mitra Keluarga Waru,"Waru, Kabupaten Sidoarjo",2025-05-23 15:59:21
"dr. Trimanto Wibowo, Sp.OT",Sp. Orthopaedi & Traumatologi,RSU Syubbanul Wathon,"Pakis, Kabupaten Magelang",2025-05-23 15:59:23
"dr. Troydimas Panjaitan, Sp.OT","Sp. Orthopaedi & Traumatologi, Dokter Bedah",RS Mitra Keluarga Kelapa Gading,"Kelapa Gading, Jakarta Utara",2025-05-23 15:59:23
"dr. Wahyu Eko Widiharso, Sp.OT","Sp. Orthopaedi & Traumatologi, Dokter Bedah",RS Bina Husada,"Cibinong, Kabupaten Bogor",2025-05-23 15:59:23
"dr. Wibisono, Sp.OT",Sp. Orthopaedi & Traumatologi,Siloam Hospitals Lippo Village,"Kelapa Dua, Kabupaten Tangerang",2025-05-23 15:59:23
"dr. Widiyatmiko Arifin Putro, Sp.OT",Sp. Orthopaedi & Traumatologi,Siloam Hospitals Putera Bahagia Cirebon,"Harjamukti, Kota Cirebon",2025-05-23 15:59:23
"dr. Widya Arsa, Sp.OT","Sp. Orthopaedi & Traumatologi, Dokter Bedah",Siloam Hospitals Purwakarta,"Bungursari, Kabupaten Purwakarta",2025-05-23 15:59:23
dr. Widyastuti Sp.OT,Sp. Orthopaedi & Traumatologi,RS Pondok Indah - Pondok Indah,"Kebayoran Lama, Jakarta Selatan",2025-05-23 15:59:23
"dr. Widyastuti Srie Utami, Sp.OT",Sp. Orthopaedi & Traumatologi,Siloam Hospitals TB Simatupang,"Cilandak, Jakarta Selatan",2025-05-23 15:59:23
"dr. Wirindro Wisnubroto, Sp.OT",Sp. Orthopaedi & Traumatologi,RS Mitra Keluarga Kenjeran,"Mulyorejo, Kota Surabaya",2025-05-23 15:59:23
"dr. Yanuar Cahyadarma, Sp.OT",Sp. Orthopaedi & Traumatologi,RS Mitra Keluarga Pondok Tjandra,"Waru, Kabupaten Sidoarjo",2025-05-23 15:59:23
"dr. Yudistira Parulian Siregar, Sp.OT",Sp. Orthopaedi & Traumatologi,MRCCC Siloam Hospitals Semanggi,"Setiabudi, Jakarta Selatan",2025-05-23 15:59:25
"dr. Yudistira Prama Tirta, Sp.OT","Sp. Orthopaedi & Traumatologi, Dokter Bedah",Mayapada Hospital Tangerang,"Tangerang, Tangerang",2025-05-23 15:59:25
"dr. Yuliana, Sp.OT",Sp. Orthopaedi & Traumatologi,RS Immanuel,"Bojongloa Kidul, Kota Bandung",2025-05-23 15:59:25
dr. ZEN FIRHAN Sp.OT,Sp. Orthopaedi & Traumatologi,RS Orthopedi Siaga Raya,"Pasar Minggu, Jakarta Selatan",2025-05-23 15:59:25
dr. Zuwanda Sp.OT,Sp. Orthopaedi & Traumatologi,Siloam Hospitals Labuan Bajo,"Komodo, Kabupaten Manggarai Barat",2025-05-23 15:59:25
dr Mohamed Ashraff,Sp. Orthopaedi & Traumatologi,Pantai Hospital Kuala Lumpur,"Mampang Prapatan, Jakarta Selatan",2025-05-23 15:59:25
"dr. Adytia Andreyta Refa, Sp.OT",Sp. Orthopaedi & Traumatologi,RS Sentra Medika Cisalak,"Sukmajaya, Depok",2025-05-23 15:59:25
"dr. Alan Philips Kustianto Putra Resubun, Sp.OT",Sp. Orthopaedi & Traumatologi,RSU Bunda Thamrin Medan,"Medan Sunggal, Kota Medan",2025-05-23 15:59:25
"dr. Ardi Setiawan, Sp.OT",Sp. Orthopaedi & Traumatologi,Siloam Hospitals TB Simatupang,"Cilandak, Jakarta Selatan",2025-05-23 15:59:25
"dr. Bayu Antara Hadi, MKed.Klin, Sp.OT",Sp. Orthopaedi & Traumatologi,RS Mitra Keluarga Pamulang,"Pamulang, Tangerang Selatan",2025-05-23 15:59:25
"dr. Charles Hoo, SpOT",Sp. Orthopaedi & Traumatologi,Mayapada Hospital Jakarta Selatan,"Cilandak, Jakarta Selatan",2025-05-23 15:59:27
"dr. Christian Silas, Sp.OT,Subsp.CO",Sp. Orthopaedi & Traumatologi,Siloam Hospitals Kebon Jeruk,"Kebon Jeruk, Jakarta Barat",2025-05-23 15:59:27
"dr. Daniel Petrus Marpaung, Sp.OT(K)",Sp. Orthopaedi & Traumatologi,RS PIK,"Penjaringan, Jakarta Utara",2025-05-23 15:59:27
"dr. Denny Suprapto, SpOT",Sp. Orthopaedi & Traumatologi,RS Budiasih,"Serang, Kota Serang",2025-05-23 15:59:27
"dr. Dicky Mulyadi, Sp.OT",Sp. Orthopaedi & Traumatologi,Santosa Hospital Bandung Central,"Andir, Kota Bandung",2025-05-23 15:59:27
"dr. Erwin Yulianto, Sp. OT (K)",Sp. Orthopaedi & Traumatologi,National Hospital,"Wiyung, Kota Surabaya",2025-05-23 15:59:27
"dr. Gazali Said, Sp.OT ( K ), MARS",Sp. Orthopaedi & Traumatologi,RS Bethsaida,"Kelapa Dua, Kabupaten Tangerang",2025-05-23 15:59:27
dr. Harwant Singh,Sp. Orthopaedi & Traumatologi,Pantai Hospital Kuala Lumpur,"Mampang Prapatan, Jakarta Selatan",2025-05-23 15:59:27
Dr. dr. Heri Suroto Sp.OT.FICS,Sp. Orthopaedi & Traumatologi,RS Adi Husada Undaan Wetan,"Genteng, Kota Surabaya",2025-05-23 15:59:27
dr. Heri Suroto Sp.OT,Sp. Orthopaedi & Traumatologi,RS Katolik St. Vincentius a Paulo (RKZ),"Wonokromo, Kota Surabaya",2025-05-23 15:59:27
"dr. Herwindo Ridwan, Sp.OT",Sp. Orthopaedi & Traumatologi,RS Bethsaida,"Kelapa Dua, Kabupaten Tangerang",2025-05-23 15:59:29
"dr. I Gusti Ngurah Wien Aryana, Sp.OT (K)",Sp. Orthopaedi & Traumatologi,Bali Royal Hospital,"Denpasar Timur, Kota Denpasar",2025-05-23 15:59:29
"dr. Jursal Harun, Sp.OT (K)",Sp. Orthopaedi & Traumatologi,Tzu Chi Hospital,"Penjaringan, Jakarta Utara",2025-05-23 15:59:29
"dr. Kerwin Halim, Sp.OT",Sp. Orthopaedi & Traumatologi,Siloam Hospitals Lippo Village,"Kelapa Dua, Kabupaten Tangerang",2025-05-23 15:59:29
"dr. M. Anggi Montazeri, Sp.OT",Sp. Orthopaedi & Traumatologi,RS Dinda,"Jatiuwung, Tangerang",2025-05-23 15:59:29
"dr. Nico Lie, Sp.OT",Sp. Orthopaedi & Traumatologi,RS Royal Taruma,"Grogol Petamburan, Jakarta Barat",2025-05-23 15:59:29
"dr. Oktavianus, Sp.OT (K) Spine",Sp. Orthopaedi & Traumatologi,RS Mitra Medika Pontianak,"Pontianak Kota, Kota Pontianak",2025-05-23 15:59:29
"dr. Teddy Heri Wardhana, Sp.OT(K)",Sp. Orthopaedi & Traumatologi,Mayapada Hospital Surabaya,"Sawahan, Kota Surabaya",2025-05-23 15:59:29
"dr. Witantra Dhamar, SpOT",Sp. Orthopaedi & Traumatologi,RS Murni Teguh Sudirman Jakarta,"Tanah Abang, Jakarta Pusat",2025-05-23 15:59:29
"dr.Ahmad Ramdan, SP.OT(K)",Sp. Orthopaedi & Traumatologi,RS Melinda 2,"Cicendo, Kota Bandung",2025-05-23 15:59:29
"dr.Handoko, Sp.OT",Sp. Orthopaedi & Traumatologi,RS Satya Negara,"Tanjung Priok, Jakarta Utara",2025-05-23 15:59:31
dr.Ong Kim Pho,Sp. Orthopaedi & Traumatologi,Gleneagles Penang,"Mampang Prapatan, Jakarta Selatan",2025-05-23 15:59:31
dr. Abdul Jamal Mohamed Thalha SpB.OT,Sp. Orthopaedi & Traumatologi,halodoc,"Setiabudi, Jakarta Selatan",2025-05-23 15:59:31
"dr. Adi Aryanto, Sp.OT","Sp. Orthopaedi & Traumatologi, Dokter Bedah",Siloam Hospitals Balikpapan,"Balikpapan Selatan, Kota Balikpapan",2025-05-23 15:59:31
Dr. Adytia Andreyta Refa Sp.OT,Sp. Orthopaedi & Traumatologi,halodoc,"Setiabudi, Jakarta Selatan",2025-05-23 15:59:31
dr. Agus Kresnadi Sp.OT,Sp. Orthopaedi & Traumatologi,RS Ichsan Medical Centre Bintaro,"Ciputat, Tangerang Selatan",2025-05-23 15:59:31
Dr. Akbar Gazali Sp.OT,Sp. Orthopaedi & Traumatologi,halodoc,"Setiabudi, Jakarta Selatan",2025-05-23 15:59:31
"dr. Alvarez Zevanya Moningka, Sp.OT",Sp. Orthopaedi & Traumatologi,Siloam Hospitals Balikpapan,"Balikpapan Selatan, Kota Balikpapan",2025-05-23 15:59:31
dr. Amri Muhyi Sp.OT,Sp. Orthopaedi & Traumatologi,halodoc,"Setiabudi, Jakarta Selatan",2025-05-23 15:59:31
"dr. Andi Hendrawan, SpOT",Sp. Orthopaedi & Traumatologi,Praktek Dokter Spesialis -,"Sawah Besar, Jakarta Pusat",2025-05-23 15:59:31
"dr. Andre Ruggery Ichwan, Sp.OT",Sp. Orthopaedi & Traumatologi,halodoc,"Setiabudi, Jakarta Selatan",2025-05-23 15:59:33
"Dr. Andriessanto Ceelvin Lengkong M.Kes, Sp.OT",Sp. Orthopaedi & Traumatologi,halodoc,"Setiabudi, Jakarta Selatan",2025-05-23 15:59:33
